21:43:28.990981 IP c-71-204-8-40.hsd1.ga.comcast.net.62348 > v1404-wn-172-21-18-151.campus-dynamic.uwaterloo.ca.24874: UDP, length 1426
21:43:28.994051 IP 87-127-36-20.static.enta.net.52619 > v1404-wn-172-21-18-151.campus-dynamic.uwaterloo.ca.63417: Flags [.], seq 3013165600:3013166946, ack 936126512, win 255, options [nop,nop,TS val 88063477 ecr 1339586719], length 1346
21:43:28.998391 IP c-71-204-8-40.hsd1.ga.comcast.net.62348 > v1404-wn-172-21-18-151.campus-dynamic.uwaterloo.ca.24874: UDP, length 1426
21:43:28.998677 IP c-71-204-8-40.hsd1.ga.comcast.net.62348 > v1404-wn-172-21-18-151.campus-dynamic.uwaterloo.ca.24874: UDP, length 1426
21:43:28.999890 IP c-71-204-8-40.hsd1.ga.comcast.net.62348 > v1404-wn-172-21-18-151.campus-dynamic.uwaterloo.ca.24874: UDP, length 1426
21:43:29.002435 IP v1404-wn-172-21-18-151.campus-dynamic.uwaterloo.ca.24874 > c-71-204-8-40.hsd1.ga.comcast.net.62348: UDP, length 20
21:43:29.003229 IP 87-127-36-20.static.enta.net.52619 > v1404-wn-172-21-18-151.campus-dynamic.uwaterloo.ca.63417: Flags [.], seq 1346:2692, ack 1, win 255, options [nop,nop,TS val 88063477 ecr 1339586719], length 1346
21:43:29.003308 IP v1404-wn-172-21-18-151.campus-dynamic.uwaterloo.ca.63417 > 87-127-36-20.static.enta.net.52619: Flags [.], ack 2692, win 58103, options [nop,nop,TS val 1339587188 ecr 88063477], length 0
21:43:29.006420 IP c-71-204-8-40.hsd1.ga.comcast.net.62348 > v1404-wn-172-21-18-151.campus-dynamic.uwaterloo.ca.24874: UDP, length 1426
21:43:29.006683 IP c-71-204-8-40.hsd1.ga.comcast.net.62348 > v1404-wn-172-21-18-151.campus-dynamic.uwaterloo.ca.24874: UDP, length 1426
21:43:29.006771 IP v1404-wn-172-21-18-151.campus-dynamic.uwaterloo.ca.24874 > c-71-204-8-40.hsd1.ga.comcast.net.62348: UDP, length 20
21:43:29.007025 IP c-71-204-8-40.hsd1.ga.comcast.net.62348 > v1404-wn-172-21-18-151.campus-dynamic.uwaterloo.ca.24874: UDP, length 1426
21:43:29.007570 IP c-71-204-8-40.hsd1.ga.comcast.net.62348 > v1404-wn-172-21-18-151.campus-dynamic.uwaterloo.ca.24874: UDP, length 1426
21:43:29.007665 IP v1404-wn-172-21-18-151.campus-dynamic.uwaterloo.ca.24874 > c-71-204-8-40.hsd1.ga.comcast.net.62348: UDP, length 20
21:43:29.007915 IP c-71-204-8-40.hsd1.ga.comcast.net.62348 > v1404-wn-172-21-18-151.campus-dynamic.uwaterloo.ca.24874: UDP, length 1426
21:43:29.016696 IP c-71-204-8-40.hsd1.ga.comcast.net.62348 > v1404-wn-172-21-18-151.campus-dynamic.uwaterloo.ca.24874: UDP, length 1426
21:43:29.016827 IP v1404-wn-172-21-18-151.campus-dynamic.uwaterloo.ca.24874 > c-71-204-8-40.hsd1.ga.comcast.net.62348: UDP, length 20
21:43:29.020073 IP 87-127-36-20.static.enta.net.52619 > v1404-wn-172-21-18-151.campus-dynamic.uwaterloo.ca.63417: Flags [.], seq 2692:4038, ack 1, win 255, options [nop,nop,TS val 88063479 ecr 1339586719], length 1346
21:43:29.027892 IP c-71-204-8-40.hsd1.ga.comcast.net.62348 > v1404-wn-172-21-18-151.campus-dynamic.uwaterloo.ca.24874: UDP, length 1426
21:43:29.028159 IP c-71-204-8-40.hsd1.ga.comcast.net.62348 > v1404-wn-172-21-18-151.campus-dynamic.uwaterloo.ca.24874: UDP, length 1426
21:43:29.028262 IP v1404-wn-172-21-18-151.campus-dynamic.uwaterloo.ca.24874 > c-71-204-8-40.hsd1.ga.comcast.net.62348: UDP, length 20
21:43:29.028413 IP c-71-204-8-40.hsd1.ga.comcast.net.62348 > v1404-wn-172-21-18-151.campus-dynamic.uwaterloo.ca.24874: UDP, length 1426
21:43:29.028502 IP c-71-204-8-40.hsd1.ga.comcast.net.62348 > v1404-wn-172-21-18-151.campus-dynamic.uwaterloo.ca.24874: UDP, length 1426
21:43:29.028603 IP c-71-204-8-40.hsd1.ga.comcast.net.62348 > v1404-wn-172-21-18-151.campus-dynamic.uwaterloo.ca.24874: UDP, length 1426
21:43:29.028614 IP v1404-wn-172-21-18-151.campus-dynamic.uwaterloo.ca.24874 > c-71-204-8-40.hsd1.ga.comcast.net.62348: UDP, length 20
21:43:29.029542 IP 87-127-36-20.static.enta.net.52619 > v1404-wn-172-21-18-151.campus-dynamic.uwaterloo.ca.63417: Flags [.], seq 4038:5384, ack 1, win 255, options [nop,nop,TS val 88063479 ecr 1339586719], length 1346
21:43:29.029592 IP v1404-wn-172-21-18-151.campus-dynamic.uwaterloo.ca.63417 > 87-127-36-20.static.enta.net.52619: Flags [.], ack 5384, win 57935, options [nop,nop,TS val 1339587213 ecr 88063479], length 0
21:43:29.035381 IP c-71-204-8-40.hsd1.ga.comcast.net.62348 > v1404-wn-172-21-18-151.campus-dynamic.uwaterloo.ca.24874: UDP, length 1426
21:43:29.035654 IP c-69-244-105-21.hsd1.nj.comcast.net.15935 > v1404-wn-172-21-18-151.campus-dynamic.uwaterloo.ca.24874: UDP, length 1426
21:43:29.036140 IP c-69-244-105-21.hsd1.nj.comcast.net.15935 > v1404-wn-172-21-18-151.campus-dynamic.uwaterloo.ca.24874: UDP, length 1426
21:43:29.036222 IP v1404-wn-172-21-18-151.campus-dynamic.uwaterloo.ca.24874 > c-71-204-8-40.hsd1.ga.comcast.net.62348: UDP, length 26
21:43:29.036259 IP v1404-wn-172-21-18-151.campus-dynamic.uwaterloo.ca.24874 > c-69-244-105-21.hsd1.nj.comcast.net.15935: UDP, length 20
21:43:29.038542 IP 87-127-36-20.static.enta.net.52619 > v1404-wn-172-21-18-151.campus-dynamic.uwaterloo.ca.63417: Flags [.], seq 5384:6730, ack 1, win 255, options [nop,nop,TS val 88063479 ecr 1339586719], length 1346
21:43:29.061505 IP c-71-204-8-40.hsd1.ga.comcast.net.62348 > v1404-wn-172-21-18-151.campus-dynamic.uwaterloo.ca.24874: UDP, length 1426
21:43:29.069234 IP 87-127-36-20.static.enta.net.52619 > v1404-wn-172-21-18-151.campus-dynamic.uwaterloo.ca.63417: Flags [.], seq 6730:8076, ack 1, win 255, options [nop,nop,TS val 88063484 ecr 1339586719], length 1346
21:43:29.069375 IP v1404-wn-172-21-18-151.campus-dynamic.uwaterloo.ca.63417 > 87-127-36-20.static.enta.net.52619: Flags [.], ack 8076, win 57908, options [nop,nop,TS val 1339587252 ecr 88063479], length 0
21:43:29.078691 IP c-71-204-8-40.hsd1.ga.comcast.net.62348 > v1404-wn-172-21-18-151.campus-dynamic.uwaterloo.ca.24874: UDP, length 1426
21:43:29.078894 IP c-71-204-8-40.hsd1.ga.comcast.net.62348 > v1404-wn-172-21-18-151.campus-dynamic.uwaterloo.ca.24874: UDP, length 1426
21:43:29.079001 IP v1404-wn-172-21-18-151.campus-dynamic.uwaterloo.ca.24874 > c-71-204-8-40.hsd1.ga.comcast.net.62348: UDP, length 26
21:43:29.079533 IP 87-127-36-20.static.enta.net.52619 > v1404-wn-172-21-18-151.campus-dynamic.uwaterloo.ca.63417: Flags [.], seq 8076:9422, ack 1, win 255, options [nop,nop,TS val 88063484 ecr 1339586719], length 1346
21:43:29.083324 IP 87-127-36-20.static.enta.net.52619 > v1404-wn-172-21-18-151.campus-dynamic.uwaterloo.ca.63417: Flags [P.], seq 9422:9912, ack 1, win 255, options [nop,nop,TS val 88063484 ecr 1339586719], length 490
21:43:29.083421 IP v1404-wn-172-21-18-151.campus-dynamic.uwaterloo.ca.63417 > 87-127-36-20.static.enta.net.52619: Flags [.], ack 9912, win 57793, options [nop,nop,TS val 1339587265 ecr 88063484], length 0
21:43:29.105262 IP c-71-204-8-40.hsd1.ga.comcast.net.62348 > v1404-wn-172-21-18-151.campus-dynamic.uwaterloo.ca.24874: UDP, length 1426
21:43:29.105432 IP c-71-204-8-40.hsd1.ga.comcast.net.62348 > v1404-wn-172-21-18-151.campus-dynamic.uwaterloo.ca.24874: UDP, length 1426
21:43:29.108874 IP c-71-204-8-40.hsd1.ga.comcast.net.62348 > v1404-wn-172-21-18-151.campus-dynamic.uwaterloo.ca.24874: UDP, length 1426
21:43:29.109065 IP c-71-204-8-40.hsd1.ga.comcast.net.62348 > v1404-wn-172-21-18-151.campus-dynamic.uwaterloo.ca.24874: UDP, length 1426
21:43:29.109341 IP c-71-204-8-40.hsd1.ga.comcast.net.62348 > v1404-wn-172-21-18-151.campus-dynamic.uwaterloo.ca.24874: UDP, length 1426
21:43:29.109966 IP c-71-204-8-40.hsd1.ga.comcast.net.62348 > v1404-wn-172-21-18-151.campus-dynamic.uwaterloo.ca.24874: UDP, length 1426
21:43:29.110056 IP v1404-wn-172-21-18-151.campus-dynamic.uwaterloo.ca.24874 > c-71-204-8-40.hsd1.ga.comcast.net.62348: UDP, length 26
21:43:29.110272 IP c-71-204-8-40.hsd1.ga.comcast.net.62348 > v1404-wn-172-21-18-151.campus-dynamic.uwaterloo.ca.24874: UDP, length 1426
21:43:29.110867 IP c-71-204-8-40.hsd1.ga.comcast.net.62348 > v1404-wn-172-21-18-151.campus-dynamic.uwaterloo.ca.24874: UDP, length 1426
21:43:29.110963 IP c-71-204-8-40.hsd1.ga.comcast.net.62348 > v1404-wn-172-21-18-151.campus-dynamic.uwaterloo.ca.24874: UDP, length 1426
21:43:29.110972 IP v1404-wn-172-21-18-151.campus-dynamic.uwaterloo.ca.24874 > c-71-204-8-40.hsd1.ga.comcast.net.62348: UDP, length 26
21:43:29.111521 IP c-71-204-8-40.hsd1.ga.comcast.net.62348 > v1404-wn-172-21-18-151.campus-dynamic.uwaterloo.ca.24874: UDP, length 1426
21:43:29.111982 IP c-71-204-8-40.hsd1.ga.comcast.net.62348 > v1404-wn-172-21-18-151.campus-dynamic.uwaterloo.ca.24874: UDP, length 1426
21:43:29.112065 IP v1404-wn-172-21-18-151.campus-dynamic.uwaterloo.ca.24874 > c-71-204-8-40.hsd1.ga.comcast.net.62348: UDP, length 26
21:43:29.117806 IP v1404-wn-172-21-18-151.campus-dynamic.uwaterloo.ca.63425 > 108.160.160.178.https: Flags [P.], seq 1475082150:1475082576, ack 682272266, win 8192, options [nop,nop,TS val 1339587298 ecr 220960080], length 426
21:43:29.123750 IP c-69-244-105-21.hsd1.nj.comcast.net.15935 > v1404-wn-172-21-18-151.campus-dynamic.uwaterloo.ca.24874: UDP, length 1426
21:43:29.123927 IP c-69-244-105-21.hsd1.nj.comcast.net.15935 > v1404-wn-172-21-18-151.campus-dynamic.uwaterloo.ca.24874: UDP, length 1426
21:43:29.124004 IP v1404-wn-172-21-18-151.campus-dynamic.uwaterloo.ca.24874 > c-69-244-105-21.hsd1.nj.comcast.net.15935: UDP, length 20
21:43:29.124186 IP c-69-244-105-21.hsd1.nj.comcast.net.15935 > v1404-wn-172-21-18-151.campus-dynamic.uwaterloo.ca.24874: UDP, length 1426
21:43:29.124697 IP c-69-244-105-21.hsd1.nj.comcast.net.15935 > v1404-wn-172-21-18-151.campus-dynamic.uwaterloo.ca.24874: UDP, length 1426
21:43:29.124758 IP v1404-wn-172-21-18-151.campus-dynamic.uwaterloo.ca.24874 > c-69-244-105-21.hsd1.nj.comcast.net.15935: UDP, length 20
21:43:29.136387 IP c-71-204-8-40.hsd1.ga.comcast.net.62348 > v1404-wn-172-21-18-151.campus-dynamic.uwaterloo.ca.24874: UDP, length 1426
21:43:29.145970 IP c-71-204-8-40.hsd1.ga.comcast.net.62348 > v1404-wn-172-21-18-151.campus-dynamic.uwaterloo.ca.24874: UDP, length 1426
21:43:29.146138 IP c-71-204-8-40.hsd1.ga.comcast.net.62348 > v1404-wn-172-21-18-151.campus-dynamic.uwaterloo.ca.24874: UDP, length 1426
21:43:29.147546 IP c-71-204-8-40.hsd1.ga.comcast.net.62348 > v1404-wn-172-21-18-151.campus-dynamic.uwaterloo.ca.24874: UDP, length 1426
21:43:29.147651 IP v1404-wn-172-21-18-151.campus-dynamic.uwaterloo.ca.24874 > c-71-204-8-40.hsd1.ga.comcast.net.62348: UDP, length 26
21:43:29.147901 IP c-71-204-8-40.hsd1.ga.comcast.net.62348 > v1404-wn-172-21-18-151.campus-dynamic.uwaterloo.ca.24874: UDP, length 1426
21:43:29.148461 IP c-71-204-8-40.hsd1.ga.comcast.net.62348 > v1404-wn-172-21-18-151.campus-dynamic.uwaterloo.ca.24874: UDP, length 1426
21:43:29.174008 IP v1404-wn-172-21-18-151.campus-dynamic.uwaterloo.ca.24874 > c-71-204-8-40.hsd1.ga.comcast.net.62348: UDP, length 26
21:43:29.201669 IP c-71-204-8-40.hsd1.ga.comcast.net.62348 > v1404-wn-172-21-18-151.campus-dynamic.uwaterloo.ca.24874: UDP, length 1426
21:43:29.201800 IP v1404-wn-172-21-18-151.campus-dynamic.uwaterloo.ca.24874 > c-71-204-8-40.hsd1.ga.comcast.net.62348: UDP, length 20
21:43:29.201882 IP c-71-204-8-40.hsd1.ga.comcast.net.62348 > v1404-wn-172-21-18-151.campus-dynamic.uwaterloo.ca.24874: UDP, length 1426
21:43:29.202451 IP c-71-204-8-40.hsd1.ga.comcast.net.62348 > v1404-wn-172-21-18-151.campus-dynamic.uwaterloo.ca.24874: UDP, length 1426
21:43:29.202525 IP v1404-wn-172-21-18-151.campus-dynamic.uwaterloo.ca.24874 > c-71-204-8-40.hsd1.ga.comcast.net.62348: UDP, length 20
21:43:29.202974 IP c-71-204-8-40.hsd1.ga.comcast.net.62348 > v1404-wn-172-21-18-151.campus-dynamic.uwaterloo.ca.24874: UDP, length 1426
21:43:29.205219 IP 108.160.160.178.https > v1404-wn-172-21-18-151.campus-dynamic.uwaterloo.ca.63425: Flags [.], ack 426, win 58, options [nop,nop,TS val 220960342 ecr 1339587298], length 0
21:43:29.209827 IP c-71-204-8-40.hsd1.ga.comcast.net.62348 > v1404-wn-172-21-18-151.campus-dynamic.uwaterloo.ca.24874: UDP, length 1426
21:43:29.209932 IP v1404-wn-172-21-18-151.campus-dynamic.uwaterloo.ca.24874 > c-71-204-8-40.hsd1.ga.comcast.net.62348: UDP, length 20
21:43:29.210024 IP c-71-204-8-40.hsd1.ga.comcast.net.62348 > v1404-wn-172-21-18-151.campus-dynamic.uwaterloo.ca.24874: UDP, length 1426
21:43:29.233327 IP c-69-244-105-21.hsd1.nj.comcast.net.15935 > v1404-wn-172-21-18-151.campus-dynamic.uwaterloo.ca.24874: UDP, length 1426
21:43:29.233723 IP c-69-244-105-21.hsd1.nj.comcast.net.15935 > v1404-wn-172-21-18-151.campus-dynamic.uwaterloo.ca.24874: UDP, length 1426
21:43:29.233824 IP v1404-wn-172-21-18-151.campus-dynamic.uwaterloo.ca.24874 > c-69-244-105-21.hsd1.nj.comcast.net.15935: UDP, length 20
21:43:29.240020 IP c-69-244-105-21.hsd1.nj.comcast.net.15935 > v1404-wn-172-21-18-151.campus-dynamic.uwaterloo.ca.24874: UDP, length 1426
21:43:29.240422 IP c-69-244-105-21.hsd1.nj.comcast.net.15935 > v1404-wn-172-21-18-151.campus-dynamic.uwaterloo.ca.24874: UDP, length 1426
21:43:29.240514 IP v1404-wn-172-21-18-151.campus-dynamic.uwaterloo.ca.24874 > c-69-244-105-21.hsd1.nj.comcast.net.15935: UDP, length 20
21:43:29.242021 IP c-71-204-8-40.hsd1.ga.comcast.net.62348 > v1404-wn-172-21-18-151.campus-dynamic.uwaterloo.ca.24874: UDP, length 1426
21:43:29.242152 IP v1404-wn-172-21-18-151.campus-dynamic.uwaterloo.ca.24874 > c-71-204-8-40.hsd1.ga.comcast.net.62348: UDP, length 20
21:43:29.251386 IP c-71-204-8-40.hsd1.ga.comcast.net.62348 > v1404-wn-172-21-18-151.campus-dynamic.uwaterloo.ca.24874: UDP, length 1426
21:43:29.251629 IP c-71-204-8-40.hsd1.ga.comcast.net.62348 > v1404-wn-172-21-18-151.campus-dynamic.uwaterloo.ca.24874: UDP, length 1426
21:43:29.251726 IP v1404-wn-172-21-18-151.campus-dynamic.uwaterloo.ca.24874 > c-71-204-8-40.hsd1.ga.comcast.net.62348: UDP, length 20
21:43:29.251958 IP c-71-204-8-40.hsd1.ga.comcast.net.62348 > v1404-wn-172-21-18-151.campus-dynamic.uwaterloo.ca.24874: UDP, length 1426
21:43:29.252527 IP c-71-204-8-40.hsd1.ga.comcast.net.62348 > v1404-wn-172-21-18-151.campus-dynamic.uwaterloo.ca.24874: UDP, length 1426
21:43:29.252600 IP v1404-wn-172-21-18-151.campus-dynamic.uwaterloo.ca.24874 > c-71-204-8-40.hsd1.ga.comcast.net.62348: UDP, length 20
21:43:29.258703 IP 108.160.160.178.https > v1404-wn-172-21-18-151.campus-dynamic.uwaterloo.ca.63425: Flags [P.], seq 1:518, ack 426, win 58, options [nop,nop,TS val 220960355 ecr 1339587298], length 517
21:43:29.258775 IP v1404-wn-172-21-18-151.campus-dynamic.uwaterloo.ca.63425 > 108.160.160.178.https: Flags [.], ack 518, win 8159, options [nop,nop,TS val 1339587438 ecr 220960355], length 0
21:43:29.276016 IP c-71-204-8-40.hsd1.ga.comcast.net.62348 > v1404-wn-172-21-18-151.campus-dynamic.uwaterloo.ca.24874: UDP, length 1426
21:43:29.276286 IP v1404-wn-172-21-18-151.campus-dynamic.uwaterloo.ca.24874 > gob75-1-81-57-25-161.fbx.proxad.net.51413: UDP, length 103
21:43:29.276323 IP v1404-wn-172-21-18-151.campus-dynamic.uwaterloo.ca.24874 > c-50-131-222-175.hsd1.ca.comcast.net.51413: UDP, length 103
21:43:29.276329 IP v1404-wn-172-21-18-151.campus-dynamic.uwaterloo.ca.24874 > bband-dyn184.178-40-45.t-com.sk.10311: UDP, length 103
21:43:29.292240 IP c-71-204-8-40.hsd1.ga.comcast.net.62348 > v1404-wn-172-21-18-151.campus-dynamic.uwaterloo.ca.24874: UDP, length 1426
21:43:29.292362 IP v1404-wn-172-21-18-151.campus-dynamic.uwaterloo.ca.24874 > c-71-204-8-40.hsd1.ga.comcast.net.62348: UDP, length 20
21:43:29.300248 IP c-69-244-105-21.hsd1.nj.comcast.net.15935 > v1404-wn-172-21-18-151.campus-dynamic.uwaterloo.ca.24874: UDP, length 1426
21:43:29.300740 IP c-69-244-105-21.hsd1.nj.comcast.net.15935 > v1404-wn-172-21-18-151.campus-dynamic.uwaterloo.ca.24874: UDP, length 1426
21:43:29.300830 IP v1404-wn-172-21-18-151.campus-dynamic.uwaterloo.ca.24874 > c-69-244-105-21.hsd1.nj.comcast.net.15935: UDP, length 20
21:43:29.301056 IP c-71-204-8-40.hsd1.ga.comcast.net.62348 > v1404-wn-172-21-18-151.campus-dynamic.uwaterloo.ca.24874: UDP, length 1426
21:43:29.301577 IP c-69-244-105-21.hsd1.nj.comcast.net.15935 > v1404-wn-172-21-18-151.campus-dynamic.uwaterloo.ca.24874: UDP, length 1426
21:43:29.302688 IP c-71-204-8-40.hsd1.ga.comcast.net.62348 > v1404-wn-172-21-18-151.campus-dynamic.uwaterloo.ca.24874: UDP, length 1426
21:43:29.302765 IP v1404-wn-172-21-18-151.campus-dynamic.uwaterloo.ca.24874 > c-71-204-8-40.hsd1.ga.comcast.net.62348: UDP, length 20
21:43:29.302959 IP c-71-204-8-40.hsd1.ga.comcast.net.62348 > v1404-wn-172-21-18-151.campus-dynamic.uwaterloo.ca.24874: UDP, length 1426
21:43:29.303453 IP c-71-204-8-40.hsd1.ga.comcast.net.62348 > v1404-wn-172-21-18-151.campus-dynamic.uwaterloo.ca.24874: UDP, length 1426
21:43:29.303528 IP v1404-wn-172-21-18-151.campus-dynamic.uwaterloo.ca.24874 > c-71-204-8-40.hsd1.ga.comcast.net.62348: UDP, length 20
21:43:29.306634 IP v1404-wn-172-21-18-151.campus-dynamic.uwaterloo.ca.63417 > 87-127-36-20.static.enta.net.52619: Flags [P.], seq 1:350, ack 9912, win 58260, options [nop,nop,TS val 1339587484 ecr 88063484], length 349
21:43:29.309819 IP c-71-204-8-40.hsd1.ga.comcast.net.62348 > v1404-wn-172-21-18-151.campus-dynamic.uwaterloo.ca.24874: UDP, length 1426
21:43:29.310075 IP c-71-204-8-40.hsd1.ga.comcast.net.62348 > v1404-wn-172-21-18-151.campus-dynamic.uwaterloo.ca.24874: UDP, length 1426
21:43:29.310166 IP v1404-wn-172-21-18-151.campus-dynamic.uwaterloo.ca.24874 > c-71-204-8-40.hsd1.ga.comcast.net.62348: UDP, length 20
21:43:29.323760 IP c-69-244-105-21.hsd1.nj.comcast.net.15935 > v1404-wn-172-21-18-151.campus-dynamic.uwaterloo.ca.24874: UDP, length 1426
21:43:29.323888 IP v1404-wn-172-21-18-151.campus-dynamic.uwaterloo.ca.24874 > c-69-244-105-21.hsd1.nj.comcast.net.15935: UDP, length 20
21:43:29.324406 IP c-69-244-105-21.hsd1.nj.comcast.net.15935 > v1404-wn-172-21-18-151.campus-dynamic.uwaterloo.ca.24874: UDP, length 1426
21:43:29.344904 IP c-71-204-8-40.hsd1.ga.comcast.net.62348 > v1404-wn-172-21-18-151.campus-dynamic.uwaterloo.ca.24874: UDP, length 1426
21:43:29.345138 IP c-71-204-8-40.hsd1.ga.comcast.net.62348 > v1404-wn-172-21-18-151.campus-dynamic.uwaterloo.ca.24874: UDP, length 1426
21:43:29.345246 IP v1404-wn-172-21-18-151.campus-dynamic.uwaterloo.ca.24874 > c-71-204-8-40.hsd1.ga.comcast.net.62348: UDP, length 20
21:43:29.354671 IP c-71-204-8-40.hsd1.ga.comcast.net.62348 > v1404-wn-172-21-18-151.campus-dynamic.uwaterloo.ca.24874: UDP, length 1426
21:43:29.355655 IP c-71-204-8-40.hsd1.ga.comcast.net.62348 > v1404-wn-172-21-18-151.campus-dynamic.uwaterloo.ca.24874: UDP, length 1426
21:43:29.355924 IP c-71-204-8-40.hsd1.ga.comcast.net.62348 > v1404-wn-172-21-18-151.campus-dynamic.uwaterloo.ca.24874: UDP, length 1426
21:43:29.356011 IP v1404-wn-172-21-18-151.campus-dynamic.uwaterloo.ca.24874 > c-71-204-8-40.hsd1.ga.comcast.net.62348: UDP, length 26
21:43:29.356533 IP c-71-204-8-40.hsd1.ga.comcast.net.62348 > v1404-wn-172-21-18-151.campus-dynamic.uwaterloo.ca.24874: UDP, length 1426
21:43:29.373121 IP c-50-131-222-175.hsd1.ca.comcast.net.51413 > v1404-wn-172-21-18-151.campus-dynamic.uwaterloo.ca.24874: UDP, length 268
21:43:29.373286 IP v1404-wn-172-21-18-151.campus-dynamic.uwaterloo.ca.24874 > c-71-204-8-40.hsd1.ga.comcast.net.62348: UDP, length 26
21:43:29.382576 IP c-71-204-8-40.hsd1.ga.comcast.net.62348 > v1404-wn-172-21-18-151.campus-dynamic.uwaterloo.ca.24874: UDP, length 1426
21:43:29.390178 IP c-71-204-8-40.hsd1.ga.comcast.net.62348 > v1404-wn-172-21-18-151.campus-dynamic.uwaterloo.ca.24874: UDP, length 1426
21:43:29.405278 IP c-71-204-8-40.hsd1.ga.comcast.net.62348 > v1404-wn-172-21-18-151.campus-dynamic.uwaterloo.ca.24874: UDP, length 1426
21:43:29.405559 IP c-71-204-8-40.hsd1.ga.comcast.net.62348 > v1404-wn-172-21-18-151.campus-dynamic.uwaterloo.ca.24874: UDP, length 1426
21:43:29.405948 IP c-71-204-8-40.hsd1.ga.comcast.net.62348 > v1404-wn-172-21-18-151.campus-dynamic.uwaterloo.ca.24874: UDP, length 1426
21:43:29.406044 IP v1404-wn-172-21-18-151.campus-dynamic.uwaterloo.ca.24874 > c-71-204-8-40.hsd1.ga.comcast.net.62348: UDP, length 26
21:43:29.407240 IP c-71-204-8-40.hsd1.ga.comcast.net.62348 > v1404-wn-172-21-18-151.campus-dynamic.uwaterloo.ca.24874: UDP, length 1426
21:43:29.407489 IP c-71-204-8-40.hsd1.ga.comcast.net.62348 > v1404-wn-172-21-18-151.campus-dynamic.uwaterloo.ca.24874: UDP, length 1426
21:43:29.407967 IP c-71-204-8-40.hsd1.ga.comcast.net.62348 > v1404-wn-172-21-18-151.campus-dynamic.uwaterloo.ca.24874: UDP, length 1426
21:43:29.408007 IP c-71-204-8-40.hsd1.ga.comcast.net.62348 > v1404-wn-172-21-18-151.campus-dynamic.uwaterloo.ca.24874: UDP, length 1426
21:43:29.408031 IP v1404-wn-172-21-18-151.campus-dynamic.uwaterloo.ca.24874 > c-71-204-8-40.hsd1.ga.comcast.net.62348: UDP, length 26
21:43:29.441587 IP c-69-244-105-21.hsd1.nj.comcast.net.15935 > v1404-wn-172-21-18-151.campus-dynamic.uwaterloo.ca.24874: UDP, length 1426
21:43:29.441722 IP v1404-wn-172-21-18-151.campus-dynamic.uwaterloo.ca.24874 > c-69-244-105-21.hsd1.nj.comcast.net.15935: UDP, length 20
21:43:29.441755 IP v1404-wn-172-21-18-151.campus-dynamic.uwaterloo.ca.24874 > c-71-204-8-40.hsd1.ga.comcast.net.62348: UDP, length 26
21:43:29.441807 IP c-69-244-105-21.hsd1.nj.comcast.net.15935 > v1404-wn-172-21-18-151.campus-dynamic.uwaterloo.ca.24874: UDP, length 1426
21:43:29.442932 IP c-71-204-8-40.hsd1.ga.comcast.net.62348 > v1404-wn-172-21-18-151.campus-dynamic.uwaterloo.ca.24874: UDP, length 1426
21:43:29.443163 IP c-71-204-8-40.hsd1.ga.comcast.net.62348 > v1404-wn-172-21-18-151.campus-dynamic.uwaterloo.ca.24874: UDP, length 1426
21:43:29.450736 IP c-71-204-8-40.hsd1.ga.comcast.net.62348 > v1404-wn-172-21-18-151.campus-dynamic.uwaterloo.ca.24874: UDP, length 1426
21:43:29.458929 IP c-71-204-8-40.hsd1.ga.comcast.net.62348 > v1404-wn-172-21-18-151.campus-dynamic.uwaterloo.ca.24874: UDP, length 1426
21:43:29.459114 IP c-71-204-8-40.hsd1.ga.comcast.net.62348 > v1404-wn-172-21-18-151.campus-dynamic.uwaterloo.ca.24874: UDP, length 1426
21:43:29.467441 IP c-71-204-8-40.hsd1.ga.comcast.net.62348 > v1404-wn-172-21-18-151.campus-dynamic.uwaterloo.ca.24874: UDP, length 1426
21:43:29.467555 IP v1404-wn-172-21-18-151.campus-dynamic.uwaterloo.ca.24874 > c-71-204-8-40.hsd1.ga.comcast.net.62348: UDP, length 20
21:43:29.503100 IP c-71-204-8-40.hsd1.ga.comcast.net.62348 > v1404-wn-172-21-18-151.campus-dynamic.uwaterloo.ca.24874: UDP, length 1426
21:43:29.503335 IP c-71-204-8-40.hsd1.ga.comcast.net.62348 > v1404-wn-172-21-18-151.campus-dynamic.uwaterloo.ca.24874: UDP, length 1426
21:43:29.503412 IP v1404-wn-172-21-18-151.campus-dynamic.uwaterloo.ca.24874 > c-71-204-8-40.hsd1.ga.comcast.net.62348: UDP, length 20
21:43:29.509733 IP c-71-204-8-40.hsd1.ga.comcast.net.62348 > v1404-wn-172-21-18-151.campus-dynamic.uwaterloo.ca.24874: UDP, length 1426
21:43:29.518299 IP c-69-244-105-21.hsd1.nj.comcast.net.15935 > v1404-wn-172-21-18-151.campus-dynamic.uwaterloo.ca.24874: UDP, length 1426
21:43:29.518421 IP v1404-wn-172-21-18-151.campus-dynamic.uwaterloo.ca.24874 > c-69-244-105-21.hsd1.nj.comcast.net.15935: UDP, length 20
21:43:29.518976 IP c-69-244-105-21.hsd1.nj.comcast.net.15935 > v1404-wn-172-21-18-151.campus-dynamic.uwaterloo.ca.24874: UDP, length 1426
21:43:29.519269 IP c-69-244-105-21.hsd1.nj.comcast.net.15935 > v1404-wn-172-21-18-151.campus-dynamic.uwaterloo.ca.24874: UDP, length 1426
21:43:29.519336 IP v1404-wn-172-21-18-151.campus-dynamic.uwaterloo.ca.24874 > c-69-244-105-21.hsd1.nj.comcast.net.15935: UDP, length 20
21:43:29.519565 IP c-69-244-105-21.hsd1.nj.comcast.net.15935 > v1404-wn-172-21-18-151.campus-dynamic.uwaterloo.ca.24874: UDP, length 1426
21:43:29.540792 IP 87-127-36-20.static.enta.net.52619 > v1404-wn-172-21-18-151.campus-dynamic.uwaterloo.ca.63417: Flags [.], seq 9912:11258, ack 350, win 253, options [nop,nop,TS val 88063532 ecr 1339587484], length 1346
21:43:29.540860 IP v1404-wn-172-21-18-151.campus-dynamic.uwaterloo.ca.63417 > 87-127-36-20.static.enta.net.52619: Flags [.], ack 11258, win 58678, options [nop,nop,TS val 1339587715 ecr 88063532], length 0
21:43:29.550992 IP 87-127-36-20.static.enta.net.52619 > v1404-wn-172-21-18-151.campus-dynamic.uwaterloo.ca.63417: Flags [.], seq 11258:12604, ack 350, win 253, options [nop,nop,TS val 88063532 ecr 1339587484], length 1346
21:43:29.559909 IP 87-127-36-20.static.enta.net.52619 > v1404-wn-172-21-18-151.campus-dynamic.uwaterloo.ca.63417: Flags [.], seq 12604:13950, ack 350, win 253, options [nop,nop,TS val 88063532 ecr 1339587484], length 1346
21:43:29.559966 IP v1404-wn-172-21-18-151.campus-dynamic.uwaterloo.ca.63417 > 87-127-36-20.static.enta.net.52619: Flags [.], ack 13950, win 58509, options [nop,nop,TS val 1339587733 ecr 88063532], length 0
21:43:29.570086 IP 87-127-36-20.static.enta.net.52619 > v1404-wn-172-21-18-151.campus-dynamic.uwaterloo.ca.63417: Flags [.], seq 13950:15296, ack 350, win 253, options [nop,nop,TS val 88063532 ecr 1339587484], length 1346
21:43:29.571255 IP c-71-204-8-40.hsd1.ga.comcast.net.62348 > v1404-wn-172-21-18-151.campus-dynamic.uwaterloo.ca.24874: UDP, length 1426
21:43:29.571354 IP v1404-wn-172-21-18-151.campus-dynamic.uwaterloo.ca.24874 > c-71-204-8-40.hsd1.ga.comcast.net.62348: UDP, length 20
21:43:29.579405 IP 87-127-36-20.static.enta.net.52619 > v1404-wn-172-21-18-151.campus-dynamic.uwaterloo.ca.63417: Flags [.], seq 15296:16642, ack 350, win 253, options [nop,nop,TS val 88063532 ecr 1339587484], length 1346
21:43:29.579450 IP v1404-wn-172-21-18-151.campus-dynamic.uwaterloo.ca.63417 > 87-127-36-20.static.enta.net.52619: Flags [.], ack 16642, win 58482, options [nop,nop,TS val 1339587752 ecr 88063532], length 0
21:43:29.582733 IP c-69-244-105-21.hsd1.nj.comcast.net.15935 > v1404-wn-172-21-18-151.campus-dynamic.uwaterloo.ca.24874: UDP, length 1426
21:43:29.582823 IP v1404-wn-172-21-18-151.campus-dynamic.uwaterloo.ca.24874 > c-69-244-105-21.hsd1.nj.comcast.net.15935: UDP, length 20
21:43:29.583377 IP c-69-244-105-21.hsd1.nj.comcast.net.15935 > v1404-wn-172-21-18-151.campus-dynamic.uwaterloo.ca.24874: UDP, length 1426
21:43:29.583921 IP c-71-204-8-40.hsd1.ga.comcast.net.62348 > v1404-wn-172-21-18-151.campus-dynamic.uwaterloo.ca.24874: UDP, length 1426
21:43:29.584205 IP c-71-204-8-40.hsd1.ga.comcast.net.62348 > v1404-wn-172-21-18-151.campus-dynamic.uwaterloo.ca.24874: UDP, length 1426
21:43:29.584275 IP v1404-wn-172-21-18-151.campus-dynamic.uwaterloo.ca.24874 > c-71-204-8-40.hsd1.ga.comcast.net.62348: UDP, length 20
21:43:29.584827 IP c-71-204-8-40.hsd1.ga.comcast.net.62348 > v1404-wn-172-21-18-151.campus-dynamic.uwaterloo.ca.24874: UDP, length 1426
21:43:29.585113 IP c-71-204-8-40.hsd1.ga.comcast.net.62348 > v1404-wn-172-21-18-151.campus-dynamic.uwaterloo.ca.24874: UDP, length 1426
21:43:29.585182 IP v1404-wn-172-21-18-151.campus-dynamic.uwaterloo.ca.24874 > c-71-204-8-40.hsd1.ga.comcast.net.62348: UDP, length 20
21:43:29.585452 IP c-71-204-8-40.hsd1.ga.comcast.net.62348 > v1404-wn-172-21-18-151.campus-dynamic.uwaterloo.ca.24874: UDP, length 1426
21:43:29.585522 IP c-71-204-8-40.hsd1.ga.comcast.net.62348 > v1404-wn-172-21-18-151.campus-dynamic.uwaterloo.ca.24874: UDP, length 1426
21:43:29.585592 IP v1404-wn-172-21-18-151.campus-dynamic.uwaterloo.ca.24874 > c-71-204-8-40.hsd1.ga.comcast.net.62348: UDP, length 20
21:43:29.589228 IP 87-127-36-20.static.enta.net.52619 > v1404-wn-172-21-18-151.campus-dynamic.uwaterloo.ca.63417: Flags [.], seq 16642:17988, ack 350, win 253, options [nop,nop,TS val 88063532 ecr 1339587484], length 1346
21:43:29.599333 IP 87-127-36-20.static.enta.net.52619 > v1404-wn-172-21-18-151.campus-dynamic.uwaterloo.ca.63417: Flags [.], seq 17988:19334, ack 350, win 253, options [nop,nop,TS val 88063532 ecr 1339587484], length 1346
21:43:29.599407 IP v1404-wn-172-21-18-151.campus-dynamic.uwaterloo.ca.63417 > 87-127-36-20.static.enta.net.52619: Flags [.], ack 19334, win 58313, options [nop,nop,TS val 1339587771 ecr 88063532], length 0
21:43:29.600440 IP c-71-204-8-40.hsd1.ga.comcast.net.62348 > v1404-wn-172-21-18-151.campus-dynamic.uwaterloo.ca.24874: UDP, length 1426
21:43:29.600662 IP c-71-204-8-40.hsd1.ga.comcast.net.62348 > v1404-wn-172-21-18-151.campus-dynamic.uwaterloo.ca.24874: UDP, length 1426
21:43:29.600741 IP v1404-wn-172-21-18-151.campus-dynamic.uwaterloo.ca.24874 > c-71-204-8-40.hsd1.ga.comcast.net.62348: UDP, length 20
21:43:29.600993 IP c-71-204-8-40.hsd1.ga.comcast.net.62348 > v1404-wn-172-21-18-151.campus-dynamic.uwaterloo.ca.24874: UDP, length 1426
21:43:29.609108 IP 87-127-36-20.static.enta.net.52619 > v1404-wn-172-21-18-151.campus-dynamic.uwaterloo.ca.63417: Flags [.], seq 19334:20680, ack 350, win 253, options [nop,nop,TS val 88063532 ecr 1339587484], length 1346
21:43:29.618705 IP 87-127-36-20.static.enta.net.52619 > v1404-wn-172-21-18-151.campus-dynamic.uwaterloo.ca.63417: Flags [.], seq 20680:22026, ack 350, win 253, options [nop,nop,TS val 88063532 ecr 1339587484], length 1346
21:43:29.618772 IP v1404-wn-172-21-18-151.campus-dynamic.uwaterloo.ca.63417 > 87-127-36-20.static.enta.net.52619: Flags [.], ack 22026, win 58145, options [nop,nop,TS val 1339587789 ecr 88063532], length 0
21:43:29.629607 IP 87-127-36-20.static.enta.net.52619 > v1404-wn-172-21-18-151.campus-dynamic.uwaterloo.ca.63417: Flags [.], seq 22026:23372, ack 350, win 253, options [nop,nop,TS val 88063532 ecr 1339587484], length 1346
21:43:29.671802 IP c-71-204-8-40.hsd1.ga.comcast.net.62348 > v1404-wn-172-21-18-151.campus-dynamic.uwaterloo.ca.24874: UDP, length 1426
21:43:29.671953 IP v1404-wn-172-21-18-151.campus-dynamic.uwaterloo.ca.24874 > c-71-204-8-40.hsd1.ga.comcast.net.62348: UDP, length 20
21:43:29.678986 IP c-69-244-105-21.hsd1.nj.comcast.net.15935 > v1404-wn-172-21-18-151.campus-dynamic.uwaterloo.ca.24874: UDP, length 1426
21:43:29.679072 IP v1404-wn-172-21-18-151.campus-dynamic.uwaterloo.ca.24874 > c-69-244-105-21.hsd1.nj.comcast.net.15935: UDP, length 20
21:43:29.679110 IP v1404-wn-172-21-18-151.campus-dynamic.uwaterloo.ca.63417 > 87-127-36-20.static.enta.net.52619: Flags [.], ack 23372, win 58310, options [nop,nop,TS val 1339587848 ecr 88063532], length 0
21:43:29.679253 IP c-69-244-105-21.hsd1.nj.comcast.net.15935 > v1404-wn-172-21-18-151.campus-dynamic.uwaterloo.ca.24874: UDP, length 1426
21:43:29.679846 IP c-71-204-8-40.hsd1.ga.comcast.net.62348 > v1404-wn-172-21-18-151.campus-dynamic.uwaterloo.ca.24874: UDP, length 1426
21:43:29.680482 IP c-71-204-8-40.hsd1.ga.comcast.net.62348 > v1404-wn-172-21-18-151.campus-dynamic.uwaterloo.ca.24874: UDP, length 1426
21:43:29.680561 IP v1404-wn-172-21-18-151.campus-dynamic.uwaterloo.ca.24874 > c-71-204-8-40.hsd1.ga.comcast.net.62348: UDP, length 20
21:43:29.694085 IP c-71-204-8-40.hsd1.ga.comcast.net.62348 > v1404-wn-172-21-18-151.campus-dynamic.uwaterloo.ca.24874: UDP, length 1426
21:43:29.694876 IP c-71-204-8-40.hsd1.ga.comcast.net.62348 > v1404-wn-172-21-18-151.campus-dynamic.uwaterloo.ca.24874: UDP, length 1426
21:43:29.694968 IP v1404-wn-172-21-18-151.campus-dynamic.uwaterloo.ca.24874 > c-71-204-8-40.hsd1.ga.comcast.net.62348: UDP, length 20
21:43:29.695194 IP c-71-204-8-40.hsd1.ga.comcast.net.62348 > v1404-wn-172-21-18-151.campus-dynamic.uwaterloo.ca.24874: UDP, length 1426
21:43:29.695786 IP c-71-204-8-40.hsd1.ga.comcast.net.62348 > v1404-wn-172-21-18-151.campus-dynamic.uwaterloo.ca.24874: UDP, length 1426
21:43:29.695849 IP v1404-wn-172-21-18-151.campus-dynamic.uwaterloo.ca.24874 > c-71-204-8-40.hsd1.ga.comcast.net.62348: UDP, length 20
21:43:29.696493 IP c-71-204-8-40.hsd1.ga.comcast.net.62348 > v1404-wn-172-21-18-151.campus-dynamic.uwaterloo.ca.24874: UDP, length 1426
21:43:29.696566 IP c-71-204-8-40.hsd1.ga.comcast.net.62348 > v1404-wn-172-21-18-151.campus-dynamic.uwaterloo.ca.24874: UDP, length 1426
21:43:29.696649 IP c-71-204-8-40.hsd1.ga.comcast.net.62348 > v1404-wn-172-21-18-151.campus-dynamic.uwaterloo.ca.24874: UDP, length 1426
21:43:29.696672 IP v1404-wn-172-21-18-151.campus-dynamic.uwaterloo.ca.24874 > c-71-204-8-40.hsd1.ga.comcast.net.62348: UDP, length 20
21:43:29.701676 IP c-71-204-8-40.hsd1.ga.comcast.net.62348 > v1404-wn-172-21-18-151.campus-dynamic.uwaterloo.ca.24874: UDP, length 1426
21:43:29.701851 IP c-71-204-8-40.hsd1.ga.comcast.net.62348 > v1404-wn-172-21-18-151.campus-dynamic.uwaterloo.ca.24874: UDP, length 1426
21:43:29.701880 IP v1404-wn-172-21-18-151.campus-dynamic.uwaterloo.ca.24874 > c-71-204-8-40.hsd1.ga.comcast.net.62348: UDP, length 20
21:43:29.749877 IP 87-127-36-20.static.enta.net.52619 > v1404-wn-172-21-18-151.campus-dynamic.uwaterloo.ca.63417: Flags [.], seq 23372:24718, ack 350, win 253, options [nop,nop,TS val 88063552 ecr 1339587715], length 1346
21:43:29.753361 IP v1404-wn-172-21-18-151.campus-dynamic.uwaterloo.ca.63417 > 87-127-36-20.static.enta.net.52619: Flags [.], ack 24718, win 58396, options [nop,nop,TS val 1339587920 ecr 88063552], length 0
21:43:29.757095 IP c-69-244-105-21.hsd1.nj.comcast.net.15935 > v1404-wn-172-21-18-151.campus-dynamic.uwaterloo.ca.24874: UDP, length 1426
21:43:29.757192 IP v1404-wn-172-21-18-151.campus-dynamic.uwaterloo.ca.24874 > c-69-244-105-21.hsd1.nj.comcast.net.15935: UDP, length 20
21:43:29.757775 IP c-69-244-105-21.hsd1.nj.comcast.net.15935 > v1404-wn-172-21-18-151.campus-dynamic.uwaterloo.ca.24874: UDP, length 1426
21:43:29.758029 IP c-69-244-105-21.hsd1.nj.comcast.net.15935 > v1404-wn-172-21-18-151.campus-dynamic.uwaterloo.ca.24874: UDP, length 1426
21:43:29.758105 IP v1404-wn-172-21-18-151.campus-dynamic.uwaterloo.ca.24874 > c-69-244-105-21.hsd1.nj.comcast.net.15935: UDP, length 20
21:43:29.758757 IP c-69-244-105-21.hsd1.nj.comcast.net.15935 > v1404-wn-172-21-18-151.campus-dynamic.uwaterloo.ca.24874: UDP, length 1426
21:43:29.768353 IP 87-127-36-20.static.enta.net.52619 > v1404-wn-172-21-18-151.campus-dynamic.uwaterloo.ca.63417: Flags [.], seq 24718:26064, ack 350, win 253, options [nop,nop,TS val 88063554 ecr 1339587733], length 1346
21:43:29.778169 IP 87-127-36-20.static.enta.net.52619 > v1404-wn-172-21-18-151.campus-dynamic.uwaterloo.ca.63417: Flags [.], seq 26064:27410, ack 350, win 253, options [nop,nop,TS val 88063554 ecr 1339587733], length 1346
21:43:29.778236 IP v1404-wn-172-21-18-151.campus-dynamic.uwaterloo.ca.63417 > 87-127-36-20.static.enta.net.52619: Flags [.], ack 27410, win 58228, options [nop,nop,TS val 1339587944 ecr 88063554], length 0
21:43:29.787870 IP c-71-204-8-40.hsd1.ga.comcast.net.62348 > v1404-wn-172-21-18-151.campus-dynamic.uwaterloo.ca.24874: UDP, length 1426
21:43:29.788091 IP c-71-204-8-40.hsd1.ga.comcast.net.62348 > v1404-wn-172-21-18-151.campus-dynamic.uwaterloo.ca.24874: UDP, length 1426
21:43:29.788106 IP v1404-wn-172-21-18-151.campus-dynamic.uwaterloo.ca.24874 > c-71-204-8-40.hsd1.ga.comcast.net.62348: UDP, length 20
21:43:29.790421 IP c-71-204-8-40.hsd1.ga.comcast.net.62348 > v1404-wn-172-21-18-151.campus-dynamic.uwaterloo.ca.24874: UDP, length 1426
21:43:29.790497 IP v1404-wn-172-21-18-151.campus-dynamic.uwaterloo.ca.24874 > c-71-204-8-40.hsd1.ga.comcast.net.62348: UDP, length 20
21:43:29.791881 IP c-71-204-8-40.hsd1.ga.comcast.net.62348 > v1404-wn-172-21-18-151.campus-dynamic.uwaterloo.ca.24874: UDP, length 1426
21:43:29.792532 IP 87-127-36-20.static.enta.net.52619 > v1404-wn-172-21-18-151.campus-dynamic.uwaterloo.ca.63417: Flags [.], seq 27410:28756, ack 350, win 253, options [nop,nop,TS val 88063555 ecr 1339587752], length 1346
21:43:29.793756 IP c-71-204-8-40.hsd1.ga.comcast.net.62348 > v1404-wn-172-21-18-151.campus-dynamic.uwaterloo.ca.24874: UDP, length 1426
21:43:29.793810 IP v1404-wn-172-21-18-151.campus-dynamic.uwaterloo.ca.24874 > c-71-204-8-40.hsd1.ga.comcast.net.62348: UDP, length 20
21:43:29.797525 IP c-69-244-105-21.hsd1.nj.comcast.net.15935 > v1404-wn-172-21-18-151.campus-dynamic.uwaterloo.ca.24874: UDP, length 1426
21:43:29.797648 IP v1404-wn-172-21-18-151.campus-dynamic.uwaterloo.ca.24874 > c-69-244-105-21.hsd1.nj.comcast.net.15935: UDP, length 20
21:43:29.797744 IP c-69-244-105-21.hsd1.nj.comcast.net.15935 > v1404-wn-172-21-18-151.campus-dynamic.uwaterloo.ca.24874: UDP, length 1426
21:43:29.800115 IP c-71-204-8-40.hsd1.ga.comcast.net.62348 > v1404-wn-172-21-18-151.campus-dynamic.uwaterloo.ca.24874: UDP, length 1426
21:43:29.800376 IP c-71-204-8-40.hsd1.ga.comcast.net.62348 > v1404-wn-172-21-18-151.campus-dynamic.uwaterloo.ca.24874: UDP, length 1426
21:43:29.800455 IP v1404-wn-172-21-18-151.campus-dynamic.uwaterloo.ca.24874 > c-71-204-8-40.hsd1.ga.comcast.net.62348: UDP, length 20
21:43:29.801007 IP c-71-204-8-40.hsd1.ga.comcast.net.62348 > v1404-wn-172-21-18-151.campus-dynamic.uwaterloo.ca.24874: UDP, length 1426
21:43:29.801291 IP c-71-204-8-40.hsd1.ga.comcast.net.62348 > v1404-wn-172-21-18-151.campus-dynamic.uwaterloo.ca.24874: UDP, length 1426
21:43:29.801361 IP v1404-wn-172-21-18-151.campus-dynamic.uwaterloo.ca.24874 > c-71-204-8-40.hsd1.ga.comcast.net.62348: UDP, length 20
21:43:29.801881 IP c-71-204-8-40.hsd1.ga.comcast.net.62348 > v1404-wn-172-21-18-151.campus-dynamic.uwaterloo.ca.24874: UDP, length 1426
21:43:29.802817 IP 87-127-36-20.static.enta.net.52619 > v1404-wn-172-21-18-151.campus-dynamic.uwaterloo.ca.63417: Flags [.], seq 28756:30102, ack 350, win 253, options [nop,nop,TS val 88063555 ecr 1339587752], length 1346
21:43:29.802859 IP v1404-wn-172-21-18-151.campus-dynamic.uwaterloo.ca.63417 > 87-127-36-20.static.enta.net.52619: Flags [.], ack 30102, win 58059, options [nop,nop,TS val 1339587967 ecr 88063555], length 0
21:43:29.803404 IP c-71-204-8-40.hsd1.ga.comcast.net.62348 > v1404-wn-172-21-18-151.campus-dynamic.uwaterloo.ca.24874: UDP, length 1426
21:43:29.803485 IP v1404-wn-172-21-18-151.campus-dynamic.uwaterloo.ca.24874 > c-71-204-8-40.hsd1.ga.comcast.net.62348: UDP, length 20
21:43:29.803617 IP c-71-204-8-40.hsd1.ga.comcast.net.62348 > v1404-wn-172-21-18-151.campus-dynamic.uwaterloo.ca.24874: UDP, length 1426
21:43:29.804207 IP c-71-204-8-40.hsd1.ga.comcast.net.62348 > v1404-wn-172-21-18-151.campus-dynamic.uwaterloo.ca.24874: UDP, length 1426
21:43:29.804284 IP c-71-204-8-40.hsd1.ga.comcast.net.62348 > v1404-wn-172-21-18-151.campus-dynamic.uwaterloo.ca.24874: UDP, length 1426
21:43:29.804295 IP v1404-wn-172-21-18-151.campus-dynamic.uwaterloo.ca.24874 > c-71-204-8-40.hsd1.ga.comcast.net.62348: UDP, length 20
21:43:29.811953 IP 87-127-36-20.static.enta.net.52619 > v1404-wn-172-21-18-151.campus-dynamic.uwaterloo.ca.63417: Flags [.], seq 30102:31448, ack 350, win 253, options [nop,nop,TS val 88063556 ecr 1339587771], length 1346
21:43:29.821742 IP 87-127-36-20.static.enta.net.52619 > v1404-wn-172-21-18-151.campus-dynamic.uwaterloo.ca.63417: Flags [.], seq 31448:32794, ack 350, win 253, options [nop,nop,TS val 88063556 ecr 1339587771], length 1346
21:43:29.821797 IP v1404-wn-172-21-18-151.campus-dynamic.uwaterloo.ca.63417 > 87-127-36-20.static.enta.net.52619: Flags [.], ack 32794, win 58006, options [nop,nop,TS val 1339587984 ecr 88063556], length 0
21:43:29.831830 IP 87-127-36-20.static.enta.net.52619 > v1404-wn-172-21-18-151.campus-dynamic.uwaterloo.ca.63417: Flags [.], seq 32794:34140, ack 350, win 253, options [nop,nop,TS val 88063556 ecr 1339587771], length 1346
21:43:29.842719 IP 87-127-36-20.static.enta.net.52619 > v1404-wn-172-21-18-151.campus-dynamic.uwaterloo.ca.63417: Flags [.], seq 34140:35486, ack 350, win 253, options [nop,nop,TS val 88063556 ecr 1339587789], length 1346
21:43:29.842777 IP v1404-wn-172-21-18-151.campus-dynamic.uwaterloo.ca.63417 > 87-127-36-20.static.enta.net.52619: Flags [.], ack 35486, win 57838, options [nop,nop,TS val 1339588004 ecr 88063556], length 0
21:43:29.848269 IP c-69-244-105-21.hsd1.nj.comcast.net.15935 > v1404-wn-172-21-18-151.campus-dynamic.uwaterloo.ca.24874: UDP, length 1426
21:43:29.848338 IP c-69-244-105-21.hsd1.nj.comcast.net.15935 > v1404-wn-172-21-18-151.campus-dynamic.uwaterloo.ca.24874: UDP, length 1426
21:43:29.848386 IP v1404-wn-172-21-18-151.campus-dynamic.uwaterloo.ca.24874 > c-69-244-105-21.hsd1.nj.comcast.net.15935: UDP, length 20
21:43:29.850931 IP 87-127-36-20.static.enta.net.52619 > v1404-wn-172-21-18-151.campus-dynamic.uwaterloo.ca.63417: Flags [.], seq 35486:36832, ack 350, win 253, options [nop,nop,TS val 88063556 ecr 1339587789], length 1346
