21:55:06.455995 IP arch1-ext.rs.github.com.https > v1404-wn-172-21-18-151.campus-dynamic.uwaterloo.ca.63659: Flags [.], seq 1366259240:1366260586, ack 3234329630, win 10, options [nop,nop,TS val 608572161 ecr 1340268547], length 1346
21:55:06.456062 IP v1404-wn-172-21-18-151.campus-dynamic.uwaterloo.ca.63659 > arch1-ext.rs.github.com.https: Flags [.], ack 1346, win 9842, options [nop,nop,TS val 1340268610 ecr 608572161], length 0
21:55:06.458242 IP arch1-ext.rs.github.com.https > v1404-wn-172-21-18-151.campus-dynamic.uwaterloo.ca.63659: Flags [.], seq 1346:2692, ack 1, win 10, options [nop,nop,TS val 608572161 ecr 1340268547], length 1346
21:55:06.460564 IP arch1-ext.rs.github.com.https > v1404-wn-172-21-18-151.campus-dynamic.uwaterloo.ca.63659: Flags [.], seq 2692:4038, ack 1, win 10, options [nop,nop,TS val 608572161 ecr 1340268547], length 1346
21:55:06.464960 IP arch1-ext.rs.github.com.https > v1404-wn-172-21-18-151.campus-dynamic.uwaterloo.ca.63659: Flags [.], seq 4038:5384, ack 1, win 10, options [nop,nop,TS val 608572161 ecr 1340268547], length 1346
21:55:06.465215 IP arch1-ext.rs.github.com.https > v1404-wn-172-21-18-151.campus-dynamic.uwaterloo.ca.63659: Flags [.], seq 5384:6730, ack 1, win 10, options [nop,nop,TS val 608572161 ecr 1340268547], length 1346
21:55:06.467416 IP arch1-ext.rs.github.com.https > v1404-wn-172-21-18-151.campus-dynamic.uwaterloo.ca.63659: Flags [.], seq 6730:8076, ack 1, win 10, options [nop,nop,TS val 608572161 ecr 1340268547], length 1346
21:55:06.469663 IP arch1-ext.rs.github.com.https > v1404-wn-172-21-18-151.campus-dynamic.uwaterloo.ca.63659: Flags [.], seq 8076:9422, ack 1, win 10, options [nop,nop,TS val 608572161 ecr 1340268547], length 1346
21:55:06.471885 IP arch1-ext.rs.github.com.https > v1404-wn-172-21-18-151.campus-dynamic.uwaterloo.ca.63659: Flags [.], seq 9422:10768, ack 1, win 10, options [nop,nop,TS val 608572162 ecr 1340268553], length 1346
21:55:06.474190 IP arch1-ext.rs.github.com.https > v1404-wn-172-21-18-151.campus-dynamic.uwaterloo.ca.63659: Flags [.], seq 10768:12114, ack 1, win 10, options [nop,nop,TS val 608572162 ecr 1340268553], length 1346
21:55:06.474264 IP v1404-wn-172-21-18-151.campus-dynamic.uwaterloo.ca.63659 > arch1-ext.rs.github.com.https: Flags [.], ack 12114, win 9842, options [nop,nop,TS val 1340268626 ecr 608572161], length 0
21:55:06.476433 IP arch1-ext.rs.github.com.https > v1404-wn-172-21-18-151.campus-dynamic.uwaterloo.ca.63659: Flags [.], seq 12114:13460, ack 1, win 10, options [nop,nop,TS val 608572162 ecr 1340268553], length 1346
21:55:06.478446 IP ec2-107-20-145-171.compute-1.amazonaws.com.https > v1404-wn-172-21-18-151.campus-dynamic.uwaterloo.ca.63661: Flags [.], ack 3332323186, win 377, options [nop,nop,TS val 727855079 ecr 1340268554], length 0
21:55:06.478557 IP ec2-107-20-145-171.compute-1.amazonaws.com.https > v1404-wn-172-21-18-151.campus-dynamic.uwaterloo.ca.63661: Flags [.], ack 413, win 380, options [nop,nop,TS val 727855079 ecr 1340268554], length 0
21:55:06.478875 IP ec2-107-20-145-171.compute-1.amazonaws.com.https > v1404-wn-172-21-18-151.campus-dynamic.uwaterloo.ca.63661: Flags [.], ack 1759, win 377, options [nop,nop,TS val 727855080 ecr 1340268554], length 0
21:55:06.479168 IP ec2-107-20-145-171.compute-1.amazonaws.com.https > v1404-wn-172-21-18-151.campus-dynamic.uwaterloo.ca.63661: Flags [.], ack 2171, win 374, options [nop,nop,TS val 727855080 ecr 1340268554], length 0
21:55:06.479431 IP ec2-107-20-145-171.compute-1.amazonaws.com.https > v1404-wn-172-21-18-151.campus-dynamic.uwaterloo.ca.63661: Flags [.], ack 5687, win 386, options [nop,nop,TS val 727855080 ecr 1340268554], length 0
21:55:06.479891 IP arch1-ext.rs.github.com.https > v1404-wn-172-21-18-151.campus-dynamic.uwaterloo.ca.63659: Flags [.], seq 13460:14806, ack 1, win 10, options [nop,nop,TS val 608572164 ecr 1340268558], length 1346
21:55:06.481522 IP arch1-ext.rs.github.com.https > v1404-wn-172-21-18-151.campus-dynamic.uwaterloo.ca.63659: Flags [.], seq 14806:16152, ack 1, win 10, options [nop,nop,TS val 608572164 ecr 1340268558], length 1346
21:55:06.484030 IP arch1-ext.rs.github.com.https > v1404-wn-172-21-18-151.campus-dynamic.uwaterloo.ca.63659: Flags [.], seq 16152:17498, ack 1, win 10, options [nop,nop,TS val 608572164 ecr 1340268558], length 1346
21:55:06.485881 IP ec2-107-20-145-171.compute-1.amazonaws.com.https > v1404-wn-172-21-18-151.campus-dynamic.uwaterloo.ca.63661: Flags [.], ack 5687, win 386, options [nop,nop,TS val 727855080 ecr 1340268554,nop,nop,sack 1 {7033:7205}], length 0
21:55:06.486049 IP ec2-107-20-145-171.compute-1.amazonaws.com.https > v1404-wn-172-21-18-151.campus-dynamic.uwaterloo.ca.63661: Flags [.], ack 7205, win 375, options [nop,nop,TS val 727855080 ecr 1340268554], length 0
21:55:06.486413 IP arch1-ext.rs.github.com.https > v1404-wn-172-21-18-151.campus-dynamic.uwaterloo.ca.63659: Flags [.], seq 17498:18844, ack 1, win 10, options [nop,nop,TS val 608572173 ecr 1340268588], length 1346
21:55:06.488645 IP arch1-ext.rs.github.com.https > v1404-wn-172-21-18-151.campus-dynamic.uwaterloo.ca.63659: Flags [.], seq 18844:20190, ack 1, win 10, options [nop,nop,TS val 608572173 ecr 1340268588], length 1346
21:55:06.490329 IP v1404-wn-172-21-18-151.campus-dynamic.uwaterloo.ca.63661 > ec2-107-20-145-171.compute-1.amazonaws.com.https: Flags [P.], seq 7205:7791, ack 0, win 8192, options [nop,nop,TS val 1340268638 ecr 727855080], length 586
21:55:06.490517 IP v1404-wn-172-21-18-151.campus-dynamic.uwaterloo.ca.63661 > ec2-107-20-145-171.compute-1.amazonaws.com.https: Flags [.], seq 7791:9137, ack 0, win 8192, options [nop,nop,TS val 1340268638 ecr 727855080], length 1346
21:55:06.490518 IP v1404-wn-172-21-18-151.campus-dynamic.uwaterloo.ca.63661 > ec2-107-20-145-171.compute-1.amazonaws.com.https: Flags [P.], seq 9137:9549, ack 0, win 8192, options [nop,nop,TS val 1340268638 ecr 727855080], length 412
21:55:06.490677 IP v1404-wn-172-21-18-151.campus-dynamic.uwaterloo.ca.63661 > ec2-107-20-145-171.compute-1.amazonaws.com.https: Flags [.], seq 9549:10895, ack 0, win 8192, options [nop,nop,TS val 1340268638 ecr 727855080], length 1346
21:55:06.490677 IP v1404-wn-172-21-18-151.campus-dynamic.uwaterloo.ca.63661 > ec2-107-20-145-171.compute-1.amazonaws.com.https: Flags [P.], seq 10895:11307, ack 0, win 8192, options [nop,nop,TS val 1340268638 ecr 727855080], length 412
21:55:06.490848 IP v1404-wn-172-21-18-151.campus-dynamic.uwaterloo.ca.63661 > ec2-107-20-145-171.compute-1.amazonaws.com.https: Flags [.], seq 11307:12653, ack 0, win 8192, options [nop,nop,TS val 1340268638 ecr 727855080], length 1346
21:55:06.490848 IP v1404-wn-172-21-18-151.campus-dynamic.uwaterloo.ca.63661 > ec2-107-20-145-171.compute-1.amazonaws.com.https: Flags [P.], seq 12653:13065, ack 0, win 8192, options [nop,nop,TS val 1340268638 ecr 727855080], length 412
21:55:06.490954 IP arch1-ext.rs.github.com.https > v1404-wn-172-21-18-151.campus-dynamic.uwaterloo.ca.63659: Flags [.], seq 20190:21536, ack 1, win 10, options [nop,nop,TS val 608572173 ecr 1340268588], length 1346
21:55:06.491009 IP v1404-wn-172-21-18-151.campus-dynamic.uwaterloo.ca.63661 > ec2-107-20-145-171.compute-1.amazonaws.com.https: Flags [.], seq 13065:14411, ack 0, win 8192, options [nop,nop,TS val 1340268638 ecr 727855080], length 1346
21:55:06.491009 IP v1404-wn-172-21-18-151.campus-dynamic.uwaterloo.ca.63661 > ec2-107-20-145-171.compute-1.amazonaws.com.https: Flags [P.], seq 14411:14823, ack 0, win 8192, options [nop,nop,TS val 1340268638 ecr 727855080], length 412
21:55:06.493325 IP arch1-ext.rs.github.com.https > v1404-wn-172-21-18-151.campus-dynamic.uwaterloo.ca.63659: Flags [.], seq 21536:22882, ack 1, win 10, options [nop,nop,TS val 608572173 ecr 1340268588], length 1346
21:55:06.493471 IP v1404-wn-172-21-18-151.campus-dynamic.uwaterloo.ca.63659 > arch1-ext.rs.github.com.https: Flags [.], ack 22882, win 9842, options [nop,nop,TS val 1340268641 ecr 608572162], length 0
21:55:06.495486 IP arch1-ext.rs.github.com.https > v1404-wn-172-21-18-151.campus-dynamic.uwaterloo.ca.63659: Flags [.], seq 22882:24228, ack 1, win 10, options [nop,nop,TS val 608572173 ecr 1340268588], length 1346
21:55:06.497768 IP arch1-ext.rs.github.com.https > v1404-wn-172-21-18-151.campus-dynamic.uwaterloo.ca.63659: Flags [.], seq 24228:25574, ack 1, win 10, options [nop,nop,TS val 608572173 ecr 1340268588], length 1346
21:55:06.500037 IP arch1-ext.rs.github.com.https > v1404-wn-172-21-18-151.campus-dynamic.uwaterloo.ca.63659: Flags [.], seq 25574:26920, ack 1, win 10, options [nop,nop,TS val 608572173 ecr 1340268588], length 1346
21:55:06.500118 IP v1404-wn-172-21-18-151.campus-dynamic.uwaterloo.ca.63659 > arch1-ext.rs.github.com.https: Flags [.], ack 26920, win 9842, options [nop,nop,TS val 1340268647 ecr 608572173], length 0
21:55:06.502309 IP arch1-ext.rs.github.com.https > v1404-wn-172-21-18-151.campus-dynamic.uwaterloo.ca.63659: Flags [.], seq 26920:28266, ack 1, win 10, options [nop,nop,TS val 608572173 ecr 1340268588], length 1346
21:55:06.502432 IP v1404-wn-172-21-18-151.campus-dynamic.uwaterloo.ca.63659 > arch1-ext.rs.github.com.https: Flags [.], ack 28266, win 9926, options [nop,nop,TS val 1340268649 ecr 608572173], length 0
21:55:06.504578 IP arch1-ext.rs.github.com.https > v1404-wn-172-21-18-151.campus-dynamic.uwaterloo.ca.63659: Flags [.], seq 28266:29612, ack 1, win 10, options [nop,nop,TS val 608572173 ecr 1340268588], length 1346
21:55:06.506839 IP arch1-ext.rs.github.com.https > v1404-wn-172-21-18-151.campus-dynamic.uwaterloo.ca.63659: Flags [.], seq 29612:30958, ack 1, win 10, options [nop,nop,TS val 608572173 ecr 1340268588], length 1346
21:55:06.506913 IP v1404-wn-172-21-18-151.campus-dynamic.uwaterloo.ca.63659 > arch1-ext.rs.github.com.https: Flags [.], ack 30958, win 9842, options [nop,nop,TS val 1340268653 ecr 608572173], length 0
21:55:06.509034 IP arch1-ext.rs.github.com.https > v1404-wn-172-21-18-151.campus-dynamic.uwaterloo.ca.63659: Flags [.], seq 30958:32304, ack 1, win 10, options [nop,nop,TS val 608572173 ecr 1340268588], length 1346
21:55:06.509149 IP v1404-wn-172-21-18-151.campus-dynamic.uwaterloo.ca.63659 > arch1-ext.rs.github.com.https: Flags [.], ack 32304, win 9926, options [nop,nop,TS val 1340268655 ecr 608572173], length 0
21:55:06.511377 IP arch1-ext.rs.github.com.https > v1404-wn-172-21-18-151.campus-dynamic.uwaterloo.ca.63659: Flags [.], seq 32304:33650, ack 1, win 10, options [nop,nop,TS val 608572173 ecr 1340268588], length 1346
21:55:06.513654 IP arch1-ext.rs.github.com.https > v1404-wn-172-21-18-151.campus-dynamic.uwaterloo.ca.63659: Flags [.], seq 33650:34996, ack 1, win 10, options [nop,nop,TS val 608572173 ecr 1340268588], length 1346
21:55:06.513799 IP v1404-wn-172-21-18-151.campus-dynamic.uwaterloo.ca.63659 > arch1-ext.rs.github.com.https: Flags [.], ack 34996, win 9842, options [nop,nop,TS val 1340268659 ecr 608572173], length 0
21:55:06.515965 IP arch1-ext.rs.github.com.https > v1404-wn-172-21-18-151.campus-dynamic.uwaterloo.ca.63659: Flags [.], seq 34996:36342, ack 1, win 10, options [nop,nop,TS val 608572173 ecr 1340268588], length 1346
21:55:06.518218 IP arch1-ext.rs.github.com.https > v1404-wn-172-21-18-151.campus-dynamic.uwaterloo.ca.63659: Flags [.], seq 36342:37688, ack 1, win 10, options [nop,nop,TS val 608572173 ecr 1340268588], length 1346
21:55:06.520548 IP arch1-ext.rs.github.com.https > v1404-wn-172-21-18-151.campus-dynamic.uwaterloo.ca.63659: Flags [.], seq 37688:39034, ack 1, win 10, options [nop,nop,TS val 608572173 ecr 1340268588], length 1346
21:55:06.522757 IP arch1-ext.rs.github.com.https > v1404-wn-172-21-18-151.campus-dynamic.uwaterloo.ca.63659: Flags [.], seq 39034:40380, ack 1, win 10, options [nop,nop,TS val 608572179 ecr 1340268610], length 1346
21:55:06.524950 IP arch1-ext.rs.github.com.https > v1404-wn-172-21-18-151.campus-dynamic.uwaterloo.ca.63659: Flags [.], seq 40380:41726, ack 1, win 10, options [nop,nop,TS val 608572179 ecr 1340268610], length 1346
21:55:06.527266 IP arch1-ext.rs.github.com.https > v1404-wn-172-21-18-151.campus-dynamic.uwaterloo.ca.63659: Flags [.], seq 41726:43072, ack 1, win 10, options [nop,nop,TS val 608572179 ecr 1340268610], length 1346
21:55:06.529557 IP arch1-ext.rs.github.com.https > v1404-wn-172-21-18-151.campus-dynamic.uwaterloo.ca.63659: Flags [.], seq 43072:44418, ack 1, win 10, options [nop,nop,TS val 608572179 ecr 1340268610], length 1346
21:55:06.531963 IP arch1-ext.rs.github.com.https > v1404-wn-172-21-18-151.campus-dynamic.uwaterloo.ca.63659: Flags [.], seq 44418:45764, ack 1, win 10, options [nop,nop,TS val 608572179 ecr 1340268610], length 1346
21:55:06.532039 IP v1404-wn-172-21-18-151.campus-dynamic.uwaterloo.ca.63659 > arch1-ext.rs.github.com.https: Flags [.], ack 45764, win 9842, options [nop,nop,TS val 1340268675 ecr 608572173], length 0
21:55:06.534041 IP arch1-ext.rs.github.com.https > v1404-wn-172-21-18-151.campus-dynamic.uwaterloo.ca.63659: Flags [.], seq 45764:47110, ack 1, win 10, options [nop,nop,TS val 608572179 ecr 1340268610], length 1346
21:55:06.536325 IP arch1-ext.rs.github.com.https > v1404-wn-172-21-18-151.campus-dynamic.uwaterloo.ca.63659: Flags [.], seq 47110:48456, ack 1, win 10, options [nop,nop,TS val 608572179 ecr 1340268610], length 1346
21:55:06.538619 IP arch1-ext.rs.github.com.https > v1404-wn-172-21-18-151.campus-dynamic.uwaterloo.ca.63659: Flags [.], seq 48456:49802, ack 1, win 10, options [nop,nop,TS val 608572179 ecr 1340268610], length 1346
21:55:06.540969 IP arch1-ext.rs.github.com.https > v1404-wn-172-21-18-151.campus-dynamic.uwaterloo.ca.63659: Flags [.], seq 49802:51148, ack 1, win 10, options [nop,nop,TS val 608572179 ecr 1340268610], length 1346
21:55:06.543181 IP arch1-ext.rs.github.com.https > v1404-wn-172-21-18-151.campus-dynamic.uwaterloo.ca.63659: Flags [.], seq 51148:52494, ack 1, win 10, options [nop,nop,TS val 608572179 ecr 1340268610], length 1346
21:55:06.545509 IP arch1-ext.rs.github.com.https > v1404-wn-172-21-18-151.campus-dynamic.uwaterloo.ca.63659: Flags [.], seq 52494:53840, ack 1, win 10, options [nop,nop,TS val 608572179 ecr 1340268610], length 1346
21:55:06.547770 IP arch1-ext.rs.github.com.https > v1404-wn-172-21-18-151.campus-dynamic.uwaterloo.ca.63659: Flags [.], seq 53840:55186, ack 1, win 10, options [nop,nop,TS val 608572184 ecr 1340268626], length 1346
21:55:06.550392 IP ec2-107-20-145-171.compute-1.amazonaws.com.https > v1404-wn-172-21-18-151.campus-dynamic.uwaterloo.ca.63661: Flags [.], ack 7791, win 380, options [nop,nop,TS val 727855104 ecr 1340268638], length 0
21:55:06.550810 IP ec2-107-20-145-171.compute-1.amazonaws.com.https > v1404-wn-172-21-18-151.campus-dynamic.uwaterloo.ca.63661: Flags [.], ack 9137, win 377, options [nop,nop,TS val 727855105 ecr 1340268638], length 0
21:55:06.550812 IP ec2-107-20-145-171.compute-1.amazonaws.com.https > v1404-wn-172-21-18-151.campus-dynamic.uwaterloo.ca.63661: Flags [.], ack 9549, win 374, options [nop,nop,TS val 727855105 ecr 1340268638], length 0
21:55:06.550812 IP ec2-107-20-145-171.compute-1.amazonaws.com.https > v1404-wn-172-21-18-151.campus-dynamic.uwaterloo.ca.63661: Flags [.], ack 10895, win 364, options [nop,nop,TS val 727855105 ecr 1340268638], length 0
21:55:06.551059 IP ec2-107-20-145-171.compute-1.amazonaws.com.https > v1404-wn-172-21-18-151.campus-dynamic.uwaterloo.ca.63661: Flags [.], ack 11307, win 361, options [nop,nop,TS val 727855105 ecr 1340268638], length 0
21:55:06.551428 IP arch1-ext.rs.github.com.https > v1404-wn-172-21-18-151.campus-dynamic.uwaterloo.ca.63659: Flags [.], seq 55186:56532, ack 1, win 10, options [nop,nop,TS val 608572189 ecr 1340268641], length 1346
21:55:06.551478 IP v1404-wn-172-21-18-151.campus-dynamic.uwaterloo.ca.63659 > arch1-ext.rs.github.com.https: Flags [.], ack 56532, win 9842, options [nop,nop,TS val 1340268692 ecr 608572179], length 0
21:55:06.552862 IP arch1-ext.rs.github.com.https > v1404-wn-172-21-18-151.campus-dynamic.uwaterloo.ca.63659: Flags [.], seq 56532:57878, ack 1, win 10, options [nop,nop,TS val 608572189 ecr 1340268641], length 1346
21:55:06.555234 IP arch1-ext.rs.github.com.https > v1404-wn-172-21-18-151.campus-dynamic.uwaterloo.ca.63659: Flags [.], seq 57878:59224, ack 1, win 10, options [nop,nop,TS val 608572189 ecr 1340268641], length 1346
21:55:06.557358 IP arch1-ext.rs.github.com.https > v1404-wn-172-21-18-151.campus-dynamic.uwaterloo.ca.63659: Flags [.], seq 59224:60570, ack 1, win 10, options [nop,nop,TS val 608572189 ecr 1340268641], length 1346
21:55:06.559623 IP arch1-ext.rs.github.com.https > v1404-wn-172-21-18-151.campus-dynamic.uwaterloo.ca.63659: Flags [.], seq 60570:61916, ack 1, win 10, options [nop,nop,TS val 608572189 ecr 1340268641], length 1346
21:55:06.561976 IP arch1-ext.rs.github.com.https > v1404-wn-172-21-18-151.campus-dynamic.uwaterloo.ca.63659: Flags [.], seq 61916:63262, ack 1, win 10, options [nop,nop,TS val 608572189 ecr 1340268641], length 1346
21:55:06.564273 IP arch1-ext.rs.github.com.https > v1404-wn-172-21-18-151.campus-dynamic.uwaterloo.ca.63659: Flags [.], seq 63262:64608, ack 1, win 10, options [nop,nop,TS val 608572189 ecr 1340268641], length 1346
21:55:06.567374 IP arch1-ext.rs.github.com.https > v1404-wn-172-21-18-151.campus-dynamic.uwaterloo.ca.63659: Flags [.], seq 64608:65954, ack 1, win 10, options [nop,nop,TS val 608572189 ecr 1340268641], length 1346
21:55:06.568734 IP arch1-ext.rs.github.com.https > v1404-wn-172-21-18-151.campus-dynamic.uwaterloo.ca.63659: Flags [.], seq 65954:67300, ack 1, win 10, options [nop,nop,TS val 608572189 ecr 1340268641], length 1346
21:55:06.568796 IP v1404-wn-172-21-18-151.campus-dynamic.uwaterloo.ca.63659 > arch1-ext.rs.github.com.https: Flags [.], ack 67300, win 9842, options [nop,nop,TS val 1340268707 ecr 608572189], length 0
21:55:06.571431 IP arch1-ext.rs.github.com.https > v1404-wn-172-21-18-151.campus-dynamic.uwaterloo.ca.63659: Flags [.], seq 67300:68646, ack 1, win 10, options [nop,nop,TS val 608572189 ecr 1340268641], length 1346
21:55:06.573339 IP arch1-ext.rs.github.com.https > v1404-wn-172-21-18-151.campus-dynamic.uwaterloo.ca.63659: Flags [.], seq 68646:69992, ack 1, win 10, options [nop,nop,TS val 608572189 ecr 1340268641], length 1346
21:55:06.575508 IP arch1-ext.rs.github.com.https > v1404-wn-172-21-18-151.campus-dynamic.uwaterloo.ca.63659: Flags [.], seq 69992:71338, ack 1, win 10, options [nop,nop,TS val 608572189 ecr 1340268641], length 1346
21:55:06.577857 IP arch1-ext.rs.github.com.https > v1404-wn-172-21-18-151.campus-dynamic.uwaterloo.ca.63659: Flags [.], seq 71338:72684, ack 1, win 10, options [nop,nop,TS val 608572189 ecr 1340268641], length 1346
21:55:06.580209 IP arch1-ext.rs.github.com.https > v1404-wn-172-21-18-151.campus-dynamic.uwaterloo.ca.63659: Flags [.], seq 72684:74030, ack 1, win 10, options [nop,nop,TS val 608572189 ecr 1340268641], length 1346
21:55:06.582399 IP arch1-ext.rs.github.com.https > v1404-wn-172-21-18-151.campus-dynamic.uwaterloo.ca.63659: Flags [.], seq 74030:75376, ack 1, win 10, options [nop,nop,TS val 608572189 ecr 1340268641], length 1346
21:55:06.584356 IP ec2-107-20-145-171.compute-1.amazonaws.com.https > v1404-wn-172-21-18-151.campus-dynamic.uwaterloo.ca.63661: Flags [.], ack 12653, win 377, options [nop,nop,TS val 727855105 ecr 1340268638], length 0
21:55:06.584534 IP ec2-107-20-145-171.compute-1.amazonaws.com.https > v1404-wn-172-21-18-151.campus-dynamic.uwaterloo.ca.63661: Flags [.], ack 13065, win 374, options [nop,nop,TS val 727855105 ecr 1340268638], length 0
21:55:06.584684 IP ec2-107-20-145-171.compute-1.amazonaws.com.https > v1404-wn-172-21-18-151.campus-dynamic.uwaterloo.ca.63661: Flags [.], ack 14411, win 364, options [nop,nop,TS val 727855105 ecr 1340268638], length 0
21:55:06.584903 IP ec2-107-20-145-171.compute-1.amazonaws.com.https > v1404-wn-172-21-18-151.campus-dynamic.uwaterloo.ca.63661: Flags [.], ack 14823, win 361, options [nop,nop,TS val 727855105 ecr 1340268638], length 0
21:55:06.584942 IP v1404-wn-172-21-18-151.campus-dynamic.uwaterloo.ca.63661 > ec2-107-20-145-171.compute-1.amazonaws.com.https: Flags [P.], seq 14823:15755, ack 0, win 8192, options [nop,nop,TS val 1340268719 ecr 727855105], length 932
21:55:06.585546 IP arch1-ext.rs.github.com.https > v1404-wn-172-21-18-151.campus-dynamic.uwaterloo.ca.63659: Flags [.], seq 75376:76722, ack 1, win 10, options [nop,nop,TS val 608572191 ecr 1340268649], length 1346
21:55:06.587456 IP arch1-ext.rs.github.com.https > v1404-wn-172-21-18-151.campus-dynamic.uwaterloo.ca.63659: Flags [.], seq 76722:78068, ack 1, win 10, options [nop,nop,TS val 608572191 ecr 1340268649], length 1346
21:55:06.587504 IP v1404-wn-172-21-18-151.campus-dynamic.uwaterloo.ca.63659 > arch1-ext.rs.github.com.https: Flags [.], ack 78068, win 9842, options [nop,nop,TS val 1340268721 ecr 608572189], length 0
21:55:06.589756 IP arch1-ext.rs.github.com.https > v1404-wn-172-21-18-151.campus-dynamic.uwaterloo.ca.63659: Flags [.], seq 78068:79414, ack 1, win 10, options [nop,nop,TS val 608572191 ecr 1340268649], length 1346
21:55:06.591519 IP v1404-wn-172-21-18-151.campus-dynamic.uwaterloo.ca.63661 > ec2-107-20-145-171.compute-1.amazonaws.com.https: Flags [.], seq 15755:17101, ack 0, win 8192, options [nop,nop,TS val 1340268724 ecr 727855105], length 1346
21:55:06.591520 IP v1404-wn-172-21-18-151.campus-dynamic.uwaterloo.ca.63661 > ec2-107-20-145-171.compute-1.amazonaws.com.https: Flags [P.], seq 17101:17513, ack 0, win 8192, options [nop,nop,TS val 1340268724 ecr 727855105], length 412
21:55:06.591702 IP v1404-wn-172-21-18-151.campus-dynamic.uwaterloo.ca.63661 > ec2-107-20-145-171.compute-1.amazonaws.com.https: Flags [.], seq 17513:18859, ack 0, win 8192, options [nop,nop,TS val 1340268724 ecr 727855105], length 1346
21:55:06.591703 IP v1404-wn-172-21-18-151.campus-dynamic.uwaterloo.ca.63661 > ec2-107-20-145-171.compute-1.amazonaws.com.https: Flags [P.], seq 18859:19271, ack 0, win 8192, options [nop,nop,TS val 1340268724 ecr 727855105], length 412
21:55:06.591866 IP v1404-wn-172-21-18-151.campus-dynamic.uwaterloo.ca.63661 > ec2-107-20-145-171.compute-1.amazonaws.com.https: Flags [.], seq 19271:20617, ack 0, win 8192, options [nop,nop,TS val 1340268724 ecr 727855105], length 1346
21:55:06.591867 IP v1404-wn-172-21-18-151.campus-dynamic.uwaterloo.ca.63661 > ec2-107-20-145-171.compute-1.amazonaws.com.https: Flags [P.], seq 20617:21029, ack 0, win 8192, options [nop,nop,TS val 1340268724 ecr 727855105], length 412
21:55:06.592083 IP v1404-wn-172-21-18-151.campus-dynamic.uwaterloo.ca.63661 > ec2-107-20-145-171.compute-1.amazonaws.com.https: Flags [.], seq 21029:22375, ack 0, win 8192, options [nop,nop,TS val 1340268724 ecr 727855105], length 1346
21:55:06.592084 IP v1404-wn-172-21-18-151.campus-dynamic.uwaterloo.ca.63661 > ec2-107-20-145-171.compute-1.amazonaws.com.https: Flags [P.], seq 22375:22787, ack 0, win 8192, options [nop,nop,TS val 1340268724 ecr 727855105], length 412
21:55:06.592199 IP v1404-wn-172-21-18-151.campus-dynamic.uwaterloo.ca.63661 > ec2-107-20-145-171.compute-1.amazonaws.com.https: Flags [.], seq 22787:24133, ack 0, win 8192, options [nop,nop,TS val 1340268724 ecr 727855105], length 1346
21:55:06.592200 IP v1404-wn-172-21-18-151.campus-dynamic.uwaterloo.ca.63661 > ec2-107-20-145-171.compute-1.amazonaws.com.https: Flags [P.], seq 24133:24305, ack 0, win 8192, options [nop,nop,TS val 1340268724 ecr 727855105], length 172
21:55:06.592258 IP arch1-ext.rs.github.com.https > v1404-wn-172-21-18-151.campus-dynamic.uwaterloo.ca.63659: Flags [.], seq 79414:80760, ack 1, win 10, options [nop,nop,TS val 608572191 ecr 1340268649], length 1346
21:55:06.594254 IP arch1-ext.rs.github.com.https > v1404-wn-172-21-18-151.campus-dynamic.uwaterloo.ca.63659: Flags [.], seq 80760:82106, ack 1, win 10, options [nop,nop,TS val 608572193 ecr 1340268655], length 1346
21:55:06.596519 IP arch1-ext.rs.github.com.https > v1404-wn-172-21-18-151.campus-dynamic.uwaterloo.ca.63659: Flags [.], seq 82106:83452, ack 1, win 10, options [nop,nop,TS val 608572193 ecr 1340268655], length 1346
21:55:06.598767 IP arch1-ext.rs.github.com.https > v1404-wn-172-21-18-151.campus-dynamic.uwaterloo.ca.63659: Flags [.], seq 83452:84798, ack 1, win 10, options [nop,nop,TS val 608572193 ecr 1340268655], length 1346
21:55:06.600939 IP arch1-ext.rs.github.com.https > v1404-wn-172-21-18-151.campus-dynamic.uwaterloo.ca.63659: Flags [.], seq 84798:86144, ack 1, win 10, options [nop,nop,TS val 608572198 ecr 1340268675], length 1346
21:55:06.603325 IP arch1-ext.rs.github.com.https > v1404-wn-172-21-18-151.campus-dynamic.uwaterloo.ca.63659: Flags [.], seq 86144:87490, ack 1, win 10, options [nop,nop,TS val 608572198 ecr 1340268675], length 1346
21:55:06.605545 IP arch1-ext.rs.github.com.https > v1404-wn-172-21-18-151.campus-dynamic.uwaterloo.ca.63659: Flags [.], seq 87490:88836, ack 1, win 10, options [nop,nop,TS val 608572198 ecr 1340268675], length 1346
21:55:06.605615 IP v1404-wn-172-21-18-151.campus-dynamic.uwaterloo.ca.63659 > arch1-ext.rs.github.com.https: Flags [.], ack 88836, win 9842, options [nop,nop,TS val 1340268736 ecr 608572191], length 0
21:55:06.607884 IP arch1-ext.rs.github.com.https > v1404-wn-172-21-18-151.campus-dynamic.uwaterloo.ca.63659: Flags [.], seq 88836:90182, ack 1, win 10, options [nop,nop,TS val 608572198 ecr 1340268675], length 1346
21:55:06.610149 IP arch1-ext.rs.github.com.https > v1404-wn-172-21-18-151.campus-dynamic.uwaterloo.ca.63659: Flags [.], seq 90182:91528, ack 1, win 10, options [nop,nop,TS val 608572198 ecr 1340268675], length 1346
21:55:06.612444 IP arch1-ext.rs.github.com.https > v1404-wn-172-21-18-151.campus-dynamic.uwaterloo.ca.63659: Flags [.], seq 91528:92874, ack 1, win 10, options [nop,nop,TS val 608572198 ecr 1340268675], length 1346
21:55:06.614658 IP arch1-ext.rs.github.com.https > v1404-wn-172-21-18-151.campus-dynamic.uwaterloo.ca.63659: Flags [.], seq 92874:94220, ack 1, win 10, options [nop,nop,TS val 608572198 ecr 1340268675], length 1346
21:55:06.616990 IP arch1-ext.rs.github.com.https > v1404-wn-172-21-18-151.campus-dynamic.uwaterloo.ca.63659: Flags [.], seq 94220:95566, ack 1, win 10, options [nop,nop,TS val 608572198 ecr 1340268675], length 1346
21:55:06.619358 IP arch1-ext.rs.github.com.https > v1404-wn-172-21-18-151.campus-dynamic.uwaterloo.ca.63659: Flags [.], seq 95566:96912, ack 1, win 10, options [nop,nop,TS val 608572198 ecr 1340268675], length 1346
21:55:06.619423 IP v1404-wn-172-21-18-151.campus-dynamic.uwaterloo.ca.63659 > arch1-ext.rs.github.com.https: Flags [.], ack 96912, win 9842, options [nop,nop,TS val 1340268748 ecr 608572198], length 0
21:55:06.621425 IP arch1-ext.rs.github.com.https > v1404-wn-172-21-18-151.campus-dynamic.uwaterloo.ca.63659: Flags [.], seq 96912:98258, ack 1, win 10, options [nop,nop,TS val 608572198 ecr 1340268675], length 1346
21:55:06.621493 IP v1404-wn-172-21-18-151.campus-dynamic.uwaterloo.ca.63659 > arch1-ext.rs.github.com.https: Flags [.], ack 98258, win 9926, options [nop,nop,TS val 1340268750 ecr 608572198], length 0
21:55:06.623748 IP arch1-ext.rs.github.com.https > v1404-wn-172-21-18-151.campus-dynamic.uwaterloo.ca.63659: Flags [.], seq 98258:99604, ack 1, win 10, options [nop,nop,TS val 608572207 ecr 1340268707], length 1346
21:55:06.626086 IP arch1-ext.rs.github.com.https > v1404-wn-172-21-18-151.campus-dynamic.uwaterloo.ca.63659: Flags [.], seq 99604:100950, ack 1, win 10, options [nop,nop,TS val 608572207 ecr 1340268707], length 1346
21:55:06.626143 IP v1404-wn-172-21-18-151.campus-dynamic.uwaterloo.ca.63659 > arch1-ext.rs.github.com.https: Flags [.], ack 100950, win 9842, options [nop,nop,TS val 1340268754 ecr 608572207], length 0
21:55:06.628380 IP arch1-ext.rs.github.com.https > v1404-wn-172-21-18-151.campus-dynamic.uwaterloo.ca.63659: Flags [.], seq 100950:102296, ack 1, win 10, options [nop,nop,TS val 608572207 ecr 1340268707], length 1346
21:55:06.628458 IP v1404-wn-172-21-18-151.campus-dynamic.uwaterloo.ca.63659 > arch1-ext.rs.github.com.https: Flags [.], ack 102296, win 9926, options [nop,nop,TS val 1340268756 ecr 608572207], length 0
21:55:06.630588 IP arch1-ext.rs.github.com.https > v1404-wn-172-21-18-151.campus-dynamic.uwaterloo.ca.63659: Flags [.], seq 102296:103642, ack 1, win 10, options [nop,nop,TS val 608572207 ecr 1340268707], length 1346
21:55:06.632835 IP arch1-ext.rs.github.com.https > v1404-wn-172-21-18-151.campus-dynamic.uwaterloo.ca.63659: Flags [.], seq 103642:104988, ack 1, win 10, options [nop,nop,TS val 608572207 ecr 1340268707], length 1346
21:55:06.632900 IP v1404-wn-172-21-18-151.campus-dynamic.uwaterloo.ca.63659 > arch1-ext.rs.github.com.https: Flags [.], ack 104988, win 9842, options [nop,nop,TS val 1340268760 ecr 608572207], length 0
21:55:06.635170 IP arch1-ext.rs.github.com.https > v1404-wn-172-21-18-151.campus-dynamic.uwaterloo.ca.63659: Flags [.], seq 104988:106334, ack 1, win 10, options [nop,nop,TS val 608572207 ecr 1340268707], length 1346
21:55:06.637441 IP arch1-ext.rs.github.com.https > v1404-wn-172-21-18-151.campus-dynamic.uwaterloo.ca.63659: Flags [.], seq 106334:107680, ack 1, win 10, options [nop,nop,TS val 608572207 ecr 1340268707], length 1346
21:55:06.639640 IP arch1-ext.rs.github.com.https > v1404-wn-172-21-18-151.campus-dynamic.uwaterloo.ca.63659: Flags [.], seq 107680:109026, ack 1, win 10, options [nop,nop,TS val 608572207 ecr 1340268707], length 1346
21:55:06.642103 IP arch1-ext.rs.github.com.https > v1404-wn-172-21-18-151.campus-dynamic.uwaterloo.ca.63659: Flags [.], seq 109026:110372, ack 1, win 10, options [nop,nop,TS val 608572207 ecr 1340268707], length 1346
21:55:06.644275 IP arch1-ext.rs.github.com.https > v1404-wn-172-21-18-151.campus-dynamic.uwaterloo.ca.63659: Flags [.], seq 110372:111718, ack 1, win 10, options [nop,nop,TS val 608572207 ecr 1340268707], length 1346
21:55:06.646512 IP arch1-ext.rs.github.com.https > v1404-wn-172-21-18-151.campus-dynamic.uwaterloo.ca.63659: Flags [.], seq 111718:113064, ack 1, win 10, options [nop,nop,TS val 608572207 ecr 1340268707], length 1346
21:55:06.648767 IP arch1-ext.rs.github.com.https > v1404-wn-172-21-18-151.campus-dynamic.uwaterloo.ca.63659: Flags [.], seq 113064:114410, ack 1, win 10, options [nop,nop,TS val 608572207 ecr 1340268707], length 1346
21:55:06.651189 IP arch1-ext.rs.github.com.https > v1404-wn-172-21-18-151.campus-dynamic.uwaterloo.ca.63659: Flags [.], seq 114410:115756, ack 1, win 10, options [nop,nop,TS val 608572207 ecr 1340268707], length 1346
21:55:06.651341 IP v1404-wn-172-21-18-151.campus-dynamic.uwaterloo.ca.63659 > arch1-ext.rs.github.com.https: Flags [.], ack 115756, win 9842, options [nop,nop,TS val 1340268776 ecr 608572207], length 0
21:55:06.653275 IP arch1-ext.rs.github.com.https > v1404-wn-172-21-18-151.campus-dynamic.uwaterloo.ca.63659: Flags [.], seq 115756:117102, ack 1, win 10, options [nop,nop,TS val 608572207 ecr 1340268707], length 1346
21:55:06.655563 IP arch1-ext.rs.github.com.https > v1404-wn-172-21-18-151.campus-dynamic.uwaterloo.ca.63659: Flags [.], seq 117102:118448, ack 1, win 10, options [nop,nop,TS val 608572207 ecr 1340268707], length 1346
21:55:06.657968 IP arch1-ext.rs.github.com.https > v1404-wn-172-21-18-151.campus-dynamic.uwaterloo.ca.63659: Flags [.], seq 118448:119794, ack 1, win 10, options [nop,nop,TS val 608572207 ecr 1340268707], length 1346
21:55:06.659964 IP ec2-107-20-145-171.compute-1.amazonaws.com.https > v1404-wn-172-21-18-151.campus-dynamic.uwaterloo.ca.63661: Flags [.], ack 15755, win 378, options [nop,nop,TS val 727855128 ecr 1340268719], length 0
21:55:06.660027 IP ec2-107-20-145-171.compute-1.amazonaws.com.https > v1404-wn-172-21-18-151.campus-dynamic.uwaterloo.ca.63661: Flags [.], ack 17101, win 377, options [nop,nop,TS val 727855130 ecr 1340268724], length 0
21:55:06.660267 IP ec2-107-20-145-171.compute-1.amazonaws.com.https > v1404-wn-172-21-18-151.campus-dynamic.uwaterloo.ca.63661: Flags [.], ack 17513, win 374, options [nop,nop,TS val 727855130 ecr 1340268724], length 0
21:55:06.660494 IP ec2-107-20-145-171.compute-1.amazonaws.com.https > v1404-wn-172-21-18-151.campus-dynamic.uwaterloo.ca.63661: Flags [.], ack 18859, win 364, options [nop,nop,TS val 727855130 ecr 1340268724], length 0
21:55:06.660666 IP ec2-107-20-145-171.compute-1.amazonaws.com.https > v1404-wn-172-21-18-151.campus-dynamic.uwaterloo.ca.63661: Flags [.], ack 19271, win 380, options [nop,nop,TS val 727855130 ecr 1340268724], length 0
21:55:06.660913 IP ec2-107-20-145-171.compute-1.amazonaws.com.https > v1404-wn-172-21-18-151.campus-dynamic.uwaterloo.ca.63661: Flags [.], ack 24305, win 386, options [nop,nop,TS val 727855130 ecr 1340268724], length 0
21:55:06.661213 IP arch1-ext.rs.github.com.https > v1404-wn-172-21-18-151.campus-dynamic.uwaterloo.ca.63659: Flags [.], seq 119794:121140, ack 1, win 10, options [nop,nop,TS val 608572217 ecr 1340268736], length 1346
21:55:06.663182 IP arch1-ext.rs.github.com.https > v1404-wn-172-21-18-151.campus-dynamic.uwaterloo.ca.63659: Flags [.], seq 121140:122486, ack 1, win 10, options [nop,nop,TS val 608572217 ecr 1340268736], length 1346
21:55:06.665399 IP arch1-ext.rs.github.com.https > v1404-wn-172-21-18-151.campus-dynamic.uwaterloo.ca.63659: Flags [.], seq 122486:123832, ack 1, win 10, options [nop,nop,TS val 608572217 ecr 1340268736], length 1346
21:55:06.669745 IP arch1-ext.rs.github.com.https > v1404-wn-172-21-18-151.campus-dynamic.uwaterloo.ca.63659: Flags [.], seq 123832:125178, ack 1, win 10, options [nop,nop,TS val 608572217 ecr 1340268736], length 1346
21:55:06.670048 IP arch1-ext.rs.github.com.https > v1404-wn-172-21-18-151.campus-dynamic.uwaterloo.ca.63659: Flags [.], seq 125178:126524, ack 1, win 10, options [nop,nop,TS val 608572217 ecr 1340268736], length 1346
21:55:06.670102 IP v1404-wn-172-21-18-151.campus-dynamic.uwaterloo.ca.63659 > arch1-ext.rs.github.com.https: Flags [.], ack 126524, win 9842, options [nop,nop,TS val 1340268791 ecr 608572207], length 0
21:55:06.672278 IP arch1-ext.rs.github.com.https > v1404-wn-172-21-18-151.campus-dynamic.uwaterloo.ca.63659: Flags [.], seq 126524:127870, ack 1, win 10, options [nop,nop,TS val 608572217 ecr 1340268736], length 1346
21:55:06.674495 IP arch1-ext.rs.github.com.https > v1404-wn-172-21-18-151.campus-dynamic.uwaterloo.ca.63659: Flags [.], seq 127870:129216, ack 1, win 10, options [nop,nop,TS val 608572217 ecr 1340268736], length 1346
21:55:06.676916 IP arch1-ext.rs.github.com.https > v1404-wn-172-21-18-151.campus-dynamic.uwaterloo.ca.63659: Flags [.], seq 129216:130562, ack 1, win 10, options [nop,nop,TS val 608572217 ecr 1340268736], length 1346
21:55:06.679085 IP arch1-ext.rs.github.com.https > v1404-wn-172-21-18-151.campus-dynamic.uwaterloo.ca.63659: Flags [.], seq 130562:131908, ack 1, win 10, options [nop,nop,TS val 608572217 ecr 1340268736], length 1346
21:55:06.681311 IP arch1-ext.rs.github.com.https > v1404-wn-172-21-18-151.campus-dynamic.uwaterloo.ca.63659: Flags [.], seq 131908:133254, ack 1, win 10, options [nop,nop,TS val 608572217 ecr 1340268736], length 1346
21:55:06.683656 IP arch1-ext.rs.github.com.https > v1404-wn-172-21-18-151.campus-dynamic.uwaterloo.ca.63659: Flags [.], seq 133254:134600, ack 1, win 10, options [nop,nop,TS val 608572217 ecr 1340268736], length 1346
21:55:06.685987 IP arch1-ext.rs.github.com.https > v1404-wn-172-21-18-151.campus-dynamic.uwaterloo.ca.63659: Flags [.], seq 134600:135946, ack 1, win 10, options [nop,nop,TS val 608572217 ecr 1340268736], length 1346
21:55:06.688280 IP arch1-ext.rs.github.com.https > v1404-wn-172-21-18-151.campus-dynamic.uwaterloo.ca.63659: Flags [.], seq 135946:137292, ack 1, win 10, options [nop,nop,TS val 608572217 ecr 1340268736], length 1346
21:55:06.688377 IP v1404-wn-172-21-18-151.campus-dynamic.uwaterloo.ca.63659 > arch1-ext.rs.github.com.https: Flags [.], ack 137292, win 9842, options [nop,nop,TS val 1340268807 ecr 608572217], length 0
21:55:06.690398 IP arch1-ext.rs.github.com.https > v1404-wn-172-21-18-151.campus-dynamic.uwaterloo.ca.63659: Flags [.], seq 137292:138638, ack 1, win 10, options [nop,nop,TS val 608572217 ecr 1340268736], length 1346
21:55:06.691831 IP v1404-wn-172-21-18-151.campus-dynamic.uwaterloo.ca.63661 > ec2-107-20-145-171.compute-1.amazonaws.com.https: Flags [P.], seq 24305:24891, ack 0, win 8192, options [nop,nop,TS val 1340268810 ecr 727855130], length 586
21:55:06.691995 IP v1404-wn-172-21-18-151.campus-dynamic.uwaterloo.ca.63661 > ec2-107-20-145-171.compute-1.amazonaws.com.https: Flags [.], seq 24891:26237, ack 0, win 8192, options [nop,nop,TS val 1340268810 ecr 727855130], length 1346
21:55:06.691996 IP v1404-wn-172-21-18-151.campus-dynamic.uwaterloo.ca.63661 > ec2-107-20-145-171.compute-1.amazonaws.com.https: Flags [P.], seq 26237:26649, ack 0, win 8192, options [nop,nop,TS val 1340268810 ecr 727855130], length 412
21:55:06.692160 IP v1404-wn-172-21-18-151.campus-dynamic.uwaterloo.ca.63661 > ec2-107-20-145-171.compute-1.amazonaws.com.https: Flags [.], seq 26649:27995, ack 0, win 8192, options [nop,nop,TS val 1340268810 ecr 727855130], length 1346
21:55:06.692161 IP v1404-wn-172-21-18-151.campus-dynamic.uwaterloo.ca.63661 > ec2-107-20-145-171.compute-1.amazonaws.com.https: Flags [P.], seq 27995:28407, ack 0, win 8192, options [nop,nop,TS val 1340268810 ecr 727855130], length 412
21:55:06.692332 IP v1404-wn-172-21-18-151.campus-dynamic.uwaterloo.ca.63661 > ec2-107-20-145-171.compute-1.amazonaws.com.https: Flags [.], seq 28407:29753, ack 0, win 8192, options [nop,nop,TS val 1340268810 ecr 727855130], length 1346
21:55:06.692332 IP v1404-wn-172-21-18-151.campus-dynamic.uwaterloo.ca.63661 > ec2-107-20-145-171.compute-1.amazonaws.com.https: Flags [P.], seq 29753:30165, ack 0, win 8192, options [nop,nop,TS val 1340268810 ecr 727855130], length 412
21:55:06.692484 IP v1404-wn-172-21-18-151.campus-dynamic.uwaterloo.ca.63661 > ec2-107-20-145-171.compute-1.amazonaws.com.https: Flags [.], seq 30165:31511, ack 0, win 8192, options [nop,nop,TS val 1340268810 ecr 727855130], length 1346
21:55:06.692485 IP v1404-wn-172-21-18-151.campus-dynamic.uwaterloo.ca.63661 > ec2-107-20-145-171.compute-1.amazonaws.com.https: Flags [P.], seq 31511:31923, ack 0, win 8192, options [nop,nop,TS val 1340268810 ecr 727855130], length 412
21:55:06.692802 IP arch1-ext.rs.github.com.https > v1404-wn-172-21-18-151.campus-dynamic.uwaterloo.ca.63659: Flags [.], seq 138638:139984, ack 1, win 10, options [nop,nop,TS val 608572217 ecr 1340268736], length 1346
21:55:06.694985 IP arch1-ext.rs.github.com.https > v1404-wn-172-21-18-151.campus-dynamic.uwaterloo.ca.63659: Flags [.], seq 139984:141330, ack 1, win 10, options [nop,nop,TS val 608572217 ecr 1340268736], length 1346
21:55:06.697283 IP arch1-ext.rs.github.com.https > v1404-wn-172-21-18-151.campus-dynamic.uwaterloo.ca.63659: Flags [.], seq 141330:142676, ack 1, win 10, options [nop,nop,TS val 608572221 ecr 1340268750], length 1346
21:55:06.699515 IP arch1-ext.rs.github.com.https > v1404-wn-172-21-18-151.campus-dynamic.uwaterloo.ca.63659: Flags [.], seq 142676:144022, ack 1, win 10, options [nop,nop,TS val 608572221 ecr 1340268750], length 1346
21:55:06.701895 IP arch1-ext.rs.github.com.https > v1404-wn-172-21-18-151.campus-dynamic.uwaterloo.ca.63659: Flags [.], seq 144022:145368, ack 1, win 10, options [nop,nop,TS val 608572221 ecr 1340268750], length 1346
21:55:06.704080 IP arch1-ext.rs.github.com.https > v1404-wn-172-21-18-151.campus-dynamic.uwaterloo.ca.63659: Flags [.], seq 145368:146714, ack 1, win 10, options [nop,nop,TS val 608572221 ecr 1340268750], length 1346
21:55:06.706367 IP arch1-ext.rs.github.com.https > v1404-wn-172-21-18-151.campus-dynamic.uwaterloo.ca.63659: Flags [.], seq 146714:148060, ack 1, win 10, options [nop,nop,TS val 608572221 ecr 1340268750], length 1346
21:55:06.706492 IP v1404-wn-172-21-18-151.campus-dynamic.uwaterloo.ca.63659 > arch1-ext.rs.github.com.https: Flags [.], ack 148060, win 9842, options [nop,nop,TS val 1340268822 ecr 608572217], length 0
