22:20:06.976984 IP v1404-wn-172-21-18-151.campus-dynamic.uwaterloo.ca.59012 > ie-in-f109.1e100.net.imaps: Flags [P.], seq 691072507:691072538, ack 4195970547, win 8192, options [nop,nop,TS val 1341742468 ecr 1587211016], length 31
22:20:06.978179 IP v1404-wn-172-21-18-151.campus-dynamic.uwaterloo.ca.59011 > ie-in-f109.1e100.net.imaps: Flags [P.], seq 896116735:896116775, ack 3481624696, win 8192, options [nop,nop,TS val 1341742469 ecr 960421555], length 40
22:20:06.980554 IP v1404-wn-172-21-18-151.campus-dynamic.uwaterloo.ca.59013 > ie-in-f108.1e100.net.imaps: Flags [P.], seq 2215254309:2215254348, ack 298851295, win 12450, options [nop,nop,TS val 1341742471 ecr 1127601621], length 39
22:20:06.981320 IP v1404-wn-172-21-18-151.campus-dynamic.uwaterloo.ca.59032 > ie-in-f108.1e100.net.imaps: Flags [P.], seq 917451635:917451674, ack 4238913451, win 8192, options [nop,nop,TS val 1341742471 ecr 1587378056], length 39
22:20:07.016066 IP ie-in-f109.1e100.net.imaps > v1404-wn-172-21-18-151.campus-dynamic.uwaterloo.ca.59012: Flags [.], ack 31, win 1002, options [nop,nop,TS val 1587510103 ecr 1341742468], length 0
22:20:07.040469 IP ie-in-f108.1e100.net.imaps > v1404-wn-172-21-18-151.campus-dynamic.uwaterloo.ca.59032: Flags [P.], seq 1:46, ack 39, win 1002, options [nop,nop,TS val 1587510127 ecr 1341742471], length 45
22:20:07.040601 IP v1404-wn-172-21-18-151.campus-dynamic.uwaterloo.ca.59032 > ie-in-f108.1e100.net.imaps: Flags [.], ack 46, win 8189, options [nop,nop,TS val 1341742529 ecr 1587510127], length 0
22:20:07.040809 IP ie-in-f108.1e100.net.imaps > v1404-wn-172-21-18-151.campus-dynamic.uwaterloo.ca.59013: Flags [P.], seq 1:46, ack 39, win 524, options [nop,nop,TS val 1127728580 ecr 1341742471], length 45
22:20:07.040946 IP v1404-wn-172-21-18-151.campus-dynamic.uwaterloo.ca.59013 > ie-in-f108.1e100.net.imaps: Flags [.], ack 46, win 12447, options [nop,nop,TS val 1341742529 ecr 1127728580], length 0
22:20:07.046696 IP ie-in-f109.1e100.net.imaps > v1404-wn-172-21-18-151.campus-dynamic.uwaterloo.ca.59011: Flags [P.], seq 1:47, ack 40, win 1002, options [nop,nop,TS val 960548443 ecr 1341742469], length 46
22:20:07.046878 IP v1404-wn-172-21-18-151.campus-dynamic.uwaterloo.ca.59011 > ie-in-f109.1e100.net.imaps: Flags [.], ack 47, win 8189, options [nop,nop,TS val 1341742535 ecr 960548443], length 0
22:20:07.048873 IP v1404-wn-172-21-18-151.campus-dynamic.uwaterloo.ca.59011 > ie-in-f109.1e100.net.imaps: Flags [P.], seq 40:118, ack 47, win 8192, options [nop,nop,TS val 1341742537 ecr 960548443], length 78
22:20:07.051552 IP v1404-wn-172-21-18-151.campus-dynamic.uwaterloo.ca.59011 > ie-in-f109.1e100.net.imaps: Flags [.], seq 118:1464, ack 47, win 8192, options [nop,nop,TS val 1341742539 ecr 960548443], length 1346
22:20:07.051554 IP v1404-wn-172-21-18-151.campus-dynamic.uwaterloo.ca.59011 > ie-in-f109.1e100.net.imaps: Flags [P.], seq 1464:1513, ack 47, win 8192, options [nop,nop,TS val 1341742539 ecr 960548443], length 49
22:20:07.091057 IP ie-in-f109.1e100.net.imaps > v1404-wn-172-21-18-151.campus-dynamic.uwaterloo.ca.59011: Flags [.], ack 1464, win 1002, options [nop,nop,TS val 960548488 ecr 1341742537], length 0
22:20:07.119359 IP ie-in-f109.1e100.net.imaps > v1404-wn-172-21-18-151.campus-dynamic.uwaterloo.ca.59012: Flags [P.], seq 1:65, ack 31, win 1002, options [nop,nop,TS val 1587510206 ecr 1341742468], length 64
22:20:07.119479 IP v1404-wn-172-21-18-151.campus-dynamic.uwaterloo.ca.59012 > ie-in-f109.1e100.net.imaps: Flags [.], ack 65, win 8188, options [nop,nop,TS val 1341742607 ecr 1587510206], length 0
22:20:07.126831 IP v1404-wn-172-21-18-151.campus-dynamic.uwaterloo.ca.59012 > ie-in-f109.1e100.net.imaps: Flags [P.], seq 31:71, ack 65, win 8192, options [nop,nop,TS val 1341742614 ecr 1587510206], length 40
22:20:07.130898 IP ie-in-f109.1e100.net.imaps > v1404-wn-172-21-18-151.campus-dynamic.uwaterloo.ca.59011: Flags [.], ack 1513, win 1002, options [nop,nop,TS val 960548528 ecr 1341742539], length 0
22:20:07.131023 IP v1404-wn-172-21-18-151.campus-dynamic.uwaterloo.ca.59011 > ie-in-f109.1e100.net.imaps: Flags [P.], seq 1513:2192, ack 47, win 8192, options [nop,nop,TS val 1341742618 ecr 960548528], length 679
22:20:07.162881 IP ie-in-f109.1e100.net.imaps > v1404-wn-172-21-18-151.campus-dynamic.uwaterloo.ca.59012: Flags [.], ack 71, win 1002, options [nop,nop,TS val 1587510250 ecr 1341742614], length 0
22:20:07.169684 IP ie-in-f109.1e100.net.imaps > v1404-wn-172-21-18-151.campus-dynamic.uwaterloo.ca.59011: Flags [.], ack 2192, win 1002, options [nop,nop,TS val 960548566 ecr 1341742618], length 0
22:20:07.172400 IP ie-in-f109.1e100.net.imaps > v1404-wn-172-21-18-151.campus-dynamic.uwaterloo.ca.59011: Flags [P.], seq 47:150, ack 2192, win 1002, options [nop,nop,TS val 960548569 ecr 1341742618], length 103
22:20:07.172511 IP v1404-wn-172-21-18-151.campus-dynamic.uwaterloo.ca.59011 > ie-in-f109.1e100.net.imaps: Flags [.], ack 150, win 8185, options [nop,nop,TS val 1341742657 ecr 960548569], length 0
22:20:07.173273 IP ie-in-f109.1e100.net.imaps > v1404-wn-172-21-18-151.campus-dynamic.uwaterloo.ca.59011: Flags [P.], seq 150:246, ack 2192, win 1002, options [nop,nop,TS val 960548570 ecr 1341742618], length 96
22:20:07.173337 IP v1404-wn-172-21-18-151.campus-dynamic.uwaterloo.ca.59011 > ie-in-f109.1e100.net.imaps: Flags [.], ack 246, win 8186, options [nop,nop,TS val 1341742657 ecr 960548570], length 0
22:20:07.173829 IP ie-in-f109.1e100.net.imaps > v1404-wn-172-21-18-151.campus-dynamic.uwaterloo.ca.59011: Flags [P.], seq 246:347, ack 2192, win 1002, options [nop,nop,TS val 960548571 ecr 1341742618], length 101
22:20:07.173872 IP v1404-wn-172-21-18-151.campus-dynamic.uwaterloo.ca.59011 > ie-in-f109.1e100.net.imaps: Flags [.], ack 347, win 8185, options [nop,nop,TS val 1341742658 ecr 960548571], length 0
22:20:07.174492 IP ie-in-f109.1e100.net.imaps > v1404-wn-172-21-18-151.campus-dynamic.uwaterloo.ca.59011: Flags [P.], seq 347:445, ack 2192, win 1002, options [nop,nop,TS val 960548571 ecr 1341742618], length 98
22:20:07.174530 IP v1404-wn-172-21-18-151.campus-dynamic.uwaterloo.ca.59011 > ie-in-f109.1e100.net.imaps: Flags [.], ack 445, win 8185, options [nop,nop,TS val 1341742658 ecr 960548571], length 0
22:20:07.175161 IP ie-in-f109.1e100.net.imaps > v1404-wn-172-21-18-151.campus-dynamic.uwaterloo.ca.59011: Flags [P.], seq 445:542, ack 2192, win 1002, options [nop,nop,TS val 960548572 ecr 1341742618], length 97
22:20:07.175198 IP v1404-wn-172-21-18-151.campus-dynamic.uwaterloo.ca.59011 > ie-in-f109.1e100.net.imaps: Flags [.], ack 542, win 8185, options [nop,nop,TS val 1341742659 ecr 960548572], length 0
22:20:07.176247 IP ie-in-f109.1e100.net.imaps > v1404-wn-172-21-18-151.campus-dynamic.uwaterloo.ca.59011: Flags [P.], seq 542:639, ack 2192, win 1002, options [nop,nop,TS val 960548573 ecr 1341742618], length 97
22:20:07.176285 IP v1404-wn-172-21-18-151.campus-dynamic.uwaterloo.ca.59011 > ie-in-f109.1e100.net.imaps: Flags [.], ack 639, win 8185, options [nop,nop,TS val 1341742660 ecr 960548573], length 0
22:20:07.176816 IP ie-in-f109.1e100.net.imaps > v1404-wn-172-21-18-151.campus-dynamic.uwaterloo.ca.59011: Flags [P.], seq 639:734, ack 2192, win 1002, options [nop,nop,TS val 960548574 ecr 1341742618], length 95
22:20:07.176856 IP v1404-wn-172-21-18-151.campus-dynamic.uwaterloo.ca.59011 > ie-in-f109.1e100.net.imaps: Flags [.], ack 734, win 8186, options [nop,nop,TS val 1341742660 ecr 960548574], length 0
22:20:07.177506 IP ie-in-f109.1e100.net.imaps > v1404-wn-172-21-18-151.campus-dynamic.uwaterloo.ca.59011: Flags [P.], seq 734:831, ack 2192, win 1002, options [nop,nop,TS val 960548574 ecr 1341742618], length 97
22:20:07.177541 IP v1404-wn-172-21-18-151.campus-dynamic.uwaterloo.ca.59011 > ie-in-f109.1e100.net.imaps: Flags [.], ack 831, win 8185, options [nop,nop,TS val 1341742661 ecr 960548574], length 0
22:20:07.178212 IP ie-in-f109.1e100.net.imaps > v1404-wn-172-21-18-151.campus-dynamic.uwaterloo.ca.59011: Flags [P.], seq 831:927, ack 2192, win 1002, options [nop,nop,TS val 960548575 ecr 1341742618], length 96
22:20:07.178246 IP v1404-wn-172-21-18-151.campus-dynamic.uwaterloo.ca.59011 > ie-in-f109.1e100.net.imaps: Flags [.], ack 927, win 8186, options [nop,nop,TS val 1341742661 ecr 960548575], length 0
22:20:07.178743 IP ie-in-f109.1e100.net.imaps > v1404-wn-172-21-18-151.campus-dynamic.uwaterloo.ca.59011: Flags [P.], seq 927:1025, ack 2192, win 1002, options [nop,nop,TS val 960548576 ecr 1341742618], length 98
22:20:07.178778 IP v1404-wn-172-21-18-151.campus-dynamic.uwaterloo.ca.59011 > ie-in-f109.1e100.net.imaps: Flags [.], ack 1025, win 8185, options [nop,nop,TS val 1341742662 ecr 960548576], length 0
22:20:07.180057 IP ie-in-f109.1e100.net.imaps > v1404-wn-172-21-18-151.campus-dynamic.uwaterloo.ca.59011: Flags [P.], seq 1025:1121, ack 2192, win 1002, options [nop,nop,TS val 960548577 ecr 1341742618], length 96
22:20:07.180221 IP v1404-wn-172-21-18-151.campus-dynamic.uwaterloo.ca.59011 > ie-in-f109.1e100.net.imaps: Flags [.], ack 1121, win 8186, options [nop,nop,TS val 1341742663 ecr 960548577], length 0
22:20:07.180806 IP ie-in-f109.1e100.net.imaps > v1404-wn-172-21-18-151.campus-dynamic.uwaterloo.ca.59011: Flags [P.], seq 1121:1218, ack 2192, win 1002, options [nop,nop,TS val 960548577 ecr 1341742618], length 97
22:20:07.180866 IP v1404-wn-172-21-18-151.campus-dynamic.uwaterloo.ca.59011 > ie-in-f109.1e100.net.imaps: Flags [.], ack 1218, win 8185, options [nop,nop,TS val 1341742663 ecr 960548577], length 0
22:20:07.181419 IP ie-in-f109.1e100.net.imaps > v1404-wn-172-21-18-151.campus-dynamic.uwaterloo.ca.59011: Flags [P.], seq 1218:1316, ack 2192, win 1002, options [nop,nop,TS val 960548578 ecr 1341742618], length 98
22:20:07.181474 IP v1404-wn-172-21-18-151.campus-dynamic.uwaterloo.ca.59011 > ie-in-f109.1e100.net.imaps: Flags [.], ack 1316, win 8185, options [nop,nop,TS val 1341742664 ecr 960548578], length 0
22:20:07.209801 IP ie-in-f109.1e100.net.imaps > v1404-wn-172-21-18-151.campus-dynamic.uwaterloo.ca.59012: Flags [P.], seq 65:111, ack 71, win 1002, options [nop,nop,TS val 1587510297 ecr 1341742614], length 46
22:20:07.209874 IP v1404-wn-172-21-18-151.campus-dynamic.uwaterloo.ca.59012 > ie-in-f109.1e100.net.imaps: Flags [.], ack 111, win 8189, options [nop,nop,TS val 1341742692 ecr 1587510297], length 0
22:20:07.213256 IP ie-in-f109.1e100.net.imaps > v1404-wn-172-21-18-151.campus-dynamic.uwaterloo.ca.59011: Flags [.], seq 1316:2662, ack 2192, win 1002, options [nop,nop,TS val 960548610 ecr 1341742658], length 1346
22:20:07.213473 IP ie-in-f109.1e100.net.imaps > v1404-wn-172-21-18-151.campus-dynamic.uwaterloo.ca.59011: Flags [P.], seq 2662:2843, ack 2192, win 1002, options [nop,nop,TS val 960548610 ecr 1341742658], length 181
22:20:07.213521 IP v1404-wn-172-21-18-151.campus-dynamic.uwaterloo.ca.59011 > ie-in-f109.1e100.net.imaps: Flags [.], ack 2843, win 8180, options [nop,nop,TS val 1341742695 ecr 960548610], length 0
22:20:07.216280 IP v1404-wn-172-21-18-151.campus-dynamic.uwaterloo.ca.59011 > ie-in-f109.1e100.net.imaps: Flags [P.], seq 2192:2232, ack 2843, win 8192, options [nop,nop,TS val 1341742697 ecr 960548610], length 40
22:20:07.216580 IP v1404-wn-172-21-18-151.campus-dynamic.uwaterloo.ca.59012 > ie-in-f109.1e100.net.imaps: Flags [P.], seq 71:111, ack 111, win 8192, options [nop,nop,TS val 1341742697 ecr 1587510297], length 40
22:20:07.253768 IP ie-in-f109.1e100.net.imaps > v1404-wn-172-21-18-151.campus-dynamic.uwaterloo.ca.59012: Flags [.], ack 111, win 1002, options [nop,nop,TS val 1587510341 ecr 1341742697], length 0
22:20:07.294898 IP ie-in-f109.1e100.net.imaps > v1404-wn-172-21-18-151.campus-dynamic.uwaterloo.ca.59011: Flags [.], ack 2232, win 1002, options [nop,nop,TS val 960548692 ecr 1341742697], length 0
22:20:07.301876 IP ie-in-f109.1e100.net.imaps > v1404-wn-172-21-18-151.campus-dynamic.uwaterloo.ca.59012: Flags [P.], seq 111:146, ack 111, win 1002, options [nop,nop,TS val 1587510388 ecr 1341742697], length 35
22:20:07.301995 IP v1404-wn-172-21-18-151.campus-dynamic.uwaterloo.ca.59012 > ie-in-f109.1e100.net.imaps: Flags [.], ack 146, win 8189, options [nop,nop,TS val 1341742781 ecr 1587510388], length 0
22:20:07.310561 IP ie-in-f109.1e100.net.imaps > v1404-wn-172-21-18-151.campus-dynamic.uwaterloo.ca.59011: Flags [P.], seq 2843:2889, ack 2232, win 1002, options [nop,nop,TS val 960548707 ecr 1341742697], length 46
22:20:07.310742 IP v1404-wn-172-21-18-151.campus-dynamic.uwaterloo.ca.59011 > ie-in-f109.1e100.net.imaps: Flags [.], ack 2889, win 8189, options [nop,nop,TS val 1341742789 ecr 960548707], length 0
22:20:07.313149 IP v1404-wn-172-21-18-151.campus-dynamic.uwaterloo.ca.59011 > ie-in-f109.1e100.net.imaps: Flags [P.], seq 2232:2307, ack 2889, win 8192, options [nop,nop,TS val 1341742791 ecr 960548707], length 75
22:20:07.351835 IP ie-in-f109.1e100.net.imaps > v1404-wn-172-21-18-151.campus-dynamic.uwaterloo.ca.59011: Flags [.], ack 2307, win 1002, options [nop,nop,TS val 960548748 ecr 1341742791], length 0
22:20:07.352021 IP v1404-wn-172-21-18-151.campus-dynamic.uwaterloo.ca.59011 > ie-in-f109.1e100.net.imaps: Flags [P.], seq 2307:2385, ack 2889, win 8192, options [nop,nop,TS val 1341742829 ecr 960548748], length 78
22:20:07.377790 IP ie-in-f109.1e100.net.imaps > v1404-wn-172-21-18-151.campus-dynamic.uwaterloo.ca.59011: Flags [P.], seq 2889:2984, ack 2307, win 1002, options [nop,nop,TS val 960548775 ecr 1341742791], length 95
22:20:07.377863 IP v1404-wn-172-21-18-151.campus-dynamic.uwaterloo.ca.59011 > ie-in-f109.1e100.net.imaps: Flags [.], ack 2984, win 8186, options [nop,nop,TS val 1341742854 ecr 960548775], length 0
22:20:07.393936 IP v1404-wn-172-21-18-151.campus-dynamic.uwaterloo.ca.63226 > yyz06s07-in-f7.1e100.net.https: Flags [P.], seq 772025565:772026103, ack 1045448022, win 8192, options [nop,nop,TS val 1341742870 ecr 3344910919], length 538
22:20:07.394009 IP v1404-wn-172-21-18-151.campus-dynamic.uwaterloo.ca.63226 > yyz06s07-in-f7.1e100.net.https: Flags [P.], seq 538:575, ack 1, win 8192, options [nop,nop,TS val 1341742870 ecr 3344910919], length 37
22:20:07.394086 IP v1404-wn-172-21-18-151.campus-dynamic.uwaterloo.ca.63226 > yyz06s07-in-f7.1e100.net.https: Flags [.], seq 575:1921, ack 1, win 8192, options [nop,nop,TS val 1341742870 ecr 3344910919], length 1346
22:20:07.394087 IP v1404-wn-172-21-18-151.campus-dynamic.uwaterloo.ca.63226 > yyz06s07-in-f7.1e100.net.https: Flags [P.], seq 1921:2758, ack 1, win 8192, options [nop,nop,TS val 1341742870 ecr 3344910919], length 837
22:20:07.402356 IP yyz06s07-in-f7.1e100.net.https > v1404-wn-172-21-18-151.campus-dynamic.uwaterloo.ca.63226: Flags [.], ack 575, win 1002, options [nop,nop,TS val 3344945332 ecr 1341742870], length 0
22:20:07.402657 IP yyz06s07-in-f7.1e100.net.https > v1404-wn-172-21-18-151.campus-dynamic.uwaterloo.ca.63226: Flags [P.], seq 1:38, ack 575, win 1002, options [nop,nop,TS val 3344945332 ecr 1341742870], length 37
22:20:07.402727 IP v1404-wn-172-21-18-151.campus-dynamic.uwaterloo.ca.63226 > yyz06s07-in-f7.1e100.net.https: Flags [.], ack 38, win 8189, options [nop,nop,TS val 1341742878 ecr 3344945332], length 0
22:20:07.403219 IP yyz06s07-in-f7.1e100.net.https > v1404-wn-172-21-18-151.campus-dynamic.uwaterloo.ca.63226: Flags [.], ack 2758, win 968, options [nop,nop,TS val 3344945332 ecr 1341742870], length 0
22:20:07.429840 IP ie-in-f109.1e100.net.imaps > v1404-wn-172-21-18-151.campus-dynamic.uwaterloo.ca.59011: Flags [.], ack 2385, win 1002, options [nop,nop,TS val 960548827 ecr 1341742829], length 0
22:20:07.488559 IP yyz06s07-in-f7.1e100.net.https > v1404-wn-172-21-18-151.campus-dynamic.uwaterloo.ca.63226: Flags [P.], seq 38:111, ack 2758, win 1002, options [nop,nop,TS val 3344945418 ecr 1341742878], length 73
22:20:07.488640 IP v1404-wn-172-21-18-151.campus-dynamic.uwaterloo.ca.63226 > yyz06s07-in-f7.1e100.net.https: Flags [.], ack 111, win 8187, options [nop,nop,TS val 1341742962 ecr 3344945418], length 0
22:20:07.489164 IP yyz06s07-in-f7.1e100.net.https > v1404-wn-172-21-18-151.campus-dynamic.uwaterloo.ca.63226: Flags [.], seq 111:1457, ack 2758, win 1002, options [nop,nop,TS val 3344945418 ecr 1341742878], length 1346
22:20:07.489291 IP yyz06s07-in-f7.1e100.net.https > v1404-wn-172-21-18-151.campus-dynamic.uwaterloo.ca.63226: Flags [P.], seq 1457:1461, ack 2758, win 1002, options [nop,nop,TS val 3344945418 ecr 1341742878], length 4
22:20:07.489331 IP v1404-wn-172-21-18-151.campus-dynamic.uwaterloo.ca.63226 > yyz06s07-in-f7.1e100.net.https: Flags [.], ack 1461, win 8191, options [nop,nop,TS val 1341742962 ecr 3344945418], length 0
22:20:07.489581 IP yyz06s07-in-f7.1e100.net.https > v1404-wn-172-21-18-151.campus-dynamic.uwaterloo.ca.63226: Flags [.], seq 1461:2807, ack 2758, win 1002, options [nop,nop,TS val 3344945418 ecr 1341742878], length 1346
22:20:07.489583 IP yyz06s07-in-f7.1e100.net.https > v1404-wn-172-21-18-151.campus-dynamic.uwaterloo.ca.63226: Flags [P.], seq 2807:2811, ack 2758, win 1002, options [nop,nop,TS val 3344945418 ecr 1341742878], length 4
22:20:07.489639 IP v1404-wn-172-21-18-151.campus-dynamic.uwaterloo.ca.63226 > yyz06s07-in-f7.1e100.net.https: Flags [.], ack 2811, win 8107, options [nop,nop,TS val 1341742963 ecr 3344945418], length 0
22:20:07.489697 IP yyz06s07-in-f7.1e100.net.https > v1404-wn-172-21-18-151.campus-dynamic.uwaterloo.ca.63226: Flags [.], seq 2811:4157, ack 2758, win 1002, options [nop,nop,TS val 3344945418 ecr 1341742878], length 1346
22:20:07.489699 IP yyz06s07-in-f7.1e100.net.https > v1404-wn-172-21-18-151.campus-dynamic.uwaterloo.ca.63226: Flags [P.], seq 4157:4161, ack 2758, win 1002, options [nop,nop,TS val 3344945418 ecr 1341742878], length 4
22:20:07.489746 IP v1404-wn-172-21-18-151.campus-dynamic.uwaterloo.ca.63226 > yyz06s07-in-f7.1e100.net.https: Flags [.], ack 4161, win 8107, options [nop,nop,TS val 1341742963 ecr 3344945418], length 0
22:20:07.496726 IP yyz06s07-in-f7.1e100.net.https > v1404-wn-172-21-18-151.campus-dynamic.uwaterloo.ca.63226: Flags [.], seq 4161:5507, ack 2758, win 1002, options [nop,nop,TS val 3344945426 ecr 1341742962], length 1346
22:20:07.496833 IP v1404-wn-172-21-18-151.campus-dynamic.uwaterloo.ca.63226 > yyz06s07-in-f7.1e100.net.https: Flags [.], ack 5507, win 8192, options [nop,nop,TS val 1341742970 ecr 3344945426], length 0
22:20:07.496928 IP yyz06s07-in-f7.1e100.net.https > v1404-wn-172-21-18-151.campus-dynamic.uwaterloo.ca.63226: Flags [.], seq 5507:6853, ack 2758, win 1002, options [nop,nop,TS val 3344945426 ecr 1341742962], length 1346
22:20:07.497502 IP yyz06s07-in-f7.1e100.net.https > v1404-wn-172-21-18-151.campus-dynamic.uwaterloo.ca.63226: Flags [.], seq 6853:8199, ack 2758, win 1002, options [nop,nop,TS val 3344945426 ecr 1341742962], length 1346
22:20:07.497540 IP v1404-wn-172-21-18-151.campus-dynamic.uwaterloo.ca.63226 > yyz06s07-in-f7.1e100.net.https: Flags [.], ack 8199, win 8107, options [nop,nop,TS val 1341742970 ecr 3344945426], length 0
22:20:07.497743 IP yyz06s07-in-f7.1e100.net.https > v1404-wn-172-21-18-151.campus-dynamic.uwaterloo.ca.63226: Flags [P.], seq 8199:9023, ack 2758, win 1002, options [nop,nop,TS val 3344945426 ecr 1341742962], length 824
22:20:07.497779 IP v1404-wn-172-21-18-151.campus-dynamic.uwaterloo.ca.63226 > yyz06s07-in-f7.1e100.net.https: Flags [.], ack 9023, win 8140, options [nop,nop,TS val 1341742971 ecr 3344945426], length 0
22:20:07.501843 IP v1404-wn-172-21-18-151.campus-dynamic.uwaterloo.ca.63226 > yyz06s07-in-f7.1e100.net.https: Flags [P.], seq 2758:3296, ack 9023, win 8192, options [nop,nop,TS val 1341742975 ecr 3344945426], length 538
22:20:07.501928 IP v1404-wn-172-21-18-151.campus-dynamic.uwaterloo.ca.63226 > yyz06s07-in-f7.1e100.net.https: Flags [.], seq 3296:4642, ack 9023, win 8192, options [nop,nop,TS val 1341742975 ecr 3344945426], length 1346
22:20:07.501928 IP v1404-wn-172-21-18-151.campus-dynamic.uwaterloo.ca.63226 > yyz06s07-in-f7.1e100.net.https: Flags [P.], seq 4642:5139, ack 9023, win 8192, options [nop,nop,TS val 1341742975 ecr 3344945426], length 497
22:20:07.510348 IP yyz06s07-in-f7.1e100.net.https > v1404-wn-172-21-18-151.campus-dynamic.uwaterloo.ca.63226: Flags [.], ack 5139, win 965, options [nop,nop,TS val 3344945440 ecr 1341742975], length 0
22:20:07.546377 IP ie-in-f109.1e100.net.imaps > v1404-wn-172-21-18-151.campus-dynamic.uwaterloo.ca.59011: Flags [P.], seq 2984:3080, ack 2385, win 1002, options [nop,nop,TS val 960548943 ecr 1341742829], length 96
22:20:07.546522 IP v1404-wn-172-21-18-151.campus-dynamic.uwaterloo.ca.59011 > ie-in-f109.1e100.net.imaps: Flags [.], ack 3080, win 8186, options [nop,nop,TS val 1341743018 ecr 960548943], length 0
22:20:07.552445 IP v1404-wn-172-21-18-151.campus-dynamic.uwaterloo.ca.59012 > ie-in-f109.1e100.net.imaps: Flags [P.], seq 111:142, ack 146, win 8192, options [nop,nop,TS val 1341743023 ecr 1587510388], length 31
22:20:07.588465 IP ie-in-f109.1e100.net.imaps > v1404-wn-172-21-18-151.campus-dynamic.uwaterloo.ca.59012: Flags [.], ack 142, win 1002, options [nop,nop,TS val 1587510675 ecr 1341743023], length 0
22:20:07.606113 IP yyz06s07-in-f7.1e100.net.https > v1404-wn-172-21-18-151.campus-dynamic.uwaterloo.ca.63226: Flags [P.], seq 9023:9078, ack 5139, win 1002, options [nop,nop,TS val 3344945535 ecr 1341742975], length 55
22:20:07.606278 IP v1404-wn-172-21-18-151.campus-dynamic.uwaterloo.ca.63226 > yyz06s07-in-f7.1e100.net.https: Flags [.], ack 9078, win 8188, options [nop,nop,TS val 1341743076 ecr 3344945535], length 0
22:20:07.606413 IP yyz06s07-in-f7.1e100.net.https > v1404-wn-172-21-18-151.campus-dynamic.uwaterloo.ca.63226: Flags [P.], seq 9078:9347, ack 5139, win 1002, options [nop,nop,TS val 3344945536 ecr 1341742975], length 269
22:20:07.606474 IP v1404-wn-172-21-18-151.campus-dynamic.uwaterloo.ca.63226 > yyz06s07-in-f7.1e100.net.https: Flags [.], ack 9347, win 8175, options [nop,nop,TS val 1341743076 ecr 3344945536], length 0
22:20:07.621664 IP v1404-wn-172-21-18-151.campus-dynamic.uwaterloo.ca.49803 > adns.uwaterloo.ca.domain: 54856+ PTR? 71.226.125.74.in-addr.arpa. (44)
22:20:07.623547 IP adns.uwaterloo.ca.domain > v1404-wn-172-21-18-151.campus-dynamic.uwaterloo.ca.49803: 54856 1/0/0 PTR yyz06s07-in-f7.1e100.net. (82)
22:20:07.635485 IP ie-in-f109.1e100.net.imaps > v1404-wn-172-21-18-151.campus-dynamic.uwaterloo.ca.59012: Flags [P.], seq 146:210, ack 142, win 1002, options [nop,nop,TS val 1587510723 ecr 1341743023], length 64
22:20:07.635594 IP v1404-wn-172-21-18-151.campus-dynamic.uwaterloo.ca.59012 > ie-in-f109.1e100.net.imaps: Flags [.], ack 210, win 8188, options [nop,nop,TS val 1341743105 ecr 1587510723], length 0
22:20:07.643264 IP v1404-wn-172-21-18-151.campus-dynamic.uwaterloo.ca.59012 > ie-in-f109.1e100.net.imaps: Flags [P.], seq 142:182, ack 210, win 8192, options [nop,nop,TS val 1341743112 ecr 1587510723], length 40
22:20:07.679397 IP ie-in-f109.1e100.net.imaps > v1404-wn-172-21-18-151.campus-dynamic.uwaterloo.ca.59012: Flags [.], ack 182, win 1002, options [nop,nop,TS val 1587510766 ecr 1341743112], length 0
22:20:07.729579 IP ie-in-f109.1e100.net.imaps > v1404-wn-172-21-18-151.campus-dynamic.uwaterloo.ca.59012: Flags [P.], seq 210:256, ack 182, win 1002, options [nop,nop,TS val 1587510816 ecr 1341743112], length 46
22:20:07.729646 IP v1404-wn-172-21-18-151.campus-dynamic.uwaterloo.ca.59012 > ie-in-f109.1e100.net.imaps: Flags [.], ack 256, win 8189, options [nop,nop,TS val 1341743198 ecr 1587510816], length 0
22:20:07.731415 IP v1404-wn-172-21-18-151.campus-dynamic.uwaterloo.ca.59012 > ie-in-f109.1e100.net.imaps: Flags [P.], seq 182:257, ack 256, win 8192, options [nop,nop,TS val 1341743199 ecr 1587510816], length 75
22:20:07.767559 IP ie-in-f109.1e100.net.imaps > v1404-wn-172-21-18-151.campus-dynamic.uwaterloo.ca.59012: Flags [.], ack 257, win 1002, options [nop,nop,TS val 1587510855 ecr 1341743199], length 0
22:20:07.814679 IP ie-in-f109.1e100.net.imaps > v1404-wn-172-21-18-151.campus-dynamic.uwaterloo.ca.59012: Flags [P.], seq 256:354, ack 257, win 1002, options [nop,nop,TS val 1587510902 ecr 1341743199], length 98
22:20:07.814756 IP v1404-wn-172-21-18-151.campus-dynamic.uwaterloo.ca.59012 > ie-in-f109.1e100.net.imaps: Flags [.], ack 354, win 8185, options [nop,nop,TS val 1341743281 ecr 1587510902], length 0
22:20:07.816837 IP v1404-wn-172-21-18-151.campus-dynamic.uwaterloo.ca.59012 > ie-in-f109.1e100.net.imaps: Flags [P.], seq 257:335, ack 354, win 8192, options [nop,nop,TS val 1341743283 ecr 1587510902], length 78
22:20:07.852913 IP ie-in-f109.1e100.net.imaps > v1404-wn-172-21-18-151.campus-dynamic.uwaterloo.ca.59012: Flags [.], ack 335, win 1002, options [nop,nop,TS val 1587510940 ecr 1341743283], length 0
22:20:07.852978 IP v1404-wn-172-21-18-151.campus-dynamic.uwaterloo.ca.59012 > ie-in-f109.1e100.net.imaps: Flags [P.], seq 335:1443, ack 354, win 8192, options [nop,nop,TS val 1341743318 ecr 1587510940], length 1108
22:20:07.889314 IP ie-in-f109.1e100.net.imaps > v1404-wn-172-21-18-151.campus-dynamic.uwaterloo.ca.59012: Flags [.], ack 1443, win 1002, options [nop,nop,TS val 1587510976 ecr 1341743318], length 0
22:20:07.922273 IP ie-in-f109.1e100.net.imaps > v1404-wn-172-21-18-151.campus-dynamic.uwaterloo.ca.59012: Flags [P.], seq 354:455, ack 1443, win 1002, options [nop,nop,TS val 1587511009 ecr 1341743318], length 101
22:20:07.922343 IP v1404-wn-172-21-18-151.campus-dynamic.uwaterloo.ca.59012 > ie-in-f109.1e100.net.imaps: Flags [.], ack 455, win 8185, options [nop,nop,TS val 1341743386 ecr 1587511009], length 0
22:20:07.936200 IP ie-in-f109.1e100.net.imaps > v1404-wn-172-21-18-151.campus-dynamic.uwaterloo.ca.59012: Flags [P.], seq 455:550, ack 1443, win 1002, options [nop,nop,TS val 1587511023 ecr 1341743318], length 95
22:20:07.936265 IP v1404-wn-172-21-18-151.campus-dynamic.uwaterloo.ca.59012 > ie-in-f109.1e100.net.imaps: Flags [.], ack 550, win 8186, options [nop,nop,TS val 1341743399 ecr 1587511023], length 0
22:20:07.936772 IP ie-in-f109.1e100.net.imaps > v1404-wn-172-21-18-151.campus-dynamic.uwaterloo.ca.59012: Flags [P.], seq 550:649, ack 1443, win 1002, options [nop,nop,TS val 1587511024 ecr 1341743318], length 99
22:20:07.936833 IP v1404-wn-172-21-18-151.campus-dynamic.uwaterloo.ca.59012 > ie-in-f109.1e100.net.imaps: Flags [.], ack 649, win 8185, options [nop,nop,TS val 1341743399 ecr 1587511024], length 0
22:20:07.937287 IP ie-in-f109.1e100.net.imaps > v1404-wn-172-21-18-151.campus-dynamic.uwaterloo.ca.59012: Flags [P.], seq 649:747, ack 1443, win 1002, options [nop,nop,TS val 1587511024 ecr 1341743318], length 98
22:20:07.937333 IP v1404-wn-172-21-18-151.campus-dynamic.uwaterloo.ca.59012 > ie-in-f109.1e100.net.imaps: Flags [.], ack 747, win 8185, options [nop,nop,TS val 1341743400 ecr 1587511024], length 0
22:20:07.937857 IP ie-in-f109.1e100.net.imaps > v1404-wn-172-21-18-151.campus-dynamic.uwaterloo.ca.59012: Flags [P.], seq 747:839, ack 1443, win 1002, options [nop,nop,TS val 1587511025 ecr 1341743318], length 92
22:20:07.937904 IP v1404-wn-172-21-18-151.campus-dynamic.uwaterloo.ca.59012 > ie-in-f109.1e100.net.imaps: Flags [.], ack 839, win 8186, options [nop,nop,TS val 1341743400 ecr 1587511025], length 0
22:20:07.938567 IP ie-in-f109.1e100.net.imaps > v1404-wn-172-21-18-151.campus-dynamic.uwaterloo.ca.59012: Flags [P.], seq 839:935, ack 1443, win 1002, options [nop,nop,TS val 1587511026 ecr 1341743318], length 96
22:20:07.938608 IP v1404-wn-172-21-18-151.campus-dynamic.uwaterloo.ca.59012 > ie-in-f109.1e100.net.imaps: Flags [.], ack 935, win 8186, options [nop,nop,TS val 1341743401 ecr 1587511026], length 0
22:20:07.939032 IP ie-in-f109.1e100.net.imaps > v1404-wn-172-21-18-151.campus-dynamic.uwaterloo.ca.59012: Flags [P.], seq 935:1029, ack 1443, win 1002, options [nop,nop,TS val 1587511026 ecr 1341743318], length 94
22:20:07.939071 IP v1404-wn-172-21-18-151.campus-dynamic.uwaterloo.ca.59012 > ie-in-f109.1e100.net.imaps: Flags [.], ack 1029, win 8186, options [nop,nop,TS val 1341743401 ecr 1587511026], length 0
22:20:07.939752 IP ie-in-f109.1e100.net.imaps > v1404-wn-172-21-18-151.campus-dynamic.uwaterloo.ca.59012: Flags [P.], seq 1029:1124, ack 1443, win 1002, options [nop,nop,TS val 1587511026 ecr 1341743318], length 95
22:20:07.939799 IP v1404-wn-172-21-18-151.campus-dynamic.uwaterloo.ca.59012 > ie-in-f109.1e100.net.imaps: Flags [.], ack 1124, win 8186, options [nop,nop,TS val 1341743402 ecr 1587511026], length 0
22:20:07.940229 IP ie-in-f109.1e100.net.imaps > v1404-wn-172-21-18-151.campus-dynamic.uwaterloo.ca.59012: Flags [P.], seq 1124:1220, ack 1443, win 1002, options [nop,nop,TS val 1587511027 ecr 1341743318], length 96
22:20:07.940282 IP v1404-wn-172-21-18-151.campus-dynamic.uwaterloo.ca.59012 > ie-in-f109.1e100.net.imaps: Flags [.], ack 1220, win 8186, options [nop,nop,TS val 1341743402 ecr 1587511027], length 0
22:20:07.941393 IP ie-in-f109.1e100.net.imaps > v1404-wn-172-21-18-151.campus-dynamic.uwaterloo.ca.59012: Flags [P.], seq 1220:1317, ack 1443, win 1002, options [nop,nop,TS val 1587511028 ecr 1341743318], length 97
22:20:07.941454 IP v1404-wn-172-21-18-151.campus-dynamic.uwaterloo.ca.59012 > ie-in-f109.1e100.net.imaps: Flags [.], ack 1317, win 8185, options [nop,nop,TS val 1341743403 ecr 1587511028], length 0
22:20:07.941985 IP ie-in-f109.1e100.net.imaps > v1404-wn-172-21-18-151.campus-dynamic.uwaterloo.ca.59012: Flags [P.], seq 1317:1415, ack 1443, win 1002, options [nop,nop,TS val 1587511028 ecr 1341743318], length 98
22:20:07.942032 IP v1404-wn-172-21-18-151.campus-dynamic.uwaterloo.ca.59012 > ie-in-f109.1e100.net.imaps: Flags [.], ack 1415, win 8185, options [nop,nop,TS val 1341743403 ecr 1587511028], length 0
22:20:07.942581 IP ie-in-f109.1e100.net.imaps > v1404-wn-172-21-18-151.campus-dynamic.uwaterloo.ca.59012: Flags [P.], seq 1415:1573, ack 1443, win 1002, options [nop,nop,TS val 1587511030 ecr 1341743318], length 158
22:20:07.942629 IP v1404-wn-172-21-18-151.campus-dynamic.uwaterloo.ca.59012 > ie-in-f109.1e100.net.imaps: Flags [.], ack 1573, win 8182, options [nop,nop,TS val 1341743404 ecr 1587511030], length 0
22:20:07.944491 IP ie-in-f109.1e100.net.imaps > v1404-wn-172-21-18-151.campus-dynamic.uwaterloo.ca.59012: Flags [P.], seq 1573:1660, ack 1443, win 1002, options [nop,nop,TS val 1587511032 ecr 1341743318], length 87
22:20:07.944559 IP v1404-wn-172-21-18-151.campus-dynamic.uwaterloo.ca.59012 > ie-in-f109.1e100.net.imaps: Flags [.], ack 1660, win 8186, options [nop,nop,TS val 1341743405 ecr 1587511032], length 0
22:20:07.945176 IP ie-in-f109.1e100.net.imaps > v1404-wn-172-21-18-151.campus-dynamic.uwaterloo.ca.59012: Flags [P.], seq 1660:1748, ack 1443, win 1002, options [nop,nop,TS val 1587511032 ecr 1341743318], length 88
22:20:07.945226 IP v1404-wn-172-21-18-151.campus-dynamic.uwaterloo.ca.59012 > ie-in-f109.1e100.net.imaps: Flags [.], ack 1748, win 8186, options [nop,nop,TS val 1341743405 ecr 1587511032], length 0
22:20:07.945959 IP ie-in-f109.1e100.net.imaps > v1404-wn-172-21-18-151.campus-dynamic.uwaterloo.ca.59012: Flags [P.], seq 1748:1842, ack 1443, win 1002, options [nop,nop,TS val 1587511033 ecr 1341743318], length 94
22:20:07.946024 IP v1404-wn-172-21-18-151.campus-dynamic.uwaterloo.ca.59012 > ie-in-f109.1e100.net.imaps: Flags [.], ack 1842, win 8186, options [nop,nop,TS val 1341743406 ecr 1587511033], length 0
22:20:07.947453 IP v1404-wn-172-21-18-151.campus-dynamic.uwaterloo.ca.61331 > yyz06s07-in-f18.1e100.net.https: Flags [.], seq 3639239042:3639240230, ack 3064271504, win 8192, options [nop,nop,TS val 1341743407 ecr 3344932114], length 1188
22:20:07.947454 IP v1404-wn-172-21-18-151.campus-dynamic.uwaterloo.ca.61331 > yyz06s07-in-f18.1e100.net.https: Flags [.], seq 1188:2376, ack 1, win 8192, options [nop,nop,TS val 1341743407 ecr 3344932114], length 1188
22:20:07.947454 IP v1404-wn-172-21-18-151.campus-dynamic.uwaterloo.ca.61331 > yyz06s07-in-f18.1e100.net.https: Flags [P.], seq 2376:3335, ack 1, win 8192, options [nop,nop,TS val 1341743407 ecr 3344932114], length 959
22:20:07.947514 IP v1404-wn-172-21-18-151.campus-dynamic.uwaterloo.ca.61331 > yyz06s07-in-f18.1e100.net.https: Flags [P.], seq 3335:3372, ack 1, win 8192, options [nop,nop,TS val 1341743407 ecr 3344932114], length 37
22:20:07.949375 IP v1404-wn-172-21-18-151.campus-dynamic.uwaterloo.ca.59012 > ie-in-f109.1e100.net.imaps: Flags [P.], seq 1443:1483, ack 1842, win 8192, options [nop,nop,TS val 1341743408 ecr 1587511033], length 40
22:20:07.957755 IP yyz06s07-in-f18.1e100.net.https > v1404-wn-172-21-18-151.campus-dynamic.uwaterloo.ca.61331: Flags [.], ack 3372, win 1002, options [nop,nop,TS val 3344942132 ecr 1341743407], length 0
22:20:07.958077 IP yyz06s07-in-f18.1e100.net.https > v1404-wn-172-21-18-151.campus-dynamic.uwaterloo.ca.61331: Flags [P.], seq 1:38, ack 3372, win 1002, options [nop,nop,TS val 3344942132 ecr 1341743407], length 37
22:20:07.958135 IP v1404-wn-172-21-18-151.campus-dynamic.uwaterloo.ca.61331 > yyz06s07-in-f18.1e100.net.https: Flags [.], ack 38, win 8189, options [nop,nop,TS val 1341743416 ecr 3344942132], length 0
22:20:08.025476 IP ie-in-f109.1e100.net.imaps > v1404-wn-172-21-18-151.campus-dynamic.uwaterloo.ca.59012: Flags [.], ack 1483, win 1002, options [nop,nop,TS val 1587511113 ecr 1341743408], length 0
22:20:08.053494 IP yyz06s07-in-f18.1e100.net.https > v1404-wn-172-21-18-151.campus-dynamic.uwaterloo.ca.61331: Flags [P.], seq 38:599, ack 3372, win 1002, options [nop,nop,TS val 3344942227 ecr 1341743416], length 561
22:20:08.053597 IP v1404-wn-172-21-18-151.campus-dynamic.uwaterloo.ca.61331 > yyz06s07-in-f18.1e100.net.https: Flags [.], ack 599, win 8156, options [nop,nop,TS val 1341743510 ecr 3344942227], length 0
22:20:08.053673 IP yyz06s07-in-f18.1e100.net.https > v1404-wn-172-21-18-151.campus-dynamic.uwaterloo.ca.61331: Flags [P.], seq 599:889, ack 3372, win 1002, options [nop,nop,TS val 3344942227 ecr 1341743416], length 290
22:20:08.053714 IP v1404-wn-172-21-18-151.campus-dynamic.uwaterloo.ca.61331 > yyz06s07-in-f18.1e100.net.https: Flags [.], ack 889, win 8173, options [nop,nop,TS val 1341743510 ecr 3344942227], length 0
22:20:08.059643 IP ie-in-f109.1e100.net.imaps > v1404-wn-172-21-18-151.campus-dynamic.uwaterloo.ca.59012: Flags [P.], seq 1842:1877, ack 1483, win 1002, options [nop,nop,TS val 1587511147 ecr 1341743408], length 35
22:20:08.059743 IP v1404-wn-172-21-18-151.campus-dynamic.uwaterloo.ca.59012 > ie-in-f109.1e100.net.imaps: Flags [.], ack 1877, win 8189, options [nop,nop,TS val 1341743516 ecr 1587511147], length 0
22:20:08.365598 IP v1404-wn-172-21-18-151.campus-dynamic.uwaterloo.ca.64124 > yyz06s07-in-f30.1e100.net.https: Flags [P.], seq 2569484941:2569485531, ack 1243610493, win 8192, options [nop,nop,TS val 1341743820 ecr 3344941550], length 590
22:20:08.377177 IP yyz06s07-in-f30.1e100.net.https > v1404-wn-172-21-18-151.campus-dynamic.uwaterloo.ca.64124: Flags [P.], seq 1:54, ack 590, win 1002, options [nop,nop,TS val 3344947559 ecr 1341743820], length 53
22:20:08.377291 IP yyz06s07-in-f30.1e100.net.https > v1404-wn-172-21-18-151.campus-dynamic.uwaterloo.ca.64124: Flags [P.], seq 54:122, ack 590, win 1002, options [nop,nop,TS val 3344947559 ecr 1341743820], length 68
22:20:08.377303 IP v1404-wn-172-21-18-151.campus-dynamic.uwaterloo.ca.64124 > yyz06s07-in-f30.1e100.net.https: Flags [.], ack 54, win 8188, options [nop,nop,TS val 1341743831 ecr 3344947559], length 0
22:20:08.377366 IP v1404-wn-172-21-18-151.campus-dynamic.uwaterloo.ca.64124 > yyz06s07-in-f30.1e100.net.https: Flags [.], ack 122, win 8184, options [nop,nop,TS val 1341743831 ecr 3344947559], length 0
22:20:08.379420 IP v1404-wn-172-21-18-151.campus-dynamic.uwaterloo.ca.64146 > github.com.https: Flags [.], seq 3045441329:3045442675, ack 297347083, win 8192, options [nop,nop,TS val 1341743833 ecr 1734492741], length 1346
22:20:08.379421 IP v1404-wn-172-21-18-151.campus-dynamic.uwaterloo.ca.64146 > github.com.https: Flags [P.], seq 1346:1715, ack 1, win 8192, options [nop,nop,TS val 1341743833 ecr 1734492741], length 369
22:20:08.404574 IP github.com.https > v1404-wn-172-21-18-151.campus-dynamic.uwaterloo.ca.64146: Flags [.], ack 1715, win 63, options [nop,nop,TS val 1734494177 ecr 1341743833], length 0
22:20:08.471341 IP github.com.https > v1404-wn-172-21-18-151.campus-dynamic.uwaterloo.ca.64146: Flags [.], seq 1:1347, ack 1715, win 63, options [nop,nop,TS val 1734494194 ecr 1341743833], length 1346
22:20:08.471476 IP github.com.https > v1404-wn-172-21-18-151.campus-dynamic.uwaterloo.ca.64146: Flags [.], seq 1347:2693, ack 1715, win 63, options [nop,nop,TS val 1734494194 ecr 1341743833], length 1346
22:20:08.471542 IP v1404-wn-172-21-18-151.campus-dynamic.uwaterloo.ca.64146 > github.com.https: Flags [.], ack 2693, win 8023, options [nop,nop,TS val 1341743922 ecr 1734494194], length 0
22:20:08.471697 IP github.com.https > v1404-wn-172-21-18-151.campus-dynamic.uwaterloo.ca.64146: Flags [P.], seq 2693:2811, ack 1715, win 63, options [nop,nop,TS val 1734494194 ecr 1341743833], length 118
22:20:08.471744 IP v1404-wn-172-21-18-151.campus-dynamic.uwaterloo.ca.64146 > github.com.https: Flags [.], ack 2811, win 8016, options [nop,nop,TS val 1341743922 ecr 1734494194], length 0
22:20:08.627854 IP v1404-wn-172-21-18-151.campus-dynamic.uwaterloo.ca.61531 > adns.uwaterloo.ca.domain: 19293+ PTR? 94.226.125.74.in-addr.arpa. (44)
22:20:08.629920 IP adns.uwaterloo.ca.domain > v1404-wn-172-21-18-151.campus-dynamic.uwaterloo.ca.61531: 19293 1/0/0 PTR yyz06s07-in-f30.1e100.net. (83)
22:20:08.699652 IP v1404-wn-172-21-18-151.campus-dynamic.uwaterloo.ca.64150 > 108.160.160.178.https: Flags [P.], seq 449898604:449899430, ack 1897828487, win 8189, options [nop,nop,TS val 1341744149 ecr 221504497], length 826
22:20:08.714423 IP v1404-wn-172-21-18-151.campus-dynamic.uwaterloo.ca.64156 > v-client-2a.sjc.dropbox.com.https: Flags [S], seq 1229323745, win 65535, options [mss 1460,nop,wscale 4,nop,nop,TS val 1341744163 ecr 0,sackOK,eol], length 0
22:20:08.789138 IP 108.160.160.178.https > v1404-wn-172-21-18-151.campus-dynamic.uwaterloo.ca.64150: Flags [R], seq 1897828487, win 0, length 0
22:20:08.790942 IP v1404-wn-172-21-18-151.campus-dynamic.uwaterloo.ca.64146 > github.com.https: Flags [.], seq 1715:3061, ack 2811, win 8192, options [nop,nop,TS val 1341744238 ecr 1734494194], length 1346
22:20:08.790942 IP v1404-wn-172-21-18-151.campus-dynamic.uwaterloo.ca.64146 > github.com.https: Flags [P.], seq 3061:3549, ack 2811, win 8192, options [nop,nop,TS val 1341744238 ecr 1734494194], length 488
22:20:08.791631 IP v1404-wn-172-21-18-151.campus-dynamic.uwaterloo.ca.64152 > github.com.https: Flags [.], seq 2899588283:2899589629, ack 3699392121, win 8192, options [nop,nop,TS val 1341744238 ecr 2961128432], length 1346
22:20:08.791631 IP v1404-wn-172-21-18-151.campus-dynamic.uwaterloo.ca.64152 > github.com.https: Flags [P.], seq 1346:1835, ack 1, win 8192, options [nop,nop,TS val 1341744238 ecr 2961128432], length 489
22:20:08.804579 IP v-client-2a.sjc.dropbox.com.https > v1404-wn-172-21-18-151.campus-dynamic.uwaterloo.ca.64156: Flags [S.], seq 964205022, ack 1229323746, win 14480, options [mss 1358,sackOK,TS val 1905955492 ecr 1341744163,nop,wscale 9], length 0
22:20:08.804652 IP v1404-wn-172-21-18-151.campus-dynamic.uwaterloo.ca.64156 > v-client-2a.sjc.dropbox.com.https: Flags [.], ack 1, win 8244, options [nop,nop,TS val 1341744251 ecr 1905955492], length 0
22:20:08.807185 IP v1404-wn-172-21-18-151.campus-dynamic.uwaterloo.ca.64156 > v-client-2a.sjc.dropbox.com.https: Flags [P.], seq 1:75, ack 1, win 8244, options [nop,nop,TS val 1341744253 ecr 1905955492], length 74
22:20:08.817192 IP github.com.https > v1404-wn-172-21-18-151.campus-dynamic.uwaterloo.ca.64152: Flags [.], ack 1835, win 19, options [nop,nop,TS val 2961130034 ecr 1341744238], length 0
22:20:08.820126 IP github.com.https > v1404-wn-172-21-18-151.campus-dynamic.uwaterloo.ca.64146: Flags [.], ack 3549, win 63, options [nop,nop,TS val 1734494281 ecr 1341744238], length 0
