20:10:31.371495 IP www.rdio.com.http > v1404-wn-172-21-18-151.campus-dynamic.uwaterloo.ca.62317: Flags [P.], seq 529117372:529118605, ack 3233660515, win 5519, options [nop,nop,TS val 3356788952 ecr 1334066867], length 1233
20:10:31.371593 IP v1404-wn-172-21-18-151.campus-dynamic.uwaterloo.ca.62317 > www.rdio.com.http: Flags [.], ack 1233, win 8114, options [nop,nop,TS val 1334066948 ecr 3356788865], length 0
20:10:31.376861 IP v1404-wn-172-21-18-151.campus-dynamic.uwaterloo.ca.62321 > a23-14-98-110.deploy.akamaitechnologies.com.https: Flags [P.], seq 277809330:277809597, ack 3224387528, win 8192, options [nop,nop,TS val 1334066953 ecr 910094951], length 267
20:10:31.376927 IP v1404-wn-172-21-18-151.campus-dynamic.uwaterloo.ca.62321 > a23-14-98-110.deploy.akamaitechnologies.com.https: Flags [P.], seq 267:273, ack 1, win 8192, options [nop,nop,TS val 1334066953 ecr 910094951], length 6
20:10:31.376928 IP v1404-wn-172-21-18-151.campus-dynamic.uwaterloo.ca.62321 > a23-14-98-110.deploy.akamaitechnologies.com.https: Flags [P.], seq 273:314, ack 1, win 8192, options [nop,nop,TS val 1334066953 ecr 910094951], length 41
20:10:31.386370 IP v1404-wn-172-21-18-151.campus-dynamic.uwaterloo.ca.62322 > edge-star-ecmp-12-iad1.facebook.com.https: Flags [P.], seq 3908269620:3908269759, ack 3276038149, win 8192, options [nop,nop,TS val 1334066962 ecr 524535456], length 139
20:10:31.386436 IP v1404-wn-172-21-18-151.campus-dynamic.uwaterloo.ca.62322 > edge-star-ecmp-12-iad1.facebook.com.https: Flags [P.], seq 139:145, ack 1, win 8192, options [nop,nop,TS val 1334066962 ecr 524535456], length 6
20:10:31.386436 IP v1404-wn-172-21-18-151.campus-dynamic.uwaterloo.ca.62322 > edge-star-ecmp-12-iad1.facebook.com.https: Flags [P.], seq 145:186, ack 1, win 8192, options [nop,nop,TS val 1334066962 ecr 524535456], length 41
20:10:31.400752 IP 8.18.203.81.http > v1404-wn-172-21-18-151.campus-dynamic.uwaterloo.ca.62319: Flags [P.], seq 2624021104:2624021152, ack 3934828926, win 9, options [nop,nop,TS val 2808446791 ecr 1334066893], length 48
20:10:31.400882 IP v1404-wn-172-21-18-151.campus-dynamic.uwaterloo.ca.62319 > 8.18.203.81.http: Flags [P.], seq 1:176, ack 48, win 8233, options [nop,nop,TS val 1334066976 ecr 2808446791], length 175
20:10:31.405608 IP a23-14-98-110.deploy.akamaitechnologies.com.https > v1404-wn-172-21-18-151.campus-dynamic.uwaterloo.ca.62321: Flags [.], ack 314, win 8312, options [nop,nop,TS val 910095042 ecr 1334066953], length 0
20:10:31.405805 IP a23-14-98-110.deploy.akamaitechnologies.com.https > v1404-wn-172-21-18-151.campus-dynamic.uwaterloo.ca.62321: Flags [P.], seq 1:48, ack 314, win 8312, options [nop,nop,TS val 910095042 ecr 1334066953], length 47
20:10:31.405878 IP v1404-wn-172-21-18-151.campus-dynamic.uwaterloo.ca.62321 > a23-14-98-110.deploy.akamaitechnologies.com.https: Flags [.], ack 48, win 8189, options [nop,nop,TS val 1334066980 ecr 910095042], length 0
20:10:31.406305 IP v1404-wn-172-21-18-151.campus-dynamic.uwaterloo.ca.62321 > a23-14-98-110.deploy.akamaitechnologies.com.https: Flags [P.], seq 314:833, ack 48, win 8192, options [nop,nop,TS val 1334066980 ecr 910095042], length 519
20:10:31.410449 IP edge-star-ecmp-12-iad1.facebook.com.https > v1404-wn-172-21-18-151.campus-dynamic.uwaterloo.ca.62322: Flags [.], ack 139, win 33, options [nop,nop,TS val 524535541 ecr 1334066962], length 0
20:10:31.410599 IP edge-star-ecmp-12-iad1.facebook.com.https > v1404-wn-172-21-18-151.campus-dynamic.uwaterloo.ca.62322: Flags [.], ack 145, win 33, options [nop,nop,TS val 524535541 ecr 1334066962], length 0
20:10:31.410848 IP edge-star-ecmp-12-iad1.facebook.com.https > v1404-wn-172-21-18-151.campus-dynamic.uwaterloo.ca.62322: Flags [.], ack 186, win 33, options [nop,nop,TS val 524535541 ecr 1334066962], length 0
20:10:31.411513 IP edge-star-ecmp-12-iad1.facebook.com.https > v1404-wn-172-21-18-151.campus-dynamic.uwaterloo.ca.62322: Flags [P.], seq 1:48, ack 186, win 33, options [nop,nop,TS val 524535542 ecr 1334066962], length 47
20:10:31.411575 IP v1404-wn-172-21-18-151.campus-dynamic.uwaterloo.ca.62322 > edge-star-ecmp-12-iad1.facebook.com.https: Flags [.], ack 48, win 8189, options [nop,nop,TS val 1334066985 ecr 524535542], length 0
20:10:31.412060 IP v1404-wn-172-21-18-151.campus-dynamic.uwaterloo.ca.62322 > edge-star-ecmp-12-iad1.facebook.com.https: Flags [P.], seq 186:1008, ack 48, win 8192, options [nop,nop,TS val 1334066985 ecr 524535542], length 822
20:10:31.424371 IP v1404-wn-172-21-18-151.campus-dynamic.uwaterloo.ca.62313 > a216-191-211-200.deploy.akamaitechnologies.com.http: Flags [P.], seq 1159626461:1159626980, ack 4151787626, win 8192, options [nop,nop,TS val 1334066997 ecr 1594959305], length 519
20:10:31.426799 IP a23-14-98-110.deploy.akamaitechnologies.com.https > v1404-wn-172-21-18-151.campus-dynamic.uwaterloo.ca.62321: Flags [.], seq 48:1394, ack 833, win 8848, options [nop,nop,TS val 910095063 ecr 1334066980], length 1346
20:10:31.427120 IP a23-14-98-110.deploy.akamaitechnologies.com.https > v1404-wn-172-21-18-151.campus-dynamic.uwaterloo.ca.62321: Flags [.], seq 1394:2740, ack 833, win 8848, options [nop,nop,TS val 910095063 ecr 1334066980], length 1346
20:10:31.427174 IP v1404-wn-172-21-18-151.campus-dynamic.uwaterloo.ca.62321 > a23-14-98-110.deploy.akamaitechnologies.com.https: Flags [.], ack 2740, win 8107, options [nop,nop,TS val 1334066999 ecr 910095063], length 0
20:10:31.427764 IP a23-14-98-110.deploy.akamaitechnologies.com.https > v1404-wn-172-21-18-151.campus-dynamic.uwaterloo.ca.62321: Flags [.], seq 2740:4086, ack 833, win 8848, options [nop,nop,TS val 910095063 ecr 1334066980], length 1346
20:10:31.427819 IP a23-14-98-110.deploy.akamaitechnologies.com.https > v1404-wn-172-21-18-151.campus-dynamic.uwaterloo.ca.62321: Flags [.], seq 4086:5432, ack 833, win 8848, options [nop,nop,TS val 910095063 ecr 1334066980], length 1346
20:10:31.427858 IP v1404-wn-172-21-18-151.campus-dynamic.uwaterloo.ca.62321 > a23-14-98-110.deploy.akamaitechnologies.com.https: Flags [.], ack 5432, win 8023, options [nop,nop,TS val 1334067000 ecr 910095063], length 0
20:10:31.427916 IP a23-14-98-110.deploy.akamaitechnologies.com.https > v1404-wn-172-21-18-151.campus-dynamic.uwaterloo.ca.62321: Flags [.], seq 5432:6778, ack 833, win 8848, options [nop,nop,TS val 910095063 ecr 1334066980], length 1346
20:10:31.428010 IP v1404-wn-172-21-18-151.campus-dynamic.uwaterloo.ca.62321 > a23-14-98-110.deploy.akamaitechnologies.com.https: Flags [.], ack 6778, win 8192, options [nop,nop,TS val 1334067000 ecr 910095063], length 0
20:10:31.428135 IP a23-14-98-110.deploy.akamaitechnologies.com.https > v1404-wn-172-21-18-151.campus-dynamic.uwaterloo.ca.62321: Flags [.], seq 6778:8124, ack 833, win 8848, options [nop,nop,TS val 910095063 ecr 1334066980], length 1346
20:10:31.428704 IP a23-14-98-110.deploy.akamaitechnologies.com.https > v1404-wn-172-21-18-151.campus-dynamic.uwaterloo.ca.62321: Flags [.], seq 8124:9470, ack 833, win 8848, options [nop,nop,TS val 910095063 ecr 1334066980], length 1346
20:10:31.428775 IP a23-14-98-110.deploy.akamaitechnologies.com.https > v1404-wn-172-21-18-151.campus-dynamic.uwaterloo.ca.62321: Flags [P.], seq 9470:10308, ack 833, win 8848, options [nop,nop,TS val 910095063 ecr 1334066980], length 838
20:10:31.428785 IP v1404-wn-172-21-18-151.campus-dynamic.uwaterloo.ca.62321 > a23-14-98-110.deploy.akamaitechnologies.com.https: Flags [.], ack 9470, win 8107, options [nop,nop,TS val 1334067000 ecr 910095063], length 0
20:10:31.428817 IP v1404-wn-172-21-18-151.campus-dynamic.uwaterloo.ca.62321 > a23-14-98-110.deploy.akamaitechnologies.com.https: Flags [.], ack 10308, win 8055, options [nop,nop,TS val 1334067000 ecr 910095063], length 0
20:10:31.433266 IP a216-191-211-200.deploy.akamaitechnologies.com.http > v1404-wn-172-21-18-151.campus-dynamic.uwaterloo.ca.62313: Flags [.], seq 1:1347, ack 519, win 8312, options [nop,nop,TS val 1594959950 ecr 1334066997], length 1346
20:10:31.433466 IP a216-191-211-200.deploy.akamaitechnologies.com.http > v1404-wn-172-21-18-151.campus-dynamic.uwaterloo.ca.62313: Flags [.], seq 1347:2693, ack 519, win 8312, options [nop,nop,TS val 1594959950 ecr 1334066997], length 1346
20:10:31.433517 IP v1404-wn-172-21-18-151.campus-dynamic.uwaterloo.ca.62313 > a216-191-211-200.deploy.akamaitechnologies.com.http: Flags [.], ack 2693, win 8107, options [nop,nop,TS val 1334067005 ecr 1594959950], length 0
20:10:31.433640 IP a216-191-211-200.deploy.akamaitechnologies.com.http > v1404-wn-172-21-18-151.campus-dynamic.uwaterloo.ca.62313: Flags [P.], seq 2693:2984, ack 519, win 8312, options [nop,nop,TS val 1594959950 ecr 1334066997], length 291
20:10:31.433684 IP v1404-wn-172-21-18-151.campus-dynamic.uwaterloo.ca.62313 > a216-191-211-200.deploy.akamaitechnologies.com.http: Flags [.], ack 2984, win 8089, options [nop,nop,TS val 1334067005 ecr 1594959950], length 0
20:10:31.436802 IP edge-star-ecmp-12-iad1.facebook.com.https > v1404-wn-172-21-18-151.campus-dynamic.uwaterloo.ca.62322: Flags [.], ack 1008, win 39, options [nop,nop,TS val 524535567 ecr 1334066985], length 0
20:10:31.455332 IP v1404-wn-172-21-18-151.campus-dynamic.uwaterloo.ca.62313 > a216-191-211-200.deploy.akamaitechnologies.com.http: Flags [P.], seq 519:1086, ack 2984, win 8192, options [nop,nop,TS val 1334067026 ecr 1594959950], length 567
20:10:31.455589 IP v1404-wn-172-21-18-151.campus-dynamic.uwaterloo.ca.62314 > a216-191-211-200.deploy.akamaitechnologies.com.http: Flags [P.], seq 2099164994:2099165536, ack 178891176, win 8192, options [nop,nop,TS val 1334067026 ecr 1594959326], length 542
20:10:31.456909 IP v1404-wn-172-21-18-151.campus-dynamic.uwaterloo.ca.62323 > a216-191-211-200.deploy.akamaitechnologies.com.http: Flags [S], seq 1369351003, win 65535, options [mss 1460,nop,wscale 4,nop,nop,TS val 1334067027 ecr 0,sackOK,eol], length 0
20:10:31.462878 IP a216-191-211-200.deploy.akamaitechnologies.com.http > v1404-wn-172-21-18-151.campus-dynamic.uwaterloo.ca.62313: Flags [P.], seq 2984:3274, ack 1086, win 8879, options [nop,nop,TS val 1594959981 ecr 1334067026], length 290
20:10:31.462961 IP v1404-wn-172-21-18-151.campus-dynamic.uwaterloo.ca.62313 > a216-191-211-200.deploy.akamaitechnologies.com.http: Flags [.], ack 3274, win 8173, options [nop,nop,TS val 1334067033 ecr 1594959981], length 0
20:10:31.463648 IP a216-191-211-200.deploy.akamaitechnologies.com.http > v1404-wn-172-21-18-151.campus-dynamic.uwaterloo.ca.62314: Flags [P.], seq 1:291, ack 542, win 8318, options [nop,nop,TS val 1594959982 ecr 1334067026], length 290
20:10:31.463701 IP v1404-wn-172-21-18-151.campus-dynamic.uwaterloo.ca.62314 > a216-191-211-200.deploy.akamaitechnologies.com.http: Flags [.], ack 291, win 8173, options [nop,nop,TS val 1334067033 ecr 1594959982], length 0
20:10:31.464703 IP a216-191-211-200.deploy.akamaitechnologies.com.http > v1404-wn-172-21-18-151.campus-dynamic.uwaterloo.ca.62323: Flags [S.], seq 749272289, ack 1369351004, win 14480, options [mss 1358,sackOK,TS val 1594959983 ecr 1334067027,nop,wscale 1], length 0
20:10:31.464753 IP v1404-wn-172-21-18-151.campus-dynamic.uwaterloo.ca.62323 > a216-191-211-200.deploy.akamaitechnologies.com.http: Flags [.], ack 1, win 8244, options [nop,nop,TS val 1334067034 ecr 1594959983], length 0
20:10:31.465793 IP v1404-wn-172-21-18-151.campus-dynamic.uwaterloo.ca.62323 > a216-191-211-200.deploy.akamaitechnologies.com.http: Flags [P.], seq 1:569, ack 1, win 8244, options [nop,nop,TS val 1334067035 ecr 1594959983], length 568
20:10:31.468108 IP v1404-wn-172-21-18-151.campus-dynamic.uwaterloo.ca.62313 > a216-191-211-200.deploy.akamaitechnologies.com.http: Flags [P.], seq 1086:1633, ack 3274, win 8192, options [nop,nop,TS val 1334067037 ecr 1594959981], length 547
20:10:31.468952 IP v1404-wn-172-21-18-151.campus-dynamic.uwaterloo.ca.62314 > a216-191-211-200.deploy.akamaitechnologies.com.http: Flags [P.], seq 542:1096, ack 291, win 8192, options [nop,nop,TS val 1334067037 ecr 1594959982], length 554
20:10:31.471039 IP v1404-wn-172-21-18-151.campus-dynamic.uwaterloo.ca.62324 > a216-191-211-200.deploy.akamaitechnologies.com.http: Flags [S], seq 1812034797, win 65535, options [mss 1460,nop,wscale 4,nop,nop,TS val 1334067039 ecr 0,sackOK,eol], length 0
20:10:31.474090 IP a216-191-211-200.deploy.akamaitechnologies.com.http > v1404-wn-172-21-18-151.campus-dynamic.uwaterloo.ca.62323: Flags [.], ack 569, win 7808, options [nop,nop,TS val 1594959992 ecr 1334067035], length 0
20:10:31.477097 IP a216-191-211-200.deploy.akamaitechnologies.com.http > v1404-wn-172-21-18-151.campus-dynamic.uwaterloo.ca.62323: Flags [P.], seq 1:291, ack 569, win 7808, options [nop,nop,TS val 1594959992 ecr 1334067035], length 290
20:10:31.477162 IP v1404-wn-172-21-18-151.campus-dynamic.uwaterloo.ca.62323 > a216-191-211-200.deploy.akamaitechnologies.com.http: Flags [.], ack 291, win 8226, options [nop,nop,TS val 1334067045 ecr 1594959992], length 0
20:10:31.477803 IP a216-191-211-200.deploy.akamaitechnologies.com.http > v1404-wn-172-21-18-151.campus-dynamic.uwaterloo.ca.62313: Flags [P.], seq 3274:3564, ack 1633, win 9446, options [nop,nop,TS val 1594959994 ecr 1334067037], length 290
20:10:31.477805 IP a216-191-211-200.deploy.akamaitechnologies.com.http > v1404-wn-172-21-18-151.campus-dynamic.uwaterloo.ca.62314: Flags [P.], seq 291:581, ack 1096, win 8872, options [nop,nop,TS val 1594959995 ecr 1334067037], length 290
20:10:31.477871 IP v1404-wn-172-21-18-151.campus-dynamic.uwaterloo.ca.62313 > a216-191-211-200.deploy.akamaitechnologies.com.http: Flags [.], ack 3564, win 8173, options [nop,nop,TS val 1334067045 ecr 1594959994], length 0
20:10:31.477871 IP v1404-wn-172-21-18-151.campus-dynamic.uwaterloo.ca.62314 > a216-191-211-200.deploy.akamaitechnologies.com.http: Flags [.], ack 581, win 8173, options [nop,nop,TS val 1334067045 ecr 1594959995], length 0
20:10:31.478509 IP a216-191-211-200.deploy.akamaitechnologies.com.http > v1404-wn-172-21-18-151.campus-dynamic.uwaterloo.ca.62324: Flags [S.], seq 4150003428, ack 1812034798, win 14480, options [mss 1358,sackOK,TS val 1594959997 ecr 1334067039,nop,wscale 1], length 0
20:10:31.478556 IP v1404-wn-172-21-18-151.campus-dynamic.uwaterloo.ca.62324 > a216-191-211-200.deploy.akamaitechnologies.com.http: Flags [.], ack 1, win 8244, options [nop,nop,TS val 1334067046 ecr 1594959997], length 0
20:10:31.480347 IP v1404-wn-172-21-18-151.campus-dynamic.uwaterloo.ca.62324 > a216-191-211-200.deploy.akamaitechnologies.com.http: Flags [P.], seq 1:548, ack 1, win 8244, options [nop,nop,TS val 1334067048 ecr 1594959997], length 547
20:10:31.482766 IP v1404-wn-172-21-18-151.campus-dynamic.uwaterloo.ca.62313 > a216-191-211-200.deploy.akamaitechnologies.com.http: Flags [P.], seq 1633:2182, ack 3564, win 8192, options [nop,nop,TS val 1334067050 ecr 1594959994], length 549
20:10:31.488469 IP 8.18.203.81.http > v1404-wn-172-21-18-151.campus-dynamic.uwaterloo.ca.62319: Flags [P.], seq 48:243, ack 176, win 9, options [nop,nop,TS val 2808446800 ecr 1334066976], length 195
20:10:31.488546 IP v1404-wn-172-21-18-151.campus-dynamic.uwaterloo.ca.62319 > 8.18.203.81.http: Flags [.], ack 243, win 8221, options [nop,nop,TS val 1334067055 ecr 2808446800], length 0
20:10:31.488622 IP 8.18.203.81.http > v1404-wn-172-21-18-151.campus-dynamic.uwaterloo.ca.62319: Flags [P.], seq 243:299, ack 176, win 9, options [nop,nop,TS val 2808446800 ecr 1334066976], length 56
20:10:31.488660 IP v1404-wn-172-21-18-151.campus-dynamic.uwaterloo.ca.62319 > 8.18.203.81.http: Flags [.], ack 299, win 8217, options [nop,nop,TS val 1334067055 ecr 2808446800], length 0
20:10:31.489075 IP a216-191-211-200.deploy.akamaitechnologies.com.http > v1404-wn-172-21-18-151.campus-dynamic.uwaterloo.ca.62324: Flags [.], ack 548, win 7787, options [nop,nop,TS val 1594960007 ecr 1334067048], length 0
20:10:31.489205 IP 8.18.203.81.http > v1404-wn-172-21-18-151.campus-dynamic.uwaterloo.ca.62319: Flags [P.], seq 299:494, ack 176, win 9, options [nop,nop,TS val 2808446800 ecr 1334066976], length 195
20:10:31.489252 IP v1404-wn-172-21-18-151.campus-dynamic.uwaterloo.ca.62319 > 8.18.203.81.http: Flags [.], ack 494, win 8205, options [nop,nop,TS val 1334067055 ecr 2808446800], length 0
20:10:31.490388 IP a216-191-211-200.deploy.akamaitechnologies.com.http > v1404-wn-172-21-18-151.campus-dynamic.uwaterloo.ca.62324: Flags [P.], seq 1:291, ack 548, win 7787, options [nop,nop,TS val 1594960008 ecr 1334067048], length 290
20:10:31.490446 IP v1404-wn-172-21-18-151.campus-dynamic.uwaterloo.ca.62324 > a216-191-211-200.deploy.akamaitechnologies.com.http: Flags [.], ack 291, win 8226, options [nop,nop,TS val 1334067056 ecr 1594960008], length 0
20:10:31.490603 IP a216-191-211-200.deploy.akamaitechnologies.com.http > v1404-wn-172-21-18-151.campus-dynamic.uwaterloo.ca.62313: Flags [P.], seq 3564:3854, ack 2182, win 10013, options [nop,nop,TS val 1594960008 ecr 1334067050], length 290
20:10:31.490644 IP v1404-wn-172-21-18-151.campus-dynamic.uwaterloo.ca.62313 > a216-191-211-200.deploy.akamaitechnologies.com.http: Flags [.], ack 3854, win 8173, options [nop,nop,TS val 1334067056 ecr 1594960008], length 0
20:10:31.497120 IP v1404-wn-172-21-18-151.campus-dynamic.uwaterloo.ca.62313 > a216-191-211-200.deploy.akamaitechnologies.com.http: Flags [P.], seq 2182:2728, ack 3854, win 8192, options [nop,nop,TS val 1334067063 ecr 1594960008], length 546
20:10:31.505426 IP a216-191-211-200.deploy.akamaitechnologies.com.http > v1404-wn-172-21-18-151.campus-dynamic.uwaterloo.ca.62313: Flags [P.], seq 3854:4144, ack 2728, win 10580, options [nop,nop,TS val 1594960023 ecr 1334067063], length 290
20:10:31.505500 IP v1404-wn-172-21-18-151.campus-dynamic.uwaterloo.ca.62313 > a216-191-211-200.deploy.akamaitechnologies.com.http: Flags [.], ack 4144, win 8173, options [nop,nop,TS val 1334067071 ecr 1594960023], length 0
20:10:31.521165 IP edge-star-ecmp-12-iad1.facebook.com.https > v1404-wn-172-21-18-151.campus-dynamic.uwaterloo.ca.62322: Flags [P.], seq 48:636, ack 1008, win 39, options [nop,nop,TS val 524535652 ecr 1334066985], length 588
20:10:31.521242 IP v1404-wn-172-21-18-151.campus-dynamic.uwaterloo.ca.62322 > edge-star-ecmp-12-iad1.facebook.com.https: Flags [.], ack 636, win 8155, options [nop,nop,TS val 1334067086 ecr 524535652], length 0
20:10:31.538959 IP v1404-wn-172-21-18-151.campus-dynamic.uwaterloo.ca.58998 > 8.18.203.81.http: Flags [F.], seq 1095147338, ack 1842535263, win 8236, options [nop,nop,TS val 1334067103 ecr 2807392538], length 0
20:10:31.583761 IP v1404-wn-172-21-18-151.campus-dynamic.uwaterloo.ca.62319 > 8.18.203.81.http: Flags [P.], seq 176:203, ack 494, win 8205, options [nop,nop,TS val 1334067147 ecr 2808446800], length 27
20:10:31.608147 IP v1404-wn-172-21-18-151.campus-dynamic.uwaterloo.ca.59022 > adns.uwaterloo.ca.domain: 32099+ AAAA? a749.dsw4.akamai.net. (38)
20:10:31.608323 IP v1404-wn-172-21-18-151.campus-dynamic.uwaterloo.ca.52324 > adns.uwaterloo.ca.domain: 25838+ AAAA? e566.dspe1.akamaiedge.net. (43)
20:10:31.610697 IP adns.uwaterloo.ca.domain > v1404-wn-172-21-18-151.campus-dynamic.uwaterloo.ca.59022: 32099 2/0/0 AAAA 2001:4c8:1004:2::d8bf:d3ca, AAAA 2001:4c8:1004:2::d8bf:d3d2 (94)
20:10:31.610808 IP adns.uwaterloo.ca.domain > v1404-wn-172-21-18-151.campus-dynamic.uwaterloo.ca.52324: 25838 3/0/0 AAAA 2600:1408:7:1:9400::236, AAAA 2600:1408:7:1:8d00::236, AAAA 2600:1408:7:1:9a00::236 (127)
20:10:31.667798 IP v1404-wn-172-21-18-151.campus-dynamic.uwaterloo.ca.62320 > a216-191-211-202.deploy.akamaitechnologies.com.http: Flags [P.], seq 448525097:448525589, ack 919818587, win 8192, options [nop,nop,TS val 1334067229 ecr 2063170011], length 492
20:10:31.670773 IP v1404-wn-172-21-18-151.campus-dynamic.uwaterloo.ca.62311 > www.rdio.com.http: Flags [P.], seq 1713400492:1713401763, ack 1824154314, win 8192, options [nop,nop,TS val 1334067231 ecr 3356788598], length 1271
20:10:31.671187 IP v1404-wn-172-21-18-151.campus-dynamic.uwaterloo.ca.62315 > www.rdio.com.http: Flags [P.], seq 3011610725:3011611997, ack 3360945253, win 8204, options [nop,nop,TS val 1334067231 ecr 3356788689], length 1272
20:10:31.671650 IP v1404-wn-172-21-18-151.campus-dynamic.uwaterloo.ca.62316 > www.rdio.com.http: Flags [P.], seq 2080419139:2080420414, ack 3881942345, win 8219, options [nop,nop,TS val 1334067231 ecr 3356788688], length 1275
20:10:31.671866 IP v1404-wn-172-21-18-151.campus-dynamic.uwaterloo.ca.62316 > www.rdio.com.http: Flags [P.], seq 1275:1918, ack 1, win 8219, options [nop,nop,TS val 1334067232 ecr 3356788688], length 643
20:10:31.672035 IP v1404-wn-172-21-18-151.campus-dynamic.uwaterloo.ca.62311 > www.rdio.com.http: Flags [P.], seq 1271:1691, ack 1, win 8192, options [nop,nop,TS val 1334067232 ecr 3356788598], length 420
20:10:31.672287 IP v1404-wn-172-21-18-151.campus-dynamic.uwaterloo.ca.62315 > www.rdio.com.http: Flags [P.], seq 1272:1663, ack 1, win 8204, options [nop,nop,TS val 1334067232 ecr 3356788689], length 391
20:10:31.675512 IP v1404-wn-172-21-18-151.campus-dynamic.uwaterloo.ca.62317 > www.rdio.com.http: Flags [P.], seq 1:1173, ack 1233, win 8192, options [nop,nop,TS val 1334067235 ecr 3356788865], length 1172
20:10:31.675699 IP a216-191-211-202.deploy.akamaitechnologies.com.http > v1404-wn-172-21-18-151.campus-dynamic.uwaterloo.ca.62320: Flags [.], seq 1:1347, ack 492, win 8312, options [nop,nop,TS val 2063170396 ecr 1334067229], length 1346
20:10:31.676242 IP a216-191-211-202.deploy.akamaitechnologies.com.http > v1404-wn-172-21-18-151.campus-dynamic.uwaterloo.ca.62320: Flags [.], seq 1347:2693, ack 492, win 8312, options [nop,nop,TS val 2063170396 ecr 1334067229], length 1346
20:10:31.676288 IP v1404-wn-172-21-18-151.campus-dynamic.uwaterloo.ca.62320 > a216-191-211-202.deploy.akamaitechnologies.com.http: Flags [.], ack 2693, win 8107, options [nop,nop,TS val 1334067235 ecr 2063170396], length 0
20:10:31.676844 IP v1404-wn-172-21-18-151.campus-dynamic.uwaterloo.ca.57181 > adns.uwaterloo.ca.domain: 33471+ A? cdn3.rd.io. (28)
20:10:31.676923 IP a216-191-211-202.deploy.akamaitechnologies.com.http > v1404-wn-172-21-18-151.campus-dynamic.uwaterloo.ca.62320: Flags [.], seq 2693:4039, ack 492, win 8312, options [nop,nop,TS val 2063170396 ecr 1334067229], length 1346
20:10:31.676932 IP v1404-wn-172-21-18-151.campus-dynamic.uwaterloo.ca.65190 > adns.uwaterloo.ca.domain: 46258+ AAAA? cdn3.rd.io. (28)
20:10:31.677010 IP a216-191-211-202.deploy.akamaitechnologies.com.http > v1404-wn-172-21-18-151.campus-dynamic.uwaterloo.ca.62320: Flags [.], seq 4039:5385, ack 492, win 8312, options [nop,nop,TS val 2063170396 ecr 1334067229], length 1346
20:10:31.677054 IP v1404-wn-172-21-18-151.campus-dynamic.uwaterloo.ca.62320 > a216-191-211-202.deploy.akamaitechnologies.com.http: Flags [.], ack 5385, win 8023, options [nop,nop,TS val 1334067236 ecr 2063170396], length 0
20:10:31.677118 IP a216-191-211-202.deploy.akamaitechnologies.com.http > v1404-wn-172-21-18-151.campus-dynamic.uwaterloo.ca.62320: Flags [.], seq 5385:6731, ack 492, win 8312, options [nop,nop,TS val 2063170396 ecr 1334067229], length 1346
20:10:31.677187 IP a216-191-211-202.deploy.akamaitechnologies.com.http > v1404-wn-172-21-18-151.campus-dynamic.uwaterloo.ca.62320: Flags [.], seq 6731:8077, ack 492, win 8312, options [nop,nop,TS val 2063170396 ecr 1334067229], length 1346
20:10:31.677272 IP a216-191-211-202.deploy.akamaitechnologies.com.http > v1404-wn-172-21-18-151.campus-dynamic.uwaterloo.ca.62320: Flags [.], seq 8077:9423, ack 492, win 8312, options [nop,nop,TS val 2063170396 ecr 1334067229], length 1346
20:10:31.677281 IP v1404-wn-172-21-18-151.campus-dynamic.uwaterloo.ca.62320 > a216-191-211-202.deploy.akamaitechnologies.com.http: Flags [.], ack 8077, win 7855, options [nop,nop,TS val 1334067236 ecr 2063170396], length 0
20:10:31.677327 IP a216-191-211-202.deploy.akamaitechnologies.com.http > v1404-wn-172-21-18-151.campus-dynamic.uwaterloo.ca.62320: Flags [P.], seq 9423:10258, ack 492, win 8312, options [nop,nop,TS val 2063170396 ecr 1334067229], length 835
20:10:31.677360 IP v1404-wn-172-21-18-151.campus-dynamic.uwaterloo.ca.62320 > a216-191-211-202.deploy.akamaitechnologies.com.http: Flags [.], ack 10258, win 7719, options [nop,nop,TS val 1334067236 ecr 2063170396], length 0
20:10:31.677360 IP v1404-wn-172-21-18-151.campus-dynamic.uwaterloo.ca.62325 > www.rdio.com.http: Flags [S], seq 467930610, win 65535, options [mss 1460,nop,wscale 4,nop,nop,TS val 1334067236 ecr 0,sackOK,eol], length 0
20:10:31.687028 IP adns.uwaterloo.ca.domain > v1404-wn-172-21-18-151.campus-dynamic.uwaterloo.ca.65190: 46258 2/1/0 CNAME cdn3.rdio.com.edgesuite.net., CNAME a1448.g.akamai.net. (159)
20:10:31.687133 IP adns.uwaterloo.ca.domain > v1404-wn-172-21-18-151.campus-dynamic.uwaterloo.ca.57181: 33471 4/0/0 CNAME cdn3.rdio.com.edgesuite.net., CNAME a1448.g.akamai.net., A 216.191.211.209, A 216.191.211.211 (130)
20:10:31.688177 IP v1404-wn-172-21-18-151.campus-dynamic.uwaterloo.ca.62326 > a216-191-211-209.deploy.akamaitechnologies.com.http: Flags [S], seq 3583589958, win 65535, options [mss 1460,nop,wscale 4,nop,nop,TS val 1334067247 ecr 0,sackOK,eol], length 0
20:10:31.695834 IP a216-191-211-209.deploy.akamaitechnologies.com.http > v1404-wn-172-21-18-151.campus-dynamic.uwaterloo.ca.62326: Flags [S.], seq 4117306416, ack 3583589959, win 14480, options [mss 1358,sackOK,TS val 1462547982 ecr 1334067247,nop,wscale 1], length 0
20:10:31.695902 IP v1404-wn-172-21-18-151.campus-dynamic.uwaterloo.ca.62326 > a216-191-211-209.deploy.akamaitechnologies.com.http: Flags [.], ack 1, win 8244, options [nop,nop,TS val 1334067254 ecr 1462547982], length 0
20:10:31.696794 IP v1404-wn-172-21-18-151.campus-dynamic.uwaterloo.ca.62326 > a216-191-211-209.deploy.akamaitechnologies.com.http: Flags [P.], seq 1:556, ack 1, win 8244, options [nop,nop,TS val 1334067254 ecr 1462547982], length 555
20:10:31.701646 IP 8.18.203.81.http > v1404-wn-172-21-18-151.campus-dynamic.uwaterloo.ca.62319: Flags [.], ack 203, win 9, options [nop,nop,TS val 2808446822 ecr 1334067147], length 0
20:10:31.701710 IP v1404-wn-172-21-18-151.campus-dynamic.uwaterloo.ca.62319 > 8.18.203.81.http: Flags [P.], seq 203:230, ack 494, win 8205, options [nop,nop,TS val 1334067259 ecr 2808446822], length 27
20:10:31.705022 IP a216-191-211-209.deploy.akamaitechnologies.com.http > v1404-wn-172-21-18-151.campus-dynamic.uwaterloo.ca.62326: Flags [.], ack 556, win 7795, options [nop,nop,TS val 1462547991 ecr 1334067254], length 0
20:10:31.708537 IP a216-191-211-209.deploy.akamaitechnologies.com.http > v1404-wn-172-21-18-151.campus-dynamic.uwaterloo.ca.62326: Flags [P.], seq 1:306, ack 556, win 7795, options [nop,nop,TS val 1462547995 ecr 1334067254], length 305
20:10:31.708612 IP v1404-wn-172-21-18-151.campus-dynamic.uwaterloo.ca.62326 > a216-191-211-209.deploy.akamaitechnologies.com.http: Flags [.], ack 306, win 8225, options [nop,nop,TS val 1334067265 ecr 1462547995], length 0
20:10:31.734258 IP jabber-03-01-snc6.tfbnw.net.jabber-client > v1404-wn-172-21-18-151.campus-dynamic.uwaterloo.ca.61663: Flags [P.], seq 2976352859:2976353141, ack 550586692, win 48, options [nop,nop,TS val 27826573 ecr 1334053617], length 282
20:10:31.734331 IP v1404-wn-172-21-18-151.campus-dynamic.uwaterloo.ca.61663 > jabber-03-01-snc6.tfbnw.net.jabber-client: Flags [.], ack 282, win 8174, options [nop,nop,TS val 1334067290 ecr 27826573], length 0
20:10:31.736186 IP jabber-02-01-snc7.tfbnw.net.jabber-client > v1404-wn-172-21-18-151.campus-dynamic.uwaterloo.ca.58997: Flags [P.], seq 3889833720:3889834002, ack 505812884, win 43, options [nop,nop,TS val 33199147 ecr 1334053701], length 282
20:10:31.736262 IP v1404-wn-172-21-18-151.campus-dynamic.uwaterloo.ca.58997 > jabber-02-01-snc7.tfbnw.net.jabber-client: Flags [.], ack 282, win 8174, options [nop,nop,TS val 1334067291 ecr 33199147], length 0
20:10:31.736842 IP v1404-wn-172-21-18-151.campus-dynamic.uwaterloo.ca.58997 > jabber-02-01-snc7.tfbnw.net.jabber-client: Flags [P.], seq 1:166, ack 282, win 8192, options [nop,nop,TS val 1334067291 ecr 33199147], length 165
20:10:31.757177 IP www.rdio.com.http > v1404-wn-172-21-18-151.campus-dynamic.uwaterloo.ca.62311: Flags [.], ack 1271, win 12239, options [nop,nop,TS val 3356789338 ecr 1334067231], length 0
20:10:31.758199 IP www.rdio.com.http > v1404-wn-172-21-18-151.campus-dynamic.uwaterloo.ca.62311: Flags [.], ack 1691, win 12659, options [nop,nop,TS val 3356789339 ecr 1334067232], length 0
20:10:31.758618 IP www.rdio.com.http > v1404-wn-172-21-18-151.campus-dynamic.uwaterloo.ca.62316: Flags [.], ack 1275, win 6800, options [nop,nop,TS val 3356789338 ecr 1334067231], length 0
20:10:31.758790 IP www.rdio.com.http > v1404-wn-172-21-18-151.campus-dynamic.uwaterloo.ca.62316: Flags [.], ack 1918, win 7443, options [nop,nop,TS val 3356789339 ecr 1334067232], length 0
20:10:31.758792 IP www.rdio.com.http > v1404-wn-172-21-18-151.campus-dynamic.uwaterloo.ca.62315: Flags [.], ack 1272, win 6762, options [nop,nop,TS val 3356789338 ecr 1334067231], length 0
20:10:31.759446 IP www.rdio.com.http > v1404-wn-172-21-18-151.campus-dynamic.uwaterloo.ca.62315: Flags [.], ack 1663, win 7153, options [nop,nop,TS val 3356789340 ecr 1334067232], length 0
20:10:31.762785 IP www.rdio.com.http > v1404-wn-172-21-18-151.campus-dynamic.uwaterloo.ca.62317: Flags [.], ack 1173, win 6691, options [nop,nop,TS val 3356789343 ecr 1334067235], length 0
20:10:31.763171 IP www.rdio.com.http > v1404-wn-172-21-18-151.campus-dynamic.uwaterloo.ca.62317: Flags [P.], seq 1233:1602, ack 1173, win 6691, options [nop,nop,TS val 3356789343 ecr 1334067235], length 369
20:10:31.763230 IP v1404-wn-172-21-18-151.campus-dynamic.uwaterloo.ca.62317 > www.rdio.com.http: Flags [.], ack 1602, win 8168, options [nop,nop,TS val 1334067316 ecr 3356789343], length 0
20:10:31.764324 IP www.rdio.com.http > v1404-wn-172-21-18-151.campus-dynamic.uwaterloo.ca.62325: Flags [S.], seq 4173669295, ack 467930611, win 4074, options [mss 1358,nop,wscale 0,nop,nop,TS val 3356789345 ecr 1334067236,sackOK,eol], length 0
20:10:31.764377 IP v1404-wn-172-21-18-151.campus-dynamic.uwaterloo.ca.62325 > www.rdio.com.http: Flags [.], ack 1, win 8244, options [nop,nop,TS val 1334067317 ecr 3356789345], length 0
20:10:31.765263 IP v1404-wn-172-21-18-151.campus-dynamic.uwaterloo.ca.62325 > www.rdio.com.http: Flags [P.], seq 1:1263, ack 1, win 8244, options [nop,nop,TS val 1334067317 ecr 3356789345], length 1262
20:10:31.765308 IP v1404-wn-172-21-18-151.campus-dynamic.uwaterloo.ca.62325 > www.rdio.com.http: Flags [P.], seq 1263:1640, ack 1, win 8244, options [nop,nop,TS val 1334067317 ecr 3356789345], length 377
20:10:31.787585 IP 8.18.203.81.http > v1404-wn-172-21-18-151.campus-dynamic.uwaterloo.ca.62319: Flags [.], ack 230, win 9, options [nop,nop,TS val 2808446830 ecr 1334067259], length 0
20:10:31.816107 IP jabber-02-01-snc7.tfbnw.net.jabber-client > v1404-wn-172-21-18-151.campus-dynamic.uwaterloo.ca.58997: Flags [P.], seq 282:644, ack 166, win 43, options [nop,nop,TS val 33199227 ecr 1334067291], length 362
20:10:31.816191 IP v1404-wn-172-21-18-151.campus-dynamic.uwaterloo.ca.58997 > jabber-02-01-snc7.tfbnw.net.jabber-client: Flags [.], ack 644, win 8169, options [nop,nop,TS val 1334067368 ecr 33199227], length 0
20:10:31.821988 IP www.rdio.com.http > v1404-wn-172-21-18-151.campus-dynamic.uwaterloo.ca.62315: Flags [.], seq 1:1347, ack 1663, win 7153, options [nop,nop,TS val 3356789402 ecr 1334067232], length 1346
20:10:31.822097 IP www.rdio.com.http > v1404-wn-172-21-18-151.campus-dynamic.uwaterloo.ca.62315: Flags [P.], seq 1347:1477, ack 1663, win 7153, options [nop,nop,TS val 3356789402 ecr 1334067232], length 130
20:10:31.822150 IP v1404-wn-172-21-18-151.campus-dynamic.uwaterloo.ca.62315 > www.rdio.com.http: Flags [.], ack 1477, win 8111, options [nop,nop,TS val 1334067373 ecr 3356789402], length 0
20:10:31.822605 IP www.rdio.com.http > v1404-wn-172-21-18-151.campus-dynamic.uwaterloo.ca.62315: Flags [P.], seq 1477:1938, ack 1663, win 7153, options [nop,nop,TS val 3356789402 ecr 1334067232], length 461
20:10:31.822651 IP v1404-wn-172-21-18-151.campus-dynamic.uwaterloo.ca.62315 > www.rdio.com.http: Flags [.], ack 1938, win 8163, options [nop,nop,TS val 1334067373 ecr 3356789402], length 0
20:10:31.828234 IP v1404-wn-172-21-18-151.campus-dynamic.uwaterloo.ca.62319 > 8.18.203.81.http: Flags [P.], seq 230:256, ack 494, win 8205, options [nop,nop,TS val 1334067379 ecr 2808446830], length 26
20:10:31.838243 IP www.rdio.com.http > v1404-wn-172-21-18-151.campus-dynamic.uwaterloo.ca.62316: Flags [.], seq 1:1347, ack 1918, win 7443, options [nop,nop,TS val 3356789418 ecr 1334067232], length 1346
20:10:31.838414 IP www.rdio.com.http > v1404-wn-172-21-18-151.campus-dynamic.uwaterloo.ca.62316: Flags [P.], seq 1347:1465, ack 1918, win 7443, options [nop,nop,TS val 3356789418 ecr 1334067232], length 118
20:10:31.838471 IP v1404-wn-172-21-18-151.campus-dynamic.uwaterloo.ca.62316 > www.rdio.com.http: Flags [.], ack 1465, win 8127, options [nop,nop,TS val 1334067388 ecr 3356789418], length 0
20:10:31.839031 IP www.rdio.com.http > v1404-wn-172-21-18-151.campus-dynamic.uwaterloo.ca.62316: Flags [P.], seq 1465:1471, ack 1918, win 7443, options [nop,nop,TS val 3356789418 ecr 1334067232], length 6
20:10:31.839086 IP v1404-wn-172-21-18-151.campus-dynamic.uwaterloo.ca.62316 > www.rdio.com.http: Flags [.], ack 1471, win 8191, options [nop,nop,TS val 1334067388 ecr 3356789418], length 0
20:10:31.847858 IP www.rdio.com.http > v1404-wn-172-21-18-151.campus-dynamic.uwaterloo.ca.62311: Flags [P.], seq 1:1233, ack 1691, win 12659, options [nop,nop,TS val 3356789428 ecr 1334067232], length 1232
20:10:31.847942 IP v1404-wn-172-21-18-151.campus-dynamic.uwaterloo.ca.62311 > www.rdio.com.http: Flags [.], ack 1233, win 8115, options [nop,nop,TS val 1334067395 ecr 3356789428], length 0
20:10:31.853079 IP www.rdio.com.http > v1404-wn-172-21-18-151.campus-dynamic.uwaterloo.ca.62325: Flags [.], ack 1263, win 5336, options [nop,nop,TS val 3356789433 ecr 1334067317], length 0
20:10:31.853215 IP www.rdio.com.http > v1404-wn-172-21-18-151.campus-dynamic.uwaterloo.ca.62325: Flags [.], ack 1640, win 5713, options [nop,nop,TS val 3356789433 ecr 1334067317], length 0
20:10:31.888754 IP www.rdio.com.http > v1404-wn-172-21-18-151.campus-dynamic.uwaterloo.ca.62325: Flags [P.], seq 1:403, ack 1640, win 5713, options [nop,nop,TS val 3356789469 ecr 1334067317], length 402
20:10:31.888835 IP v1404-wn-172-21-18-151.campus-dynamic.uwaterloo.ca.62325 > www.rdio.com.http: Flags [.], ack 403, win 8219, options [nop,nop,TS val 1334067423 ecr 3356789469], length 0
20:10:31.914254 IP 8.18.203.81.http > v1404-wn-172-21-18-151.campus-dynamic.uwaterloo.ca.62319: Flags [.], ack 256, win 9, options [nop,nop,TS val 2808446843 ecr 1334067379], length 0
20:10:31.914328 IP v1404-wn-172-21-18-151.campus-dynamic.uwaterloo.ca.62319 > 8.18.203.81.http: Flags [P.], seq 256:1272, ack 494, win 8205, options [nop,nop,TS val 1334067441 ecr 2808446843], length 1016
20:10:32.006209 IP 8.18.203.81.http > v1404-wn-172-21-18-151.campus-dynamic.uwaterloo.ca.62319: Flags [P.], seq 494:550, ack 1272, win 9, options [nop,nop,TS val 2808446852 ecr 1334067441], length 56
20:10:32.006291 IP v1404-wn-172-21-18-151.campus-dynamic.uwaterloo.ca.62319 > 8.18.203.81.http: Flags [P.], seq 1272:1814, ack 550, win 8201, options [nop,nop,TS val 1334067528 ecr 2808446852], length 542
20:10:32.008256 IP 8.18.203.81.http > v1404-wn-172-21-18-151.campus-dynamic.uwaterloo.ca.62319: Flags [P.], seq 550:660, ack 1272, win 9, options [nop,nop,TS val 2808446852 ecr 1334067441], length 110
20:10:32.008320 IP v1404-wn-172-21-18-151.campus-dynamic.uwaterloo.ca.62319 > 8.18.203.81.http: Flags [.], ack 660, win 8194, options [nop,nop,TS val 1334067530 ecr 2808446852], length 0
20:10:32.008412 IP 8.18.203.81.http > v1404-wn-172-21-18-151.campus-dynamic.uwaterloo.ca.62319: Flags [P.], seq 660:857, ack 1272, win 9, options [nop,nop,TS val 2808446852 ecr 1334067441], length 197
20:10:32.008445 IP v1404-wn-172-21-18-151.campus-dynamic.uwaterloo.ca.62319 > 8.18.203.81.http: Flags [.], ack 857, win 8182, options [nop,nop,TS val 1334067530 ecr 2808446852], length 0
20:10:32.009188 IP 8.18.203.81.http > v1404-wn-172-21-18-151.campus-dynamic.uwaterloo.ca.62319: Flags [P.], seq 857:1052, ack 1272, win 9, options [nop,nop,TS val 2808446852 ecr 1334067441], length 195
20:10:32.009223 IP v1404-wn-172-21-18-151.campus-dynamic.uwaterloo.ca.62319 > 8.18.203.81.http: Flags [.], ack 1052, win 8170, options [nop,nop,TS val 1334067530 ecr 2808446852], length 0
20:10:32.009678 IP 8.18.203.81.http > v1404-wn-172-21-18-151.campus-dynamic.uwaterloo.ca.62319: Flags [P.], seq 1052:1110, ack 1272, win 9, options [nop,nop,TS val 2808446852 ecr 1334067441], length 58
20:10:32.009712 IP v1404-wn-172-21-18-151.campus-dynamic.uwaterloo.ca.62319 > 8.18.203.81.http: Flags [.], ack 1110, win 8166, options [nop,nop,TS val 1334067531 ecr 2808446852], length 0
20:10:32.022858 IP v1404-wn-172-21-18-151.campus-dynamic.uwaterloo.ca.63272 > adns.uwaterloo.ca.domain: 10283+ AAAA? a1448.g.akamai.net. (36)
20:10:32.025052 IP adns.uwaterloo.ca.domain > v1404-wn-172-21-18-151.campus-dynamic.uwaterloo.ca.63272: 10283 0/1/0 (97)
20:10:32.095437 IP 8.18.203.81.http > v1404-wn-172-21-18-151.campus-dynamic.uwaterloo.ca.62319: Flags [.], seq 1110:2456, ack 1814, win 9, options [nop,nop,TS val 2808446861 ecr 1334067528], length 1346
20:10:32.095554 IP 8.18.203.81.http > v1404-wn-172-21-18-151.campus-dynamic.uwaterloo.ca.62319: Flags [P.], seq 2456:2537, ack 1814, win 9, options [nop,nop,TS val 2808446861 ecr 1334067528], length 81
20:10:32.095567 IP v1404-wn-172-21-18-151.campus-dynamic.uwaterloo.ca.62319 > 8.18.203.81.http: Flags [P.], seq 1814:1916, ack 2456, win 8107, options [nop,nop,TS val 1334067613 ecr 2808446861], length 102
20:10:32.095601 IP v1404-wn-172-21-18-151.campus-dynamic.uwaterloo.ca.62319 > 8.18.203.81.http: Flags [.], ack 2537, win 8102, options [nop,nop,TS val 1334067613 ecr 2808446861], length 0
20:10:32.135780 IP v1404-wn-172-21-18-151.campus-dynamic.uwaterloo.ca.62313 > a216-191-211-200.deploy.akamaitechnologies.com.http: Flags [P.], seq 2728:3194, ack 4144, win 8192, options [nop,nop,TS val 1334067648 ecr 1594960023], length 466
20:10:32.144178 IP a216-191-211-200.deploy.akamaitechnologies.com.http > v1404-wn-172-21-18-151.campus-dynamic.uwaterloo.ca.62313: Flags [.], seq 4144:5490, ack 3194, win 11147, options [nop,nop,TS val 1594960661 ecr 1334067648], length 1346
20:10:32.144478 IP a216-191-211-200.deploy.akamaitechnologies.com.http > v1404-wn-172-21-18-151.campus-dynamic.uwaterloo.ca.62313: Flags [.], seq 5490:6836, ack 3194, win 11147, options [nop,nop,TS val 1594960661 ecr 1334067648], length 1346
20:10:32.144540 IP v1404-wn-172-21-18-151.campus-dynamic.uwaterloo.ca.62313 > a216-191-211-200.deploy.akamaitechnologies.com.http: Flags [.], ack 6836, win 8107, options [nop,nop,TS val 1334067656 ecr 1594960661], length 0
20:10:32.144720 IP a216-191-211-200.deploy.akamaitechnologies.com.http > v1404-wn-172-21-18-151.campus-dynamic.uwaterloo.ca.62313: Flags [.], seq 6836:8182, ack 3194, win 11147, options [nop,nop,TS val 1594960661 ecr 1334067648], length 1346
20:10:32.144802 IP a216-191-211-200.deploy.akamaitechnologies.com.http > v1404-wn-172-21-18-151.campus-dynamic.uwaterloo.ca.62313: Flags [.], seq 8182:9528, ack 3194, win 11147, options [nop,nop,TS val 1594960661 ecr 1334067648], length 1346
20:10:32.144829 IP v1404-wn-172-21-18-151.campus-dynamic.uwaterloo.ca.62313 > a216-191-211-200.deploy.akamaitechnologies.com.http: Flags [.], ack 8182, win 8192, options [nop,nop,TS val 1334067656 ecr 1594960661], length 0
20:10:32.145306 IP a216-191-211-200.deploy.akamaitechnologies.com.http > v1404-wn-172-21-18-151.campus-dynamic.uwaterloo.ca.62313: Flags [.], seq 9528:10874, ack 3194, win 11147, options [nop,nop,TS val 1594960661 ecr 1334067648], length 1346
